Author,Comment,Date
ddropthesoap,No more diamond hands?,2024-02-27T05:42:04.239Z
kk7766,"ALGOS SET TO PUMP TILL THE ELECTION.
  
    $NVDA $2000
  
    $SMCI $9000
  
    !!!!!!!!",2024-02-21T19:50:15.535Z
drunktothemoon,DONT WORRY HOLD THE LINE GUH,2024-02-21T17:15:32.778Z
Accomplished_End7585,This Market flat as Greta's tits and its annoying,2024-02-21T15:01:11.765Z
Very_Regarded,Don’t V panw pls,2024-02-21T13:38:47.078Z
Powerful-Call5148,Whats the play today you regards? Date and strike please.,2024-02-21T13:35:24.146Z
Miserable_Message330,"Home Depot missed because they're not selling AI lumber to make AI server racks like SMCI
  
    Classic mistake home depot",2024-02-20T11:56:54.806Z
False_Profit_of_WSB,"If you say ""OMG X RIPPED!!"" or ""OMG X CRASHIN HARD LOL"" and x hasn't even moved a full percent or two, you should be banned for a week.",2024-02-20T12:42:17.200Z
johnlonger333,"I’m not gonna lie here I bought about 50 shares of SMCI on Friday at $1030 thinking I would take a quick profit because it’s been only going up for about a month. But nope, went straight down right after I bought it. It’s been the stupidest trade I’ve made in 5 years.",2024-02-20T13:31:33.342Z
BoredPoopless,Congratulations on being down 20% on shares in less than one day of the market being open.,2024-02-20T13:33:05.646Z
Whybother456,Good morning fellow SMCI baghodlers from 1000,2024-02-20T11:03:42.177Z
freshjohnson69,"S- Super
  
    M- Mad
  
    C- Cucked
  
    I- Incels",2024-02-20T11:21:55.446Z
KeenStudent,"Regards holding SMCI $1,000 calls, can i do an interview with you guys? it's for an autism study/project",2024-02-20T11:38:04.948Z
free_lions,I feel like SMCI could end the day at $1K or $600,2024-02-20T12:22:41.928Z
Theeliteshitposter,"Might start my own AI data server rack company called Super Macro Computer…
  
    Would you guys invest?",2024-02-20T13:02:26.268Z
__Shadowman__,The second plane has hit the qqq,2024-02-20T15:11:18.738Z
jnuAK907,I waited 3 days for this???,2024-02-20T16:31:02.771Z
trumpdiego,"CNBC Friday: Honestly stocks are cheap.CNBC right now: This downturn makes sense, and frankly it's overdue.CNBC tomorrow: Anyone who didn't see that stocks were cheap yesterday had it coming to them, obviously NVIDIA is just getting started.",2024-02-20T17:19:12.489Z
Wheelsondalabus,"Sir, a 2nd plane has just hit SPY",2024-02-20T20:33:58.450Z
SuspiciousStuff3,"This is one of those situations where I'm gonna buy the dip and it keeps on dipping, then average down then average down some more then panic sell for a loss at the bottom",2024-02-20T11:47:49.324Z
yourpalbucket,6 months sober today. Feels incredible. If only my apple calls made me feel as good,2024-02-20T15:13:34.986Z
[deleted],Comment deleted by user,2024-02-20T15:27:11.151Z
TemporaryMission9809,Convinced that no one knows what the fuck they’re talking about,2024-02-20T16:42:47.159Z
AirborneMarburg,I’m gonna go to the other side of Reddit and look at boobies to make me feel better.,2024-02-20T18:33:12.046Z
ItradebetterthanU,You know SMCI $1100 call holders are looking at the chart after seeing it up $56 last night. Just saying fuc fuc fuc fuk fuk fuk !!,2024-02-20T11:20:54.012Z
Fox_n_Roll,they say scared money doesn't make money but buying calls now just doesn't feel good at all,2024-02-20T11:35:34.913Z
Codyskank,Beautiful sunrise today. Gonna make at least 5 bucks,2024-02-20T12:26:36.310Z
Sweaty_War7347,You guys ready to lose money and be sad,2024-02-20T12:44:43.112Z
jerseyhound,Not touching shit until Thursday.,2024-02-20T13:09:26.989Z
Futileuwu,At least smci going down pre market before anyone got tricked into buying it this morning.,2024-02-20T14:24:32.039Z
Mortal1ty1337,"how the FUCK can my portfolio take 3 months to recover, and then 1 day to lose it all.",2024-02-20T15:42:36.438Z
DamnMyAPGoinCrazy,r/wallstreetbets has turned into SMCI bagholders anonymous,2024-02-20T17:12:37.103Z
22strokestreet,why is my stock with a market cap of 1 billion and 2mm in annual revenue going down,2024-02-20T17:47:22.473Z
EconomyNeat175,how many of yall lost money so far?,2024-02-20T18:54:19.918Z
Red_or_Black1,I'm tired of all these SMCI pumpers. Just dump this junk.,2024-02-20T20:50:05.092Z
__Shadowman__,My calls are going to be -97% when the market opens according to options profit calculator,2024-02-20T14:15:01.098Z
optionsGPT,1 hour and 25 minutes until I feel emotion again,2024-02-20T13:05:18.460Z
Its_Stir_Friday,SMCI to 700 today?,2024-02-20T14:00:29.727Z
[deleted],Comment deleted by user,2024-02-20T14:28:00.471Z
ProfessorCommenter,Me🤝Buying calls at the literal top to the exact cent,2024-02-20T14:57:50.911Z
Aggravating_Fig6288,Bulls getting nuked from orbit,2024-02-20T15:36:30.527Z
Jabbermouth,"I was down almost $4000 today on 0DTE calls
  
    Did I sell?
  
    Absolutely fucking not.
  
    I bought even more and made $3000",2024-02-20T16:18:59.881Z
Starkfault,“Oh your son’s a dentist? Mine’s a Reddit Mod”,2024-02-20T16:22:46.870Z
__Shadowman__,Have we tried turning the economy off and on yet,2024-02-20T17:23:44.350Z
CasualPersistence,"Jensen Huang tomorrow: ""To help augment sales of our most popular GPU chips, we're now offering our own blend of microwavable popcorn, which can be found at most popular retailers. The first 10,000 boxes purchased will also receive a commemorative NFT featuring me wearing my signature leather jacket.""",2024-02-20T18:49:13.658Z
trumpdiego,"CNBC Friday: Honestly stocks are cheap.CNBC right now: This downturn makes sense, and frankly it's overdue.CNBC this afternoon: Anyone who didn't see that stocks were cheap earlier this morning had it coming to them, obviously NVIDIA and AI are just getting started.",2024-02-20T19:01:54.243Z
BigBoiBenisBlueBalls,Do crackheads ever say “I’m too broke to tweak tonight?”No. They get up and make it happen,2024-02-20T19:05:54.867Z
Namesyaboi,Lost 28k in a week,2024-02-20T19:52:21.892Z
ZippTree,Good mornin' frens ☕️☕️,2024-02-20T11:13:05.999Z
8thSt,All those fancy schmacy subs like r/economics and r/stocks that immediately remove your comment if it’s just emojis or two words.  It’s just sad how they limit the discourse.  🤦‍♂️,2024-02-20T11:25:24.918Z
billybeesesteak,Just woke up from a 4 day long coma. How are my favorite stocks (NVDA and SMCI) doing?,2024-02-20T14:06:48.147Z
Jabbermouth,Just buy the dip doesn’t work when it’s a 7 layer dip,2024-02-20T15:11:18.645Z
zephyrs85,"Mom can you pick me up, i don't like the markets anymore",2024-02-20T15:16:23.693Z
RichGuyz,sold smci at 1073,2024-02-20T11:33:16.258Z
ironexia,I’m just happy the market is open,2024-02-20T13:12:29.484Z
CMac681,"I can’t call my grandad in the mornings. Way too much old man energy builds up in him when he sleeps.
  
    Just got a nice 30 min lecture on the “Pussification of America”
  
    He wasn’t wrong about anything it’s just too early for this shit",2024-02-20T13:20:13.610Z
KilltheK04,God damn this week is an AMAZING week to lose a ton of money,2024-02-20T14:07:47.726Z
Samjabr,"Dear Allah,
  
    Please make NVDA go up.
  
    Sam Jabr
  
    PS. Don't forget about my virgins.",2024-02-20T14:10:48.863Z
fart_huffer-,"If NVDA misses, we will officially go into a recession. No definition change will save us",2024-02-20T14:16:33.954Z
TequilaTrader,You guys sound like we’re down 5% and it’s only 0.66%,2024-02-20T15:20:44.810Z
DenyDaRidas,"When 70% of the sub bought calls on NVIDIA and SMCI, they’re both down bigly",2024-02-20T15:22:00.281Z
sh1tler,GENERATIONAL BAGHOLDING OPPORTUNITY ON SMCI,2024-02-20T15:21:46.603Z
[deleted],Comment deleted by user,2024-02-20T16:49:22.838Z
CJ-2QT,"I don't want to buy NVDA calls now, I'll wait till its at 800",2024-02-20T19:09:42.477Z
[deleted],Comment deleted by user,2024-02-20T23:24:58.174Z
billybeesesteak,I’m not usually a “buy puts at open kinda guy” but it may be a buy puts at open kinda day,2024-02-20T12:01:11.276Z
Ayy_Whats_Poppin,like this comment if ur fucked,2024-02-20T12:52:09.845Z
Hl_IM_MR_MEESEEKS,,2024-02-20T14:04:21.558Z
skin_flute_player,SMCI = So Many Cucked Investors,2024-02-20T15:34:22.282Z
CaptainHoey,"Hey guys, CEO of money here. Time to panic.",2024-02-20T15:57:39.932Z
vteclover302,"Damn this hurts lmao, down 4k on Smci calls 🤡🤡",2024-02-20T16:29:52.271Z
Forward_Observation,Anyone else get real sad and depressed when you’re losing. Like I don’t Wana do anything today,2024-02-20T17:08:28.578Z
type_error,"NVDA down prior to earnings can only mean one thing…
  
    It’s down prior to earnings",2024-02-20T17:32:15.171Z
FearlessTrader,"Those who bought calls an hour ago, thinking “the V starts now”, show yourselves 🔫",2024-02-20T17:41:26.089Z
Dielawnnx5,Some of you have a tractor and it mows.,2024-02-20T20:02:56.633Z
Dividien,If smci goes green im done trading,2024-02-20T20:25:29.451Z
optionsGPT,"Multi generational bag holders being created in 2024. Your great grandchildren will inherit your SMCI at 1,000 a share",2024-02-20T11:07:47.325Z
DetroitRedWings79,Anyone ‘member last night when the regards on Robinhood were gobbling up SMCI shares amongst each other? There was like maybe 15k of total volume in about 30 minutes and the stock ripped up to $860?,2024-02-20T11:10:35.604Z
Fantastic_Barney,"shakes doors frantically

    OPEN IT!
  👁👄👁",2024-02-20T11:34:43.351Z
OSRSkarma,"SMCI week is upon us
  
    About to lose half the sub",2024-02-20T12:30:30.186Z
free_lions,All option sellers on SMCI are about to get destroyed,2024-02-20T12:48:58.599Z
Round-Lavishness-636,Got a date with Maria the thicc Latina tonight boys,2024-02-20T13:18:01.114Z
mysuruhuduga,Hope that capital one deal gets blocked,2024-02-20T13:51:45.125Z
amoistsock,"Some millionaires will be made today
  
    Some negative millionaires will also be made today",2024-02-20T14:23:41.686Z
alfapredator,SMCI options are unaffordable to the average American and that is not okay.As your senator I will bring down SMCI prices so that even a burger flipper can gamble on one of the greatest bubbles of all time.,2024-02-20T15:20:15.630Z
__Slick_iG_,Dump this fucking ponzi on its head,2024-02-20T15:25:39.143Z
[deleted],Comment deleted by user,2024-02-20T15:32:24.782Z
stocksandbonds123,cant wait to see all the loss porn after the market closes today,2024-02-20T15:40:07.526Z
TheSalmoony,SMCI alone is responsible for my portfolio losing 80%,2024-02-20T16:11:26.723Z
TacticalTackleBox,"Nobody wants to wear those stupid Apple Goggles, OK? No one driving a Diesel Truck wants to drive a fucking Cybertruck, seriously. No one wants AI telling them what to watch or eat either.
  
    This bubble is stupid as hell. Get a fucking grip regards.",2024-02-20T16:50:15.555Z
ConcentrateOdd8190,If Nvda falls America falls,2024-02-20T17:58:26.231Z
M_from_Vegas,Why SMCI still above 700,2024-02-20T18:08:32.958Z
[deleted],Comment deleted by user,2024-02-20T20:52:15.829Z
Antique_Giraffe_3728,I LOST BAD AND I WANNA REVENGE TRADE,2024-02-20T11:19:33.051Z
yawolac,Money market is paying 5.28% without having to worry about my sphincter.,2024-02-20T11:23:13.476Z
Cclown69,"To anyone getting shafted by day trade restrictions, go cash account so you don't get stuck in shit positions overnight",2024-02-20T11:24:57.945Z
Very_Regarded,Surely SMCI doesn’t get sold off on this pump again,2024-02-20T12:13:45.249Z
thealexnoles,Who’s being a 🌈🐻 this week?,2024-02-20T12:36:09.483Z
civillyRange,"SMCI down 20% from highs
  
    Bounces 2%, bols go wild",2024-02-20T12:39:14.419Z
Theeliteshitposter,@Mods we need to get an SBF in jail emoji,2024-02-20T12:53:43.304Z
Hl_IM_MR_MEESEEKS,,2024-02-20T12:54:43.550Z
PoorJudgement_101,NVDA 1200 is the  value. Stock will rise up by 17% after earnings,2024-02-20T13:51:02.542Z
DueHousing,Semis shitting harder than a Victorian kid with Cholera,2024-02-20T15:16:02.136Z
Sparky_SE81,You know 95% of wsb is absolute ruins right now after loading up on NVDA and SMCI weekly calls last Friday,2024-02-20T15:56:10.645Z
ProphetPenguin,I hate day trading restrictions,2024-02-20T16:16:06.509Z
Bapu_,"NVDA earnings leaked
  
    Rumor is that Jensen Huang bought a new jacket",2024-02-20T16:22:05.108Z
AlmightyCheesusCrust,Imagine buying SMCI at $1000,2024-02-20T16:54:46.236Z
SpermBanking,I don’t want to play this game anymore,2024-02-20T17:22:11.824Z
DamnMyAPGoinCrazy,SMCI traders becoming “long term investors” in a matter of hours,2024-02-20T17:23:51.750Z
Legitimate-Owl-7137,Spy’s about to rocket or shit find out on the next episode of useless ass market!!,2024-02-20T18:10:34.656Z
NVDAismygod,Today is so boring. All the fun happened in the first hour,2024-02-20T18:18:24.276Z
theknowndudereturns,Rotation out of tech back into tech,2024-02-20T18:41:38.562Z
btoned,"SMCI either 500 or 1500 by EOW.
  
    🤣🤣🤣",2024-02-20T19:00:27.371Z
PFC321,I am getting absolutely fisted today,2024-02-20T19:25:34.830Z
OakyTheBear,"Rather than take responsibility for what is definitely just gambling, I will choose to be upset about what is obviously a rigged system designed to target me specifically and take my money.",2024-02-20T20:53:44.662Z
RjBloxks,Lost 12k today definitely revenge trading tomorrow,2024-02-20T21:00:10.004Z
nitroweb87,"market down -0.5%, bears having orgies",2024-02-20T12:39:44.241Z
Coogiez,This week kinda scary ngl,2024-02-20T12:47:58.594Z
drunktothemoon,"I’m not telling u, I’m guaranteeing u, NVDA will crush earnings. But that don’t mean ur calls r gonna moon.",2024-02-20T13:01:55.746Z
Quiet-Tradition-1723,Tell me why I shouldn’t go all in on SMCI puts at open,2024-02-20T13:06:32.227Z
optionsGPT,Nobodies talking about ARM anymore which means it’s time for puts,2024-02-20T13:13:35.850Z
free_lions,I’m gonna start my own company called super mega cock inhalers,2024-02-20T13:15:43.110Z
NVDAismygod,I’m so nervous for market open,2024-02-20T14:19:33.071Z
VisualMod,"Ban Bet Won
u/Naive_Classic2746 made a bet that SMCI would go to 750.0 within 2 weeks when it was 997.77 and it did, congrats autist.
  
    Their record is now 1 wins and 6 losses
  
Join WSB Discord",2024-02-20T14:39:14.367Z
Ambitious-Sky5947,NVDA V TIME,2024-02-20T15:06:29.240Z
NVDABULL,"Just remember, they are dumping it so they can pump it after NVDA earnings.
  
    Load the calls right fucking now boys 🚀",2024-02-20T15:17:09.553Z
megaxanx,we gonna pump hard as fuck this week just hold on brothers,2024-02-20T15:21:49.271Z
[deleted],Comment deleted by user,2024-02-20T15:36:32.758Z
Connect-Wrongdoer-11,This is the worst day in history,2024-02-20T15:37:12.727Z
trade_doctor,I HAVE CANCELED THE RECESSION,2024-02-20T15:46:17.952Z
free_lions,Imagine buying SMCI at over $1K last week....LMAO,2024-02-20T15:51:02.760Z
TanSuede,"Bear trap, bull trap, sexual trap",2024-02-20T16:10:19.077Z
Sparky_SE81,SMCI killed off an entire generation of wsb bols.,2024-02-20T16:10:31.942Z
Forward_Observation,Really can’t believe I double downed on my apple position lol. Who tf puts 40k Into Apple 185C. This regard right here,2024-02-20T16:35:31.275Z
Domgrath42,How are my NVDA $1000C's bagholders feeling right now?,2024-02-20T16:54:28.066Z
stocksandbonds123,wow i managed to be up 30% on puts today and overtraded to be down 10%. im probably the biggest clown here today,2024-02-20T17:07:58.973Z
MakeResonableChoices,Bulls need an emergency pizza from domino’s,2024-02-20T17:08:03.738Z
Long-Blood,"Remember when people were buying real estate in the metaverse?
  
    Lol",2024-02-20T17:15:18.785Z
95percentthere,Fuck this market. FUCK,2024-02-20T17:20:04.461Z
DJ_Hamster,Why'd I buy 0dte calls instead of puts,2024-02-20T17:21:26.783Z
dizaditch,Im too scared to look at my portfolio so i just look at these comments. Whos with me,2024-02-20T17:26:02.881Z
Treading_Light,Bears who hold their puts will pay dearly,2024-02-20T17:47:45.335Z
AdPurple4902,Reddit signed a 60M deal to sell our information. Fuck reddit,2024-02-20T17:51:34.801Z
distress_deez_nutz,"bears at 930 am: - 15%
  

    bears at 12:45 pm: +200%
  

    bears at 4pm: -100% + ""how did this happen to me?!""",2024-02-20T18:23:36.751Z
Market_Bottom,Otm 0dte puts going to get demolished here,2024-02-20T18:51:27.505Z
Rebelcr7,"3 years ago today I was sitting at home, in pjs, unemployed, watching the market collapse as a virus swept the border. Good times, wish I could go back",2024-02-20T19:04:03.844Z
Successful_Wedding82,I wanna see 1 large candle to green to shatter bear anus,2024-02-20T19:27:03.841Z
LostItAllOnSpy,"if I don't open the app, I have no losses.",2024-02-20T20:04:59.300Z
BLOW_0,THIS NVIDIA DIP WAS FREE MONEY,2024-02-20T20:10:57.298Z
billybeesesteak,SMCI dumping afterhours so bulls can’t get out of their calls would be absolutely hysterical,2024-02-20T20:42:07.213Z
surfinbird,Wow SMCI did a $100 round trip IN ONE DAY 😳,2024-02-20T20:53:51.806Z
Ixorba,OPEN. THE. CASINO.,2024-02-20T11:55:16.718Z
free_lions,SMCI is moving like a penny stock,2024-02-20T12:09:06.360Z
dudetrustm3,The dopamine levels I can reach when holding only triple levered products is INSAAAAANEEEEE,2024-02-20T12:10:56.600Z
scootter82,emotional posting is so rampant here lol,2024-02-20T12:22:24.249Z
[deleted],Comment removed by moderator,2024-02-20T13:25:45.336Z
LetsGoAhoy,"Everyone I know wants to quit their job, I thought the great resignation was old news",2024-02-20T13:32:24.204Z
BoredPoopless,Google is such a piece of shit.,2024-02-20T13:51:18.596Z
Polysorbate800,The American economy hinges on how many semiconductor chips a single company is dealing,2024-02-20T14:16:22.465Z
trade_doctor,"SMCI puts are too expensive now. $2,000 to bet on a $100 drop in a week 😮‍💨",2024-02-20T14:18:19.885Z
KilltheK04,"Only traders with steel balls should trade this week
  
    Rest of you kiddos, sit down and color",2024-02-20T14:22:29.567Z
LongHealth,Super Micro Cock Inversion,2024-02-20T14:24:16.678Z
Overlord335786,NVDA 800C weeklies still over $1100,2024-02-20T14:39:48.174Z
thestashman23,This dip feels more fake than a Kardashian ass,2024-02-20T14:51:51.149Z
Perfectly_Splendid89,This is what happens when everybody buys nvida calls.,2024-02-20T14:57:15.233Z
ShinyPants45,Lets see some actual red,2024-02-20T15:11:07.789Z
Reasonable_Map_7361,SMCI +1K BAGHOLDERS SHOW YOURSELF LOL,2024-02-20T15:16:22.540Z
WhiteColllarCrime_69,🫲🏻Are you not entertained🫱🏻,2024-02-20T15:22:22.822Z
Forward_Observation,Down 1500 in the first hour. Oh it’s gonna be a shitty fuckin day,2024-02-20T15:23:40.724Z
N3XUSBLAZ3R,I am bul and I am ded,2024-02-20T15:30:55.014Z
No_Implement_5807,Looking forward to loss porn,2024-02-20T15:31:33.247Z
OSRSkarma,"The music finally stopped
  
    Who got caught without a chair and a nice hefty bag?",2024-02-20T15:34:03.344Z
GoodGuyDrew,Bears woke up and chose violence.,2024-02-20T15:40:03.200Z
Legitimate-Owl-7137,I buy calls I lose I buy puts I lose fuck this market,2024-02-20T15:48:32.524Z
EatMaTesticles,Don’t worry guys. It’s only money you’re losing. The most important thing in the world.,2024-02-20T15:50:11.542Z
ebfeebfe,"MICROSOFT DEVELOPS AI SERVER GEAR TO LESSEN RELIANCE ON NVIDIA
  
    Good night, sweet prince $NVDA",2024-02-20T16:06:16.316Z
[deleted],Comment deleted by user,2024-02-20T16:11:31.708Z
SensitiveToLight69,SMCI just burn already,2024-02-20T16:13:13.965Z
TimeToGetTheBread,I can’t lose money if I don’t log onto etrade,2024-02-20T16:25:31.731Z
Jelly__Rogers,I am starting to think these SPY calls at open were not the play,2024-02-20T16:36:19.637Z
sonic_gottagofast_11,Nvda shitting pants before earnings is top 10 funniest moments 2024,2024-02-20T16:44:57.672Z
fireat25,time to get calls again,2024-02-20T16:44:58.384Z
ProfessorCommenter,"Being down 60 percent on the day isn’t that bad, right",2024-02-20T16:46:19.349Z
--Right--Tackle--,"When they happen…NVDA dumps are so clean.
  
    No foreplay. Just one massive diarrhea.",2024-02-20T16:48:09.857Z
EatMaTesticles,Bears with -80% portfolios: “LMAO BULLS ARE FCK”,2024-02-20T16:48:20.697Z
ExactLobster1462,All the gards here holding $1100 NVDA calls are fully done lol,2024-02-20T17:12:29.182Z
_unrealized_,"45 days ago, some guy bought calls for the first time and got rich.
  
    Today, some guy bought calls for the last time and got poor.
  
    Circle of life.",2024-02-20T17:14:00.014Z
__Shadowman__,A 4th plane has hit qqq,2024-02-20T17:18:05.946Z
throw_my_money_away,This is unacceptable. I would like to speak with the manager.,2024-02-20T17:21:13.275Z
Gewoongary,"Do crackheads ever say, “I’m too broke to smoke crack tonight”?
  
    No. They get up and make it happen.
  
    Lesson in there.
  BUY THE DIP",2024-02-20T17:32:02.195Z
Very_Regarded,Jesus this is brutal,2024-02-20T17:38:11.955Z
Jelly__Rogers,"My dinner plans for today:
  


Dorsia



Texas Roadhouse



Olive Garden



Arby's



Corn Dogs



    Sleep ✅️",2024-02-20T17:45:16.529Z
Able_Web2873,"Nvda gonna raise their dividend, announce stock split and mention AI 500 times. Will hit 1000 shortly thereafter",2024-02-20T17:46:26.558Z
End-Game-1999,"After a very long string of really bad moves, what do you do? You know your next move is likely wrong if the pattern holds, and not making that move would then also most likely be the wrong move...shit",2024-02-20T17:47:21.010Z
DJ_Hamster,Ended up unintentionally buying 0dte strangle on spy cause I don't know what's going on,2024-02-20T17:47:29.958Z
__Slick_iG_,Went from AI to ayyy whyyyyyy,2024-02-20T17:53:10.337Z
FeelingBlue69,could SMCI just drop $200 like it did on Friday please ?,2024-02-20T17:56:56.883Z
MikeMikeGaming,SMCI looking ready to pull that rug again,2024-02-20T18:08:07.425Z
Unitedtendies,SPY flat for 3 years when you consider all things,2024-02-20T18:18:55.755Z
andytobbles,"This bubble ain’t even remotely popped, these pullbacks are showing health not weakness. Vertical gains everyday is scarier then this shit",2024-02-20T18:23:32.077Z
electricsheep2013,"Fuck it, I am buying calls",2024-02-20T18:32:33.121Z
[deleted],Did NVDA endorse Hamas?,2024-02-20T18:35:24.594Z
Sparky_SE81,"1k to 120k guy:
  
    I’m gona yolo on NVDA 900c (last Friday)  lol 🤣
  
    And it’s gone 📉",2024-02-20T18:36:14.434Z
LostItAllOnSpy,AI revolution is over. back to the caves and wooden tools,2024-02-20T18:39:11.797Z
Coogiez,BULLS CHARGEEEEEEEEEEEEEE,2024-02-20T18:40:32.674Z
amoistsock,I’m a professional knife catcher,2024-02-20T19:05:45.556Z
Nils_Blum,⠀⠀⠀⠀⠀⠀⠀⠀⢉⣐⣂⢤⣄⣀⣀⣀⣀⣇⣼⡠⠀⠀⠀⠀⠀⠀⠀⠀⠀⠀ ⠀⠀⠀⠀⠀⠀⠀⢀⣀⡴⠛⠉⠉⠀⠁⠀⠀⠀⠉⠑⠦⡀⠀⠀⠀⠀⠀⠀⠀⠀ ⠀⠀⠀⠀⠀⠀⠠⡿⠛⠀⠀⠀⠀⠀⢬⢦⠀⠀⠀⠀⠀⠘⢆⠀⠀⠀⠀⠀⠀⠀ ⠀⠀⠀⠀⠀⠀⢸⠁⠈⠂⠀⡠⠒⠢⠀⠁⠀⠀⠀⠀⠀⠀⠘⡆⠀⠀⠀⠀⠀⠀ ⠀⠀⠀⠀⠀⠀⡇⣠⡿⠃⠀⠀⣴⣦⠃⠀⠀⠀⠀⠀⠀⠀⠈⠣⣄⠀⠀⠀⠀⠀ ⢀⣤⣤⣤⣤⣼⡓⠊⠀⠀⠀⠤⠿⠋⠀⠀⠀⠀⠀⡀⠀⠀⠀⠀⠈⠳⣄⠀⠀⠀ ⡸⣿⣿⣿⣿⣿⣿⠆⠀⠀⠀⠀⠀⠀⣀⠀⠀⠀⠀⠈⢄⠀⠀⠀⠀⠀⠘⢧⡀⠀ ⡇⠈⢻⠿⠛⠋⠁⠀⠀⠀⠀⠀⠀⣀⠆⠁⠀⠀⠀⠀⢘⡆⠀⠀⠀⠀⠀⠈⢷⠀ ⠹⡀⠘⡄⠀⠀⠀⠀⠀⠀⠀⣰⣿⠏⠀⠀⠀⠀⠀⠀⣸⣇⠀⠀⠀⠀⠀⠀⠈⡇ ⠀⠈⠐⠳⣄⠀⠀⠀⠀⣀⠔⠋⡍⠀⠀⠀⠀⠀⠀⠀⢻⣸⠀⠀⠀⠀⠀⠀⠀⣷ ⠀⠀⠀⠀⠀⠉⢻⡙⢏⠀⣀⠜⠀⡠⠊⠀⢀⣠⣤⣶⣿⡿⣇⠀⠀⠀⠀⠀⠀⡏ ⠀⠀⠀⠀⠀⠀⠀⠑⢤⣀⣠⡤⣾⣤⣴⣾⣿⣿⠿⠛⠁⠀⠈⠢⣀⣀⣀⣠⠞⠁ ⠀⠀⠀⠀⠀⠀⠀⠀⠀⠀⠀⠀⢻⠿⠟⠛⠉⠀⠀⠀⠀⠀⠀⠀⠀⠉⠁⠀⠀⠀,2024-02-20T19:24:32.872Z
CryptographerIcy2508,My whole entire existence relies on Nvida earnings tomorrow,2024-02-20T19:28:29.033Z
weegee13,Amazing SMCI -7% for the day and my puts are -10%,2024-02-20T19:29:53.502Z
dacalo,"Get back down SMCI, you ain’t NVDA, just a POS rack maker.",2024-02-20T19:37:58.822Z
Ok-Buddy-Sure,Bears clap when the plane lands,2024-02-20T19:44:47.533Z
BagSelect,Some of you have a garden and it grows,2024-02-20T20:00:48.445Z
NVDAismygod,SMCI has killed put and call holders,2024-02-20T20:02:00.605Z
josh272321,THANK YOU TO THE HEDGE FUND THAT FINALLY HAD THE BALLS TO TURN ON THE SMCI BUY ALGO,2024-02-20T20:06:42.845Z
kenathen,who bought smci and nvda bottom today? congratulations,2024-02-20T20:12:07.970Z
hyurax,Watching the price action on SMCI is damaging my attention span more than tiktok,2024-02-20T20:12:21.878Z
marlonm2321,I gotta stick to sports gambling. This stock market shit does not like me💀,2024-02-20T20:25:12.655Z
keyboardwarrior425,"portfolio either going to 100k or 0 tomorrow boys, GL to you all",2024-02-20T20:28:21.078Z
BlitzComet95,Not pulling out of her this weekend. Puts on fatherhood tho,2024-02-20T20:31:07.109Z
lSazedl,"fuck it. NVDA 3/1 750c . I will see you all in Valhalla,",2024-02-20T20:50:40.020Z
civillyRange,"HD US sales down 4%
  
    Bols cant even afford a hammer",2024-02-20T11:26:22.818Z
optionsGPT,Miss living on the west coast and markets open at 6:30,2024-02-20T11:35:54.184Z
wowthisguyoverhere,Guess we just buy the dip until the strategy fails or...?,2024-02-20T11:43:06.868Z
ExactLobster1462,Your children will be asking why you didn’t buy the generational dip occurring on 20th Feb 2024,2024-02-20T11:51:16.343Z
optionsGPT,I wonder if Warren buffet has a 100k Robinhood account he gambles on FDs with,2024-02-20T11:56:44.358Z
MakesScreechingNoise,We are at levels not seen since mid last week!!!!!,2024-02-20T12:03:33.322Z
ShaggyDogLives,"Walmart just reported hombres:
  
    EPS of $1.80 beating expectations of $1.65 Revenue of $173.4B beating expectations of $169.3B",2024-02-20T12:07:45.881Z
