Author,Comment,Date
Bang1966,SOUN,2024-02-26T19:16:06.964Z
Themostinternet,SOUN might be my first 10 bagger,2024-02-26T19:16:08.928Z
False_Profit_of_WSB,"Y'all not even paying attention.
  
    TREX has earnings today but bro, TREX's are sooooo extinct, fucking puts, literally can't go tits up they don't even exist anymore how they gonna have earnings. Brain dead.",2024-02-26T19:25:08.051Z
zg44,"Next catalyst for SOUN is when the option chain adds 9+ strikes tomorrow.
  
    (This can keep running if turns into a gamma ramp pre-earnings).",2024-02-26T19:31:49.685Z
Mental-Associate3902,SOUN is literally going to replace every drive-thru employee in the world,2024-02-26T19:32:00.303Z
[deleted],REDDIT AND DOWNTIMENAME A MORE ICONIC DUO,2024-02-26T19:32:22.920Z
UnholyTrigon,"While you guys are buying SOUN, I’m just wondering how badly Smci will drop this Friday",2024-02-26T19:46:10.946Z
FineMasterpiece8401,SPY was a frustrating son of a bitch to trade today,2024-02-26T19:48:14.977Z
Whybother456,Anyone see the volume on Spy today?,2024-02-26T19:48:18.750Z
FearlessTrader,"You know a stock is f’ed and tanking hard when you see every other comment here saying “it’s just cooling off before take off 🚀”, “just buy the dip” 🤣🤣🤣",2024-02-26T19:53:40.220Z
nocashflow_,how da fuck am i down 600,2024-02-26T19:54:06.011Z
ReadyGain2972,MARA saving my account,2024-02-26T20:00:23.957Z
-Dreamville-,"Well headed home, good day of work, I checked 6 emails today, and that was literally it, didn’t even respond to one, well hit it hard tomorrow tho",2024-02-26T20:01:51.390Z
[deleted],"Can’t stop, won’t stop, losing money.",2024-02-26T20:06:15.745Z
anidodina,if you havent sold your position on SOUN idk what to tell you,2024-02-26T20:08:10.165Z
SlaynArsehole,They said fuck yo dip,2024-02-26T20:19:22.478Z
DuvelNA,nvidia dip was fugazi.,2024-02-26T20:23:28.931Z
Technical_Baby_6753,ive taken a short position and now i understand how it feels to be mentally ill,2024-02-26T20:27:26.446Z
AssistantInformal797,SPY has been sitting at this level to the 0.01 value for 2 hours,2024-02-26T20:28:30.875Z
Mvxlacy,SPY and MARA puts are gonna print so hard this week,2024-02-26T20:28:33.717Z
enc-nyc,shit -30% on my spy call for friday. will hold until tomorrow,2024-02-26T20:41:22.138Z
juliettefriskey,MAKE BAD DECISIONS GREAT AGAIN,2024-02-26T20:43:13.276Z
ThisHatRightHere,You guys holding SOUN overnight?,2024-02-26T20:44:54.297Z
DepartureHelpful,This…is… boring… I’ll check back in tomorrow when the volume isn’t 50% of normal,2024-02-26T20:46:49.258Z
Front_Umpire4873,Sheesh such bad volume today.,2024-02-26T20:47:49.116Z
Ldjforlife,"I learn something new every time I’m in these daily threads. For example, today I learned what sounding is….yikes!!!!",2024-02-26T20:48:25.881Z
SilkyThighs,"Just an fyi, your work 401k contribution is going towards nvda at 800",2024-02-26T20:53:23.651Z
wowthisguyoverhere,We riding HIMS calls into ER?,2024-02-26T20:55:04.517Z
Ghost1914,Seems SOUN is this weeks volatile play,2024-02-26T21:00:29.796Z
PutsOrCallsXD,i risked 16k to make 800 dollars today. someone kill me,2024-02-26T21:00:33.891Z
Sharkkboy6,u/ballsdropped is the guy that sold ZM calls for Soun calls  this comment will age even better in a few days,2024-02-26T21:17:31.591Z
Sharkkboy6,ZM $80 EOW,2024-02-26T21:25:25.233Z
LookAtMeImInAGang,elon smells like pee,2024-02-26T11:03:11.604Z
Ill_Try1620,Bet the market goes sideways today and closes green but flat!,2024-02-26T11:27:49.187Z
Tasty_Occasion_7038,Zoom puts 53 3/15. Pls fucking print man.,2024-02-26T11:34:43.433Z
Ill-Expression1737,its all gonna fall off a cliff here,2024-02-26T11:43:16.570Z
richreason1983,Trading makes Mondays great again.,2024-02-26T11:45:06.637Z
leandrostonks,dümp it,2024-02-26T11:51:44.572Z
InsiderTradingInc,All these dumbasses who held smci puts when it was down 12% deserve to get burned today,2024-02-26T11:53:34.037Z
Overlord335786,"515 today, I can feel in in juliettefriskey’s plumbs",2024-02-26T11:57:44.756Z
Artistic-Crow-3794,I think we all know the real market mover is DPZ. Pizza will win everytime. My 440c gonna ensure I'm loaded up with domino's for the rest of the year.,2024-02-26T12:01:15.770Z
amoistsock,"are you high right now

do you ever get nervous",2024-02-26T12:09:11.904Z
kenathen,what if lunr open green. 🤣,2024-02-26T12:11:19.813Z
TheGLitCashDude,Palo Alto calls printing,2024-02-26T12:16:03.371Z
[deleted],Comment removed by moderator,2024-02-26T12:17:30.022Z
gronaninjan,Is this the day to sit out? Smells like Theta,2024-02-26T12:22:18.961Z
TimAppleBurner,"Remember a year ago when those banks started collapsing and then one day the Fed & FDIC were like “ya it’s cool we got cash money” and then it just stopped
  
    Weird",2024-02-26T12:22:22.035Z
Far-Requirement9180,He sold ?,2024-02-26T12:28:14.115Z
ItradebetterthanU,LUNR on fire … back over $7,2024-02-26T12:31:25.842Z
Dipsonyx,"WMT going to $61-$62 today and $65 by end of week. Loading this solid divy stock, last split 25 years ago it was already back up +50% by eoy.",2024-02-26T12:38:11.885Z
Mortal1ty1337,That Lunar robot was always going to fall over. Looks like a fridge on wheels.,2024-02-26T12:44:51.852Z
Overlord335786,"Well it’s official.
  
    I shop at Club Monaco now.",2024-02-26T12:49:49.740Z
Zachincool,Nvda 1k eom,2024-02-26T13:05:32.232Z
