Author,Comment,Date
Sharkkboy6,Can we get TSLA -4% premarket,2024-02-28T07:56:24.795Z
[deleted],Comment deleted by user,2024-02-28T09:57:25.147Z
FCUK12345678,Why did I sell panW? God damn it. Shoot me now,2024-02-27T15:20:57.227Z
Jarlaxle_rigged_it,TURN IT AROUND FOR TUESDAY BULLS,2024-02-27T14:50:32.259Z
lawerry22,Calls all day baby,2024-02-27T14:33:50.119Z
Sharkkboy6,Why,2024-02-28T07:56:37.430Z
Commercial_Clerk_342,Short Squeeze incoming for BLUEBIRD BIO!,2024-02-27T14:26:08.584Z
Jwelz90,"Today, my therapist will learn once again why scheduling me at 9 am on Monday is just an utter waste of both of our time.",2024-02-26T11:56:24.584Z
ihadtopoop-,Beyond meat sounds like a gay romance movie,2024-02-26T13:46:32.749Z
whatsariho,I have a confession to make. I'm a gay bear and I have been sitting on the sidelines waiting for a correction getting a 5% return since the beginning of 2023 and watching as the market parties. As each day passes I put on more clown makeup and it's almost finished now.,2024-02-26T11:27:17.322Z
Overlord335786,I trade using the SPY all time chart. The Great Depression was just a bear trap.,2024-02-26T13:28:54.908Z
ItsyBitsySPYderman,"The way you beat fomo is understanding that the market always provides a way to make money, and you dont need to be in a position just because the market is open.",2024-02-26T13:48:58.907Z
Overlord335786,"I hate premarket.
  
    I’m so impatient and I want to be able to buy calls whenever I want",2024-02-26T11:46:30.898Z
Bear_is_ghey,"I know yall will prob laugh, but since I lost my Life savings wanted to say I’m going to gambler anon and told everyone what happened. Its been fun 🫡",2024-02-26T11:32:43.912Z
novalyte95,IM ADDICTED TO LOSING MONEY,2024-02-26T11:07:24.954Z
Diamondhands4dagainz,SPY at -0.02% and regards in here are screaming that it’s dumping and gunna be a Ber day lmfao,2024-02-26T12:09:41.866Z
Ill-Expression1737,im literally bankrupt right now but here i am,2024-02-26T12:03:24.608Z
Reasonable_Map_7361,"Regards in this thread sitting in their rooms, smelling their owns farts with a $20 long position on NVDA lol.",2024-02-26T12:32:52.816Z
YouOk2157,"$35K buying power, let’s see if I can make it $0",2024-02-26T14:12:03.603Z
Long_duk_dong_duck,"Hey guys, I’m back.  Thank jesus for narcan",2024-02-26T11:45:34.302Z
TheThirdGilgamesh,Carvana deserves to die,2024-02-26T11:47:09.455Z
[deleted],Comment deleted by user,2024-02-26T13:46:52.520Z
studmcstudmuffin,I have some SPY puts.. I feel naughty,2024-02-26T11:06:56.407Z
[deleted],Comment deleted by user,2024-02-26T12:41:08.350Z
MoneyMakingMitch14,MARA BULLS WHERE YOU AT,2024-02-26T15:21:56.923Z
NVDAismygod,"Down $5,000 today",2024-02-26T16:16:30.958Z
Life_Record_4935,Smci to 600 today,2024-02-26T11:04:00.202Z
novalyte95,LUNR FUCKED ME IN THE ASS,2024-02-26T11:02:28.297Z
Automatic-L0ss,You pegged yourself. Take some accountability,2024-02-26T11:03:37.629Z
theredviper17,"Even Warren Buffet calls the market a casino now, we won boys",2024-02-26T11:23:50.770Z
housemouse431,why do they offer puts to buy anymore lol,2024-02-26T14:19:06.978Z
moe_leste,Hear me out:NVDA 818 EODI did the meth,2024-02-26T11:14:51.023Z
Vegarlic,Lmao please God in heaven send help,2024-02-26T12:01:53.242Z
Stunning-Option-6722,Nobody knows what’s gonna happen yall all jus yappin,2024-02-26T12:12:31.681Z
xRICHxPIANAx,"Corn users be like:
  
    Yeah, just export to meta bridge 3.2, on the cuck chain, then stake your exocoin to my blockchain address which is hpl38276x9ajwug.
  
    Now send 10 cents to test that you have my wallet and then send the full amount. Thanks bro",2024-02-26T12:18:37.168Z
NVDAismygod,I know one of you is fully convinced you know exactly what SMCI is going to do at open and you’re going to immediately lose all your money,2024-02-26T13:34:36.391Z
818j25S,Spy is a piece of shit. I want my money back,2024-02-26T19:09:56.696Z
WSBrookie,"Looks like daddy is paying off the truck today. I bought this truck with WSB gains, I close this truck with WSB gains.",2024-02-26T11:49:21.639Z
AreProbablyWrong,Can’t spell cyberattack without AT&T,2024-02-26T12:38:27.028Z
Eastern-Cranberry84,"people actually asking if NOK is a good trade LOL. WSB routinely every year has a bunch of new regards that think this piece of shit is going to pop more than a couple bucks. i'll save you some time , you won't get any 10 baggers out of this one. move along. it doesn't matter how many ""deals"" or ""government contracts"" there are. people used to shriek it was going to go wild cuz of 5g ok ? that's how old this meme is.",2024-02-26T12:42:28.204Z
22pabloesco22,"So on top of doing work for free, Reddit mods will get early access to buy stock of a shitty company that’ll never make money.
  
    Incredible times",2024-02-26T12:55:52.656Z
LUVS2GAPE_MENs_ANOOS,"lmao u want me to max my 401k and retire at 65 lmao 🤣 🤣🤣🤣🤣🤣🤣
    Bruh
  
    Your time on this earth is limited
  
    How dare they think I am arrogant enough to think I will make it to 65 with my diet and COCOAIN diet plan !!!
  
    What ever u do
  
    DO IT NOW !!
  
    TODAY !!!
  
    Lets go!!!! Yeah",2024-02-26T13:11:15.487Z
guzzledglizzy,NVDA is going to crush the market when it pops and I’m scared,2024-02-26T13:16:52.902Z
One-Banana3327,$LUNR landed upright in my ass,2024-02-26T13:32:29.098Z
UndeadMonarch1,⣿⣿⣿⣿⣿⣿⣿⣿⣿⣿⣿⣿⡿⠛⠛⠋⠉⠙⠻⠿⠿⠿⠿⢿⣿⣿⣿⣿⣿⣿ ⣿⣿⣿⣿⣿⣿⣿⣿⣿⣿⡿⠃⠄⠄⠄⠄⠄⠄⠄⠄⠹⣿⣿⣶⣶⣦⣬⢹⣿⣿ ⣿⣿⣿⣿⣿⣿⣿⣿⣿⣿⠃⠄⠄⠄⣰⣧⡀⠄⠄⠄⠄⠈⢙⡋⣿⣿⣿⢸⣿⣿ ⣿⣿⣿⣿⣿⣿⣿⣿⣿⣿⠄⠄⠰⠼⢯⣿⣿⣦⣄⠄⠄⠄⠈⢡⣿⣿⣿⢸⣿⣿ ⣿⣿⣿⣿⣿⣿⣿⣿⣿⣿⠄⠄⠸⠤⠕⠛⠙⠷⣿⡆⠄⠄⠄⣸⣿⣿⡏⣼⣿⣿ ⣿⣿⣿⣿⣿⣿⣿⣿⣿⡇⠄⠄⠄⠄⠄⠄⠄⠄⠄⠄⠄⠄⣴⣿⣿⣿⢡⣿⣿⣿ ⣿⣿⣿⣿⣿⣿⣿⣿⡟⠄⠄⠄⠄⠄⣄⠄⢀⠄⠄⢀⣤⣾⣿⣿⣿⢃⣾⣿⣿⣿ ⣿⣿⣿⣿⣿⣿⠿⣛⣡⣄⣀⠄⠠⢴⣿⣿⡿⣄⣴⣿⣿⣿⣿⣿⢃⣾⣿⣿⣿⣿ ⣿⣿⣿⣿⣿⡏⣼⣿⣿⣿⣿⣿⣿⣿⣿⣿⣿⣿⣿⣿⣿⣩⡽⡁⢸⣿⣿⣿⣿⣿ ⣿⣿⣿⣿⣿⢃⣿⣿⢟⣿⣿⣿⣿⣿⣮⢫⣿⣿⣿⣿⣿⣟⢿⠃⠄⢻⣿⣿⣿⣿ ⣿⣿⣿⣿⡿⣸⠟⣵⣿⣿⣿⣿⣿⣿⣿⣾⣿⣿⣿⣿⣿⣿⣷⣄⢰⡄⢿⣿⣿⣿ ⣿⣿⣿⣿⡇⠏⣼⣿⣿⣿⣿⣿⣿⣿⣿⣿⣿⣿⣿⣿⣿⣿⣿⣿⣦⠹⡎⣿⣿⣿ ⣭⣍⠛⠿⠄⢰⠋⡉⠹⣿⣿⣿⣿⣿⣿⠙⣿⣿⣿⣿⣿⣿⡟⢁⠙⡆⢡⣿⣿⣿ ⠻⣿⡆⠄⣤⠈⢣⣈⣠⣿⣿⣿⣿⣿⠏⣄⠻⣿⣿⣿⣿⣿⣆⣈⣴⠃⣿⣿⣿⣿ ⡀⠈⢿⠄⣿⡇⠄⠙⠿⣿⡿⠿⢋⣥⣾⣿⣷⣌⠻⢿⣿⣿⡿⠟⣡⣾⣿⣿⠿⢋ ⠛⠳⠄⢠⣿⠇⠄⣷⡑⢶⣶⢿⣿⣿⣿⣽⣿⣿⣿⣶⣶⡐⣶⣿⠿⠛⣩⡄⠄⢸,2024-02-26T18:33:42.502Z
VisualMod,"Ban Bet Lost
u/HomosapianDaGreekGod made a bet that NVDA would go to 1000.0 within 1 week when it was 727.151 and it did not, so they were banned for a week.
  
    Their record is now 0 wins and 1 losses
  
Join WSB Discord",2024-02-26T12:13:50.064Z
WOTEugene,🙏 to Jensen that NVDA announces stock split,2024-02-26T12:38:48.228Z
nocashflow_,"I got my custom flair 

    but its lame",2024-02-26T13:39:58.736Z
bears2broke,BEARS GETTING BOOTY CLAPPED DAILY,2024-02-26T13:52:47.465Z
DJSourNipples,"Had a nightmare I couldn't sell my calls because I couldn't log into anything. By the time I could log in, market was red.
  
    I have to pee.",2024-02-26T14:15:29.582Z
wallstreetsimps,"For those wondering what secret stock Warren Buffet bought, it's SOUN",2024-02-26T15:33:54.213Z
animositisomina35,LUNR has good support at 0.,2024-02-26T17:48:51.963Z
User0198888,Banks selling but I’m holding what does this mean,2024-02-26T12:49:19.062Z
Cold-Lettuce8991,In retrospect. Turning off the buy button u gotta admit is pretty hilarious,2024-02-26T13:45:03.368Z
rdblaw,Where tf did that SOUN  come from,2024-02-26T15:34:48.392Z
SpermBanking,"If I was a hedge fund manager, I would full port 0DTE SPY options everyday",2024-02-26T16:11:37.832Z
RoyalFail6,"Spy dumping to hell, I’m ruined",2024-02-26T18:29:08.941Z
Mediocre-Yam-6134,I was up 40% now down 50% I’m greedy I hate myself,2024-02-26T18:32:57.964Z
UndeadMonarch1,⠍⠁⢒⠿⡠⠖⠉⠉⢙⣷⠀⠀⠀⠈⠩⣲⣄⠀⠀⠀⠀⠀⠀⠀ ⣲⣿⣿⣞⣁⣀⠴⢚⣿⠛⣷⡈⣆⠀⠱⡌⠉⢧⠀⠀⠀⠀⠀⠀ ⣿⣿⠋⣹⣟⣁⣴⣾⠃⢀⡏⠇⠸⡀⠀⢱⠀⢈⡇⠀⠀⠀⠀⠀ ⣿⡇⣸⡯⠽⠟⢋⣉⠑⡞⠀⡼⢠⢧⠀⠀⡇⠈⢿⠀⠀⠀⠀⠀ ⠉⣰⠙⡿⣷⣶⢦⡄⢰⠁⢰⠃⣸⡌⠀⢸⠃⢀⢾⠀⠀⠀⠀⠀ ⢼⣿⡀⠉⠀⠈⠀⠀⠀⢧⢇⣸⣳⠁⡰⢃⠀⣸⣿⡄⠀⠀⠀⠀ ⢦⠣⠁⠀⠀⠀⠀⠀⠀⠘⠙⠻⢥⠞⢁⠜⣰⣿⣿⡿⠀⠀⠀⠀ ⠘⣧⡀⠀⠀⠀⠀⠀⠄⠀⠀⠀⠀⣼⣧⣾⡷⠛⢿⠓⠀⠀⠀⠀ ⣇⣿⠙⢦⡀⠀⠀⠀⠀⠀⠀⢀⣼⡿⠋⠀⠀⠀⠈⠀⠀⠀⠀⠀ ⣿⡇⠀⠀⠈⠓⠤⣤⡤⠖⠊⠉⠀⠀⠀⠀⠀⠀⠀⠀⠀⠀⠀⠀ ⠙⠓⠤⠄⣀⡀⠀⢸⣷⣦⡤⠤⠖⠒⠒⠢⢤⡀⠀⠀⠀⠀⠀⠀ ⢆⡀⠀⠂⠒⠒⠒⠻⠦⣄⡀⠀⢀⠢⠤⠤⢄⡹⣦⣀⠀⠀⠀⠀ ⠋⠀⠀⠀⠀⠀⢀⠀⠀⠀⠈⠳⡄⠀⠀⠀⠀⠀⠈⠉⠳⣤⡀⠀ ⠀⠀⠀⠀⠀⠀⠻⠇⠀⠀⠀⠀⠙⡄⠀⠀⠀⠀⠀⠀⠀⢬⣱⣄ ⠀⠀⠀⠀⠀⠀⠀⠀⠀⠀⠀⠀⠀⡇⠀⠀⠀⠀⠀⠀⠀⠀⠀⣿ ⠀⠀⠀⠀⠀⠀⠀⠀⠀⠀⠀⠀⣠⣇⠀⠀⠀⠀⠀⠀⠀⠀⠀⡿ ⡦⣀⠀⠀⠀⠀⠀⠀⠀⣀⠠⠖⠋⠈⠳⣄⠀⠀⠀⠀⠀⠀⢠⡟ ⢸⠈⠉⠒⠒⠒⠊⠉⠁⠀⠀⠀⠀⠀⠀⠈⠳⣆⡀⠀⢀⡴⠟⠀ ⢸⡆⠀⠀⠀⠀⠀⠀⠀⠀⠀⠀⠀⠀⠀⠀⠀⠐⡿⠛⠉⠀⠀⠀,2024-02-26T18:37:07.154Z
freehouse_throwaway,"man if you want to see some really wack shit, just read any SPAC/ex meme stock bagholder subs
  
    each individual equity/company is like a fucking cult. they post and celebrate shit like new job positions, new hires, HODL memes (cuz what else you gonna do when you're -80% to -90% down) and other hardcore copium shit
  
    and each of their sub seems to have their very own youtube influencer bagholding and/or pumping the penny stock with like just enough subscribers for you to think he's legitimate but the bro is clearly just a conspiracy nutjob too",2024-02-26T19:44:18.012Z
UsernameTaken_123,"NVDA will open at 900 tomorrow
  
    SOUN will open at 12 tomorrow
  
    SPY will open at 700 tomorrow",2024-02-26T19:49:07.252Z
SHAZAzulu618,Lmao.. sat out all day today just to buy calls for tomorrow and be down immediately,2024-02-26T20:47:06.465Z
ARoseandAPoem,Coffee is the nectar of the gods. I would litterally rather die than give up my beloved coffee.,2024-02-26T12:30:14.024Z
22pabloesco22,If he cums he cums,2024-02-26T12:49:44.748Z
Ballsmeetpets,"“Do not cum… do not cum”
  
    “I’m gonna cum!”",2024-02-26T12:50:52.400Z
DooDoo1245,"Some of us are smart, I skipped the whole October - February rally by taking a break. Just to come back to this shit show",2024-02-26T13:01:44.918Z
richnun,0DTE SPY Calls at market open legooooo,2024-02-26T14:13:10.722Z
[deleted],This options trading book I'm reading talks about how to place an order over the phone,2024-02-26T16:24:04.550Z
MarcoPolooooo,Spy down .1% the world is ending,2024-02-26T16:27:50.627Z
wowthisguyoverhere,Would be insanity if SOUN pushes through 5 today.,2024-02-26T17:28:13.140Z
Competitive_Ride,I got invited to Reddit IPO. Is this their way of calling me a loser?,2024-02-26T17:29:17.374Z
saw-it,Where’s that fucker who said 507 calls were free money,2024-02-26T18:28:14.907Z
LetsGoHawks5,Anyone talking about SOUN today? /s,2024-02-26T19:29:23.501Z
SnipDripDip,"Uh oh, bulls are getting hard off the no volume pumps again",2024-02-26T11:51:58.145Z
billybeesesteak,It’s like SMCI cures all children’s cancers Monday through Thursday and then on Friday gives it back to them.,2024-02-26T11:58:59.665Z
WorkByDrew,If LUNR releases a sweet photo this morning I’d appreciate it,2024-02-26T12:16:19.385Z
alfapredator,being in cash is very dangerous. few understand.,2024-02-26T12:21:49.625Z
False_Profit_of_WSB,"RDDT going to be the best investment of the century, it's the frontpage of the internet, surely everybody is going to be buying 45$ uovotes for each other posts!
  
    Is that what they think by making that stupid fucking popup pop up every time I click on an upvote? Idiots.",2024-02-26T12:28:45.027Z
RoyalFail6,Walmart is back to levels not seen since the year 2000,2024-02-26T12:42:17.261Z
Eastern-Cranberry84,that NOK thread is funny. bagholders from years ago still hoping there will be a pump.,2024-02-26T13:02:06.742Z
Ok-Veterinarian-2333,Calls on everything,2024-02-26T13:05:16.592Z
United_Smell3542,"The company I work for just upgraded to 2 ply toilet paper! They must be doing really well, is it insider trading if I'll tell you who I work for?",2024-02-26T13:28:25.239Z
ziggs_ulted_japan,I don't care if smci goes up or down. I trade momentum. The worst is sideways. Just move 75 dollars one way each day and let me make my money.,2024-02-26T13:41:01.126Z
VisualMod,"Ban Bet Lost
u/goldenloi made a bet that SPY would go to 430.0 within 1 month when it was 471.911 and it did not, so they were banned for a week.
  
    Their record is now 4 wins and 16 losses
  
Join WSB Discord",2024-02-26T13:53:04.774Z
JustLurkCarryOn,"In these uncertain economic times, the best way to diversify is chase meme stocks and hope you sell for a profit.",2024-02-26T13:56:07.736Z
ItsyBitsySPYderman,Buying puts is not shorting...,2024-02-26T14:03:15.584Z
Consistent-Platypus3,I should probably take my gains and step away from this obvious Monday morning trap. Right?,2024-02-26T14:10:16.708Z
Jeeperg84,NVDA needs to stop this shit and resume it's normal course...shits highly regarded,2024-02-26T15:39:14.728Z
Overlord335786,It’s disturbing to think that there’s people who think SMCI 1600 by this Friday is possible,2024-02-26T15:47:45.475Z
OhCanVT,my biggest regret is not choosing to be born into a multi billionaire's family,2024-02-26T17:42:10.896Z
donefukupped,The sudden uptake in SOUN reminds me of 2021 where WSB are just shilling pump and dumps around the clock.,2024-02-26T18:50:06.823Z
winner_in_life,Soun 20 eow,2024-02-26T19:00:02.149Z
SleepiestGuyAlive,SOUN def going to create some baggies. Congrats to anyone who was already holding though,2024-02-26T19:24:39.198Z
Imaginary_Mind9788,Can SOUN hit 10 by Friday?,2024-02-26T20:18:05.691Z
ConcentrateOdd8190,Damn Google dropped 80 billions dollars because it was racist,2024-02-26T21:16:46.897Z
BallsDropped,"So anyway, yall can all lick my ass
  
    Talking shit about me buying ZM calls
  
    Regardssss regardsssss regardssssssssss",2024-02-26T21:21:02.463Z
Chipsky,Chunks in my coffee creamer... bullish.,2024-02-26T11:16:19.162Z
kuprenx,Argentine President Javier Milei will introduce a bill to jail any Central Bank official who orders the printing of money to cover Argentina's deficit.jpow started to sweat,2024-02-26T11:53:09.960Z
Jwelz90,"MONSTER earnings this week?
  
    Sure all you white Oakley and beater wearing mullet slingers are fuckin stoked.",2024-02-26T12:11:00.178Z
Jmr15002,AMD to $200 this week?,2024-02-26T12:32:40.250Z
Kreigmeister,Nothing better than waking up to a green NVDA,2024-02-26T12:51:34.517Z
[deleted],"The federal reserve is neither federal, nor does it have any reserves.
  
    smoke and mirrors, boys.",2024-02-26T12:52:27.195Z
edmocha93,MARA calls at open?,2024-02-26T13:12:40.645Z
bitchboiseb,Your honor respectfully you werent there,2024-02-26T13:29:09.135Z
trainwreck001,"Stop acting like crackheads chasing tiny ass regarded stocks. Surefire way to stay Poor.
  
    JENSEN IS YO DADDY
  
    NVDA $5K",2024-02-26T13:41:23.473Z
AreProbablyWrong,Seems like Mondays are the riskiest trading day for people new to the market,2024-02-26T13:43:42.121Z
Fart_coma,So google is dumping because their AI is racist?,2024-02-26T14:09:55.779Z
SilentHillFan12,lemme axe you guys somefing,2024-02-26T14:10:58.385Z
One-Banana3327,$LUNR posted pics. The lander is communicating. And seems to be upright in pictures from nasa satellites.,2024-02-26T14:14:31.443Z
Ok-Veterinarian-2333,Nvda calls at open,2024-02-26T14:15:51.032Z
kuprenx,"Built to last' Berkshire nears $1 trillion valuation after record profitdude has company for 100 years and still cant reach nvidia.
  
    fucking poser",2024-02-26T14:26:35.340Z
LongHealth,SELL EVERYTHING,2024-02-26T14:47:49.157Z
matthias_lee,"damn  bought SMCI calls, and they lost almost 50% after i bought them",2024-02-26T14:55:25.181Z
Goldleader-23,Bought 3 $950 smci calls.... My body is not ready for this ride,2024-02-26T14:57:43.233Z
indyyo1,Made 50$ gunna call that a win after losing 1k Friday,2024-02-26T15:30:57.355Z
spellbadgrammargood,"ngl im still amazed people still believe in crypto, after all the scandals like FTX, LunaTerra, CTX(?), sketchy pump and dumps, and it's still not a practical form of currency
  
    if anything i wonder when it'll be regulated due money being sent to Russia and Russia and Ukraine War",2024-02-26T16:21:08.486Z
kk7766,"All the new $LUNR ""long term investors"" who bought the stock on Friday at over $11 are nonstop refreshing the price today every 5 seconds 😂😂😂😂😂",2024-02-26T16:59:39.504Z
PFC321,Look at the open interest for SOUN... someone knows something maybe? Either way I just yolod at open and am up 180%,2024-02-26T17:27:56.824Z
Low_Procedure_3538,Soun + Nvidia is the now,2024-02-26T17:29:34.510Z
Prestigious_Set4560,soundhound got me audibly barking rn,2024-02-26T17:53:12.910Z
juliettefriskey,I bought SPY calls and instantly lost half. I love this game.,2024-02-26T17:56:13.231Z
thep3nis,Whoever was the one person who said buy 0dte 507C you should never trade again,2024-02-26T18:38:20.788Z
OhCanVT,Reddit servers are fucking up. Puts on Reddit,2024-02-26T19:22:51.850Z
UnholyTrigon,I’ve been told SOUN cured cancer 5 times in a row today,2024-02-26T19:29:03.056Z
[deleted],Comment deleted by user,2024-02-26T19:41:04.221Z
WSBrookie,I bought the dip and the. Dip won.,2024-02-26T19:51:58.649Z
Watchadoinfoo,"Does SOUN have an SMCI regard level push in it, or is it time to take profits?
  

    Upvote if HOLD, downvote if SELL",2024-02-26T19:53:28.147Z
WallStreetYakuza,"LADIES & GENTLEMEN & THEMS, welcome to POWER HOUR",2024-02-26T20:00:43.812Z
[deleted],Comment deleted by user,2024-02-26T20:15:28.271Z
Void19911,"Has anyone else become more jaded with their day job after being relatively successful in day trading?
  
    Like, I'm now consistently tripling my monthly income to the point that I'm like, wtf, why am I working hard at work?",2024-02-26T20:27:09.734Z
Jazzlike_Farmer_636,Cathy Bought back into Nvda my brain doesn’t know what to do 🤯,2024-02-26T11:36:50.862Z
Jeeperg84,"-.02% on SPY premarket…WSB “noooo i’m fucked whyyyyyy?!?!?”
  
    Calm down regards",2024-02-26T12:13:27.242Z
[deleted],Comment deleted by user,2024-02-26T12:35:06.694Z
Frozen_Shades,Did you happen to notice Microsoft added Copoilot to your computer?,2024-02-26T12:37:39.829Z
ironexia,My gut is telling me today will be a big day,2024-02-26T12:41:59.550Z
Jelly__Rogers,Every day is a big day when you're 400 pounds fatass,2024-02-26T12:44:01.280Z
NaNaNaNaNaNaNaNaNa65,LUNR bros were flying high Friday - only to fall down and slam their cocks into the surface of the moon 😘,2024-02-26T13:17:04.709Z
Key-Following-2650,"I shit you not, the moment I sold Amazon at 175.9, it shot up..🙄",2024-02-26T13:20:07.299Z
SlaynArsehole,SPY open at 510 my Canadian gf is going to want sponsorship,2024-02-26T13:21:26.633Z
AreProbablyWrong,I hope you make money in the market today and do not take Reddit personally.,2024-02-26T13:34:44.088Z
VisualMod,"Ban Bet Won
u/Admirable_Database19 made a bet that LUNR would go to 7.5 within 1 week when it was 6.56 and it did, congrats autist.
  
    Their record is now 1 wins and 0 losses You're a part of the WSB Discord server, therefore you earned 10,000 coins for your win!
  
Join WSB Discord",2024-02-26T13:47:54.456Z
[deleted],Comment deleted by user,2024-02-26T13:48:33.158Z
kemar7856,Kayne this new album is dogshit,2024-02-26T13:54:33.335Z
rocquet,my spy puts,2024-02-26T13:55:24.005Z
Sh1ba_Tatsuya,rip my smci put,2024-02-26T14:12:54.950Z
Ryoujin,"If I was Warren Boffet, I would buy every stock ever made.",2024-02-26T14:14:43.598Z
AllTooWell31,"Found a mother-son incest post and it’s only Monday, going to be a good week for Reddit",2024-02-26T14:15:21.168Z
MrCouncilman,"Top is nigh in NVDA, randos depositing their $30 paychecks for fractional shares",2024-02-26T14:19:43.215Z
PFC321,Sup with SOUN. shits going too,2024-02-26T15:35:58.619Z
Extension-Metal-6168,SOUN to the moon and beyond,2024-02-26T15:36:25.953Z
ImWellEndowed,SOUN mooning,2024-02-26T15:41:51.083Z
WorkingCorrect1062,What a massive dump,2024-02-26T16:09:22.833Z
MarcoPolooooo,Up 1k to down 1k what have I done,2024-02-26T16:14:38.091Z
Interpersonal,Markets down 0.1% and people are blowing up their portfolios. Impressive.,2024-02-26T16:26:16.514Z
Rhynoster,Playing GOOG right now feels like that squidward meme looking out the window. All the other AI tickers enjoy big dick gains.,2024-02-26T17:10:19.633Z
Jelly__Rogers,To the dumbass that told me to buy SOUN this morning.........thank you,2024-02-26T17:27:15.424Z
wefrench98,Wtf Soundhound doing on no news?,2024-02-26T17:32:42.836Z
Low_Procedure_3538,"Soun just touched 5 for the briefest second. Soon, it’ll touch 50",2024-02-26T17:33:30.515Z
Unitedtendies,Pump this sound to $10 eow,2024-02-26T17:36:08.613Z
comikbookdad,Whoever said Bumble puts thank you 🫡,2024-02-26T17:55:40.949Z
[deleted],Depression nap sounds pretty nice rn,2024-02-26T18:15:47.449Z
Unitedtendies,SPY $500 is where you buy calls,2024-02-26T18:26:28.180Z
No_Indication6895,"508 calls are free money 507 calls are free money thank me later
  


    some dumbass on WSB
  


    **Not even 5 min later SPY dumps 60 cents more",2024-02-26T18:31:04.551Z
Six_Times,I have a gamboling problem,2024-02-26T18:36:41.432Z
ProfessorCommenter,The year is 2065… AMD is consolidating in the 170s.,2024-02-26T18:56:17.705Z
[deleted],Comment deleted by user,2024-02-26T19:08:17.357Z
spearthrower,Why doesn’t paying off my credit card bill give me the same rush as cashing out an option contract for +150%,2024-02-26T19:49:47.746Z
saw-it,NVDA holding a gun to spy’s head to prevent it from dumping,2024-02-26T19:51:36.401Z
kempog,Surely buying an option that’s up 9000% on the day is a good idea,2024-02-26T19:52:53.610Z
Dildosmoke69,"Currently on the precipice of being assigned 14,000 spy shares. AMA",2024-02-26T20:08:58.576Z
Grymninja,"NASDAQ up .1%, my portfolio up 15.5%",2024-02-26T20:18:09.389Z
Unknown-Personas,Made 4 dollars today. Already put in my 2 weeks at work and let my boss know I’m becoming a full time day trader.,2024-02-26T20:40:11.535Z
housemouse431,"somehow miraculously the second i sell my option it then becomes positive and worth like 1,000x more",2024-02-26T20:42:36.337Z
Jeeperg84,Thinking stuffed peppers for dinner...,2024-02-26T20:49:27.863Z
SchemeSuccessful7640,Unity to shit the bed after earnings,2024-02-26T20:50:20.791Z
minrknju2p0,So where is SOUN gonna be at Open?,2024-02-26T21:23:52.088Z
SnooShortcuts7911,Unity will be down 20% tommorow. Brutal.,2024-02-26T21:25:17.022Z
Ev11an,Die smci,2024-02-26T11:28:55.722Z
Ill_Try1620,"S & P 500 called
  
    ""huang?""",2024-02-26T11:31:49.149Z
kenathen,lmao.  still ppl buying lunr,2024-02-26T12:10:39.552Z
I-bmac-n,I keep seeing posts about lunr so let me share. 82% of shares are held by insiders and investors. 18% of shares are available for trading. You gards run it up over $1bn mc and then insiders dumped hundreds of millions of profit.,2024-02-26T12:27:19.947Z
ballmode,My puts are poop,2024-02-26T12:27:56.123Z
trainwreck001,"Nvidia Stock Gains. The Chip Maker Is Targeting the Telecoms Market. -- Barrons.com
  
    02/26/24 4:44 AM
  
    Nvidia was rising early Monday as its valuation hovers near the $2 trillion mark. The chip maker is pushing to expand artificial-intelligence technology in more industries, including telecommunications.
  
    Nvidia and ServiceNow said in a joint statement on Sunday that they would build generative AI offerings specifically for telecoms companies, with the first product being a customer-service platform. 
  
    NVDA $5k",2024-02-26T12:47:25.827Z
Ok-Veterinarian-2333,Calls on smci and nvda,2024-02-26T13:05:24.244Z
WSBrookie,The pain in my chest is from BRKB $440 -> $425 premarket dump not my morning bump.,2024-02-26T13:08:19.965Z
diggin-the-doge,I just want to trade well enough for Congress to call me in for a special inquiry.,2024-02-26T13:08:41.306Z
Frozen_Shades,"The smartest stock traders in history all started with daddy's millions.  Don't be fucking fooled, they all had a golden fucking ticket.",2024-02-26T13:09:40.868Z
cow_grass,Top is in spy 500 eod?,2024-02-26T13:10:22.447Z
Miserable_Message330,"CVNA is a very profitable company, if you ignore all their operating costs and pretend adjusted earnings are the real earnings",2024-02-26T14:25:15.946Z
shankshs,!banbet SMCI -25% 5d,2024-02-26T15:01:09.708Z
DJ_Hamster,Anyone else up today but planning to hold to 0,2024-02-26T15:32:11.153Z
Jeeperg84,This market is absolutely regarded,2024-02-26T15:36:03.225Z
saw-it,"Spy when NVDA goes up 25 cents: real shit
  
    Spy when NVDA dips $2: well ackshumally",2024-02-26T15:38:20.441Z
No-Fox-4742,All on SPY puts yolo,2024-02-26T15:52:50.195Z
Overlord335786,Yea if SPY could go to 505 that’d be GREAT,2024-02-26T16:00:51.459Z
