Author,Comment,Date
I_Eat_Groceries,"Market patiently waiting for me to sell my calls, then it moons",2024-02-26T16:06:12.239Z
Many-Mess3899,Margin calls are so stupid. Cant my broker just wait a few days for my -99% contracts to go back to the moon? We all know they will 🤞🤞🤞,2024-02-26T16:06:20.855Z
im-regarded,Maybe the guy on shrooms was right,2024-02-26T16:10:25.414Z
spellbadgrammargood,"rule 1: dont lose money
  
    me: continues to buy options on hopium",2024-02-26T16:12:48.553Z
JustLurkCarryOn,My goal was to take my $100k account to $150k this year.  Currently sitting at $124k let’s fucking gooooo.,2024-02-26T16:13:11.270Z
Anonymustafar,Do MMs accept clash of clans gems as payment for options?,2024-02-26T16:20:04.934Z
Unitedtendies,Dump more SPY,2024-02-26T16:20:13.300Z
ihadtopoop-,"My new girlfriend asked me why I'm checking my investments so much lmao ""investments"" wtf are those",2024-02-26T16:28:43.043Z
sloanemonroe,Apple Google Msft all down. Qqq green. Nvda has taken over.,2024-02-26T16:33:48.111Z
bel51,NVDA edging us at 799,2024-02-26T16:43:27.279Z
Necessary-Bag-1042,"Sell side pressure on spy actually looks good now so I came back....
  
    SPY will drop below $507",2024-02-26T17:01:46.128Z
saw-it,All these comments about SOUN are coming from fairly new accounts,2024-02-26T17:27:13.341Z
gayforgoblin,"One small step for man, one giant devastating blow to my net worth",2024-02-26T17:59:36.177Z
Overlord335786,"DO IT JEROME
  
    CAST SPY INTO THE FIRE",2024-02-26T18:02:47.875Z
[deleted],Comment deleted by user,2024-02-26T18:08:34.093Z
MrCouncilman,Imagine not buying the Google dip,2024-02-26T18:13:04.942Z
Meamigoyo,I hope y’all really didn’t get those 507c,2024-02-26T18:27:38.313Z
AssistantInformal797,Got some 0dte calls just now just to make sure this thing tanks everyone inverse for free gains,2024-02-26T18:29:00.880Z
Stunning-Option-6722,Now here you buy calls idiots,2024-02-26T18:31:24.636Z
DragonfruitMean9214,NVDA 850 calls 🔜🦍🦍🦍,2024-02-26T18:39:42.594Z
Allen1013,Sound to $30 eod?,2024-02-26T18:43:12.408Z
housemouse431,bears cant even get a real dip lol,2024-02-26T18:47:35.168Z
Opening-Somewhere218,Spy 503 today would make me cream,2024-02-26T18:49:44.833Z
BoorsBazar,SOUN  to the moon!,2024-02-26T18:50:37.166Z
SleepiestGuyAlive,SPY isn’t going to pump hard going into PCE. Get ready to get theta fucked or bull trapped all week. Scalping only.,2024-02-26T18:51:55.878Z
kyledemo,SPY 505 close,2024-02-26T19:01:54.208Z
PFC321,300% so far on SOUN. $1400 gain cause im a pussy,2024-02-26T19:03:38.994Z
Embarrassed_Dot6628,I want to spend money on stupid bets but all my money is tied up in my previous stupid bets,2024-02-26T19:33:01.450Z
[deleted],Comment deleted by user,2024-02-26T19:41:08.838Z
warlock22041,"what does $soun do

    SoundHound AI, Inc. develops inde-
  
    That's all I needed to know. Thanks!",2024-02-26T19:53:15.663Z
unevrkno,Image losing a shit ton of money because a piece of equipment tipped over on the moon.,2024-02-26T20:00:45.341Z
Dildosmoke69,"I, too, will expire worthless",2024-02-26T20:01:19.996Z
Void19911,$3k for the day and done. Today was a good day to be regarded.,2024-02-26T20:16:08.119Z
cbusoh66,New stock market rule: NVDA will never be allowed to close red.,2024-02-26T20:25:15.027Z
Sparky_SE81,Spy going back to 360 📉,2024-02-26T20:29:40.522Z
Cute-Internet-9129,Made 8k on MARA calls today,2024-02-26T20:33:39.134Z
Technical_Baby_6753,having 1 Put is making me crave the downfall of civilization... never again,2024-02-26T20:34:28.345Z
throwaway_tendies,"Regards sees a stock pop 50%:
  
    “Now seems like a good time to buy”",2024-02-26T20:40:21.981Z
sonofalando,Made $800 today,2024-02-26T20:53:09.636Z
owfueI,SOUN moon mission starting,2024-02-26T20:57:51.655Z
Virtual_Ad_3349,Went from 3k to 700$ today smg,2024-02-26T21:18:14.671Z
DJSourNipples,"Holding -
  
    MARA $25c 3/1
  
    CLSK $18c 3/1
  
    HIMS $11c 3/15
  
    BMBL $11.5p 3/1
  
    Let's go, your boy can buy groceries AND pay rent",2024-02-26T21:20:35.645Z
Lopsided_Constant901,"At least when I reported my Robinhood losses I went from owing the Govt 600 in taxes to winning 800 :3
  
    (yes i live with mommy and daddy)",2024-02-26T11:41:09.886Z
kuprenx,spy green. Humanity still has hope,2024-02-26T13:16:09.777Z
cle7756,!banbet NVDA $807.77 4H,2024-02-26T13:17:13.013Z
Born_wild,I just went to r/stocks and r/investing and it sucks!! What are they talking about there?? And so boring…,2024-02-26T13:20:50.730Z
EnginrA,"I love women!
  
    I love makin money!",2024-02-26T13:22:41.006Z
greyenlightenment,QQQ green as always . Apple  & goog red as always,2024-02-26T13:29:13.284Z
Disastrous_Ad3779,"Good morning bers, hello bols",2024-02-26T13:36:43.709Z
Ban_an_able,PANW👀,2024-02-26T13:36:47.160Z
MaDoge1,!banbet NVDA 1000 10d,2024-02-26T13:37:37.715Z
WYLD_STALYNZ,"News flash: God is REAL, he had a DISSATISFACTORY experience, and he is NEVER going back to Mexico",2024-02-26T13:38:17.280Z
Hl_IM_MR_MEESEEKS,Good moaning 🥱,2024-02-26T13:40:20.483Z
MediocreX,"Yall degenerate gamblers.
  
    Regards,
  
    W Buffet",2024-02-26T13:42:27.988Z
[deleted],"I need to make at least a million dollars today.
  
    I mean I won’t but I’d like that",2024-02-26T14:01:09.866Z
TheeJackSparrow,I just got approved to sell naked calls to you guys.  I'm selling some way OTM weekly calls on SMCI and NVDA.  See you on the battlefield.,2024-02-26T14:01:16.819Z
Ryoujin,nVida has been green for the past 420.69 days,2024-02-26T14:10:27.399Z
iamchromes,Spy opens green. My calls red,2024-02-26T14:11:36.606Z
DewaltMaximaCessna,Right now I’m in the phase where after a 6 month break from a huge loss where you get back to checking the market several times a day,2024-02-26T14:24:41.738Z
Bennylegend,"I come from the gutter. I know that. I got no education... but that's okay. I know the market, and I'm making all the right trades.",2024-02-26T14:26:16.401Z
iamchromes,When I bought NvDa calls. It stopped. I can’t make this up,2024-02-26T14:51:48.901Z
LockedIn2024,"THETA DAY, SIT ON THE SIDELINES TODAY AND THANK ME AT 4:00PM",2024-02-26T14:55:46.761Z
Swimming_Pea_7195,I wanna daytrade but today looks choppy af probably gonna wait til 3,2024-02-26T14:59:13.499Z
swiss_courvoisier,"SMCI out here like ""Hello from the other siiiiiiide""",2024-02-26T15:02:49.300Z
EternalBeThyAss,Absolutely zero volume. So tired of this lame shit. It’s always something,2024-02-26T15:16:43.627Z
JoChase956,SMCI makes me so irrationally mad. I can’t figure it out.,2024-02-26T15:21:49.363Z
bonsam999,NVDA IM FKN CUUUUMIN,2024-02-26T15:22:21.072Z
Gemini_Of_Wallstreet,NVDA WANNA GET 800 SO BAD,2024-02-26T15:23:43.255Z
Prestigious_Set4560,soun meme lords pushing it,2024-02-26T15:29:53.485Z
Prestigious_Set4560,soun to 5 ?,2024-02-26T15:30:49.862Z
Due_Ad_379,SPY refusing to go red after a $20 run is comical,2024-02-26T15:33:40.885Z
Johnny_Menace,Why is NVDA so afraid of $800,2024-02-26T15:37:40.234Z
GetKnifed,50% up for the day only down 75% for the year,2024-02-26T15:40:19.541Z
surcie,I just want to get rich enough to not have to use a cash account,2024-02-26T15:53:22.336Z
PutsOrCallsXD,"guys, think you can close your trading apps today",2024-02-26T15:58:11.337Z
TanSuede,"I only make money when I quick flip options. Like 10 min or less. 50% gains locked in.
  
    Chasing 10x plays ruins my account.",2024-02-26T16:01:48.321Z
Jerraldough_v2,I’m gonna die young if I keep gambling,2024-02-26T16:03:44.423Z
SpermBanking,I TOLD YOU THESE PUTS GONNA PRINT,2024-02-26T16:07:28.109Z
SpongebobSoundByte,Me frantically spamming Google searches to save my GOOG calls,2024-02-26T16:37:58.475Z
PerpetualHillman,Die CVNA you piece of shit,2024-02-26T16:41:25.083Z
harryburton420,alexis texas,2024-02-26T16:45:11.397Z
ironlegdave,SOUN calls finally about to print.,2024-02-26T17:00:28.354Z
Themostinternet,SOUN still pumping over +20%,2024-02-26T17:03:08.189Z
Sad-Inevitable-7260,SOUN rocket is LEAVING last call,2024-02-26T17:05:59.569Z
surcie,It’s going to be so embarrassing when the reason I’m poor is cuz Texas Roadhouse stock kept going up,2024-02-26T17:07:24.789Z
valciro123,ill be rich one day surely is not today,2024-02-26T17:08:25.779Z
Jelly__Rogers,Pre-Nut Delusion is worse than Post-Nut Clarity,2024-02-26T17:11:14.656Z
leaning_on_a_wheel,Do you all have jobs or no ?,2024-02-26T17:11:19.965Z
heycals,People hating on Google and Apple stock while using their iPhone to Google the stock prices,2024-02-26T17:11:55.426Z
Overlord335786,Is SOUN the secret buffet investment,2024-02-26T17:12:38.777Z
Sad-Inevitable-7260,Somehow SOUN bears look at this price action and think puts lmao  it’s fucking mooning don’t fight the trend anon,2024-02-26T17:12:53.400Z
Johnny_Menace,NVDA breaks $800 LFG 🚀,2024-02-26T17:25:02.781Z
Sad-Inevitable-7260,United States of SOUN,2024-02-26T17:30:34.961Z
TipsyFajita,"To whatever dumbass told me to buy SOUN last week, thank you

    Shits bussin",2024-02-26T17:32:42.365Z
WelpSigh,"imagine having the opportunity to buy reddit at the same price institutional investors pay, instead of the same stock at a 30% discount four hours after open",2024-02-26T17:34:57.578Z
BusGuilty6447,SOUN hit 5 for a second,2024-02-26T17:37:31.064Z
Easy-Peace-4669,SOUN needs to stop edging 5 and just break through,2024-02-26T17:37:47.633Z
twostroke1,"Got an email: “You have been invited to participate in Reddit’s IPO”
  
    … I don’t think I will",2024-02-26T17:42:25.409Z
PutsOrCallsXD,raise your hand if you held spy calls or puts over the weekend,2024-02-26T17:44:37.562Z
AssistantInformal797,“Buffet sitting on record cash but cannot find deals” yeah me neither Mr Buffy,2024-02-26T17:52:09.526Z
ItsyBitsySPYderman,Someone in here just asked what the ticker for SPX was.,2024-02-26T17:53:36.253Z
donefukupped,If Sundar resigns GOOG will probably rocket to $180,2024-02-26T17:57:42.384Z
michaeleatsberry,"Women are weak and foolish. I'm only going out with strong, intelligent men.",2024-02-26T18:08:07.844Z
Tim_Riggins_,$888 and I’m sending a smci put,2024-02-26T18:14:48.014Z
trumpdiego,So we're buying HPE and MARA calls because shroom gods told me anon on here to do so?,2024-02-26T18:17:35.968Z
WSBrookie,"“Berkshire Hathaway is now worth almost $1 trillion after post-earnings stock surge”
  
    WHAT SURGE",2024-02-26T18:28:20.189Z
Nils_Blum,⠀⠀⠀⠀⠀⠀⠀⠀⢉⣐⣂⢤⣄⣀⣀⣀⣀⣇⣼⡠⠀⠀⠀⠀⠀⠀⠀⠀⠀⠀ ⠀⠀⠀⠀⠀⠀⠀⢀⣀⡴⠛⠉⠉⠀⠁⠀⠀⠀⠉⠑⠦⡀⠀⠀⠀⠀⠀⠀⠀⠀ ⠀⠀⠀⠀⠀⠀⠠⡿⠛⠀⠀⠀⠀⠀⢬⢦⠀⠀⠀⠀⠀⠘⢆⠀⠀⠀⠀⠀⠀⠀ ⠀⠀⠀⠀⠀⠀⢸⠁⠈⠂⠀⡠⠒⠢⠀⠁⠀⠀⠀⠀⠀⠀⠘⡆⠀⠀⠀⠀⠀⠀ ⠀⠀⠀⠀⠀⠀⡇⣠⡿⠃⠀⠀⣴⣦⠃⠀⠀⠀⠀⠀⠀⠀⠈⠣⣄⠀⠀⠀⠀⠀ ⢀⣤⣤⣤⣤⣼⡓⠊⠀⠀⠀⠤⠿⠋⠀⠀⠀⠀⠀⡀⠀⠀⠀⠀⠈⠳⣄⠀⠀⠀ ⡸⣿⣿⣿⣿⣿⣿⠆⠀⠀⠀⠀⠀⠀⣀⠀⠀⠀⠀⠈⢄⠀⠀⠀⠀⠀⠘⢧⡀⠀ ⡇⠈⢻⠿⠛⠋⠁⠀⠀⠀⠀⠀⠀⣀⠆⠁⠀⠀⠀⠀⢘⡆⠀⠀⠀⠀⠀⠈⢷⠀ ⠹⡀⠘⡄⠀⠀⠀⠀⠀⠀⠀⣰⣿⠏⠀⠀⠀⠀⠀⠀⣸⣇⠀⠀⠀⠀⠀⠀⠈⡇ ⠀⠈⠐⠳⣄⠀⠀⠀⠀⣀⠔⠋⡍⠀⠀⠀⠀⠀⠀⠀⢻⣸⠀⠀⠀⠀⠀⠀⠀⣷ ⠀⠀⠀⠀⠀⠉⢻⡙⢏⠀⣀⠜⠀⡠⠊⠀⢀⣠⣤⣶⣿⡿⣇⠀⠀⠀⠀⠀⠀⡏ ⠀⠀⠀⠀⠀⠀⠀⠑⢤⣀⣠⡤⣾⣤⣴⣾⣿⣿⠿⠛⠁⠀⠈⠢⣀⣀⣀⣠⠞⠁ ⠀⠀⠀⠀⠀⠀⠀⠀⠀⠀⠀⠀⢻⠿⠟⠛⠉⠀⠀⠀⠀⠀⠀⠀⠀⠉⠁⠀⠀⠀,2024-02-26T18:28:24.722Z
SnooShortcuts7911,Tops in.   Buyers exhausted.,2024-02-26T18:31:41.764Z
[deleted],Comment deleted by user,2024-02-26T18:36:26.745Z
ziggs_ulted_japan,Ohkay. We're just gonna keep going down then. Just forever. No recovery,2024-02-26T18:38:11.147Z
gbninjaturtle,"NVDA down to levels not seen since… checks notes before lunch
  
    Anyway…",2024-02-26T18:39:54.539Z
RoyalFail6,I’m buying GOOGL bc so many here are hating on it…see y’all a few thousand up,2024-02-26T18:43:41.437Z
Running_OutOfTime,"Upvote for V
  
    Downvote for dead cat bounce",2024-02-26T18:44:17.742Z
[deleted],"Gonna max out my credit cards on gift cards then flee the country
  
    Nice knowing you all",2024-02-26T18:48:56.015Z
boxxa,What does SOUN even do?,2024-02-26T18:49:39.900Z
ARoseandAPoem,Goog delisting soon or what?!,2024-02-26T18:53:52.739Z
gopoohgo,Die SMCI,2024-02-26T19:05:05.736Z
NVDAismygod,NVDA causes me so much pain,2024-02-26T19:13:02.845Z
Unitedtendies,SOUN opens at $7,2024-02-26T19:23:59.554Z
DJ_Hamster,Okay I have to take profit on SOUN calls right???,2024-02-26T19:27:15.626Z
Baracsreddit,I feel SOUN is going to be entertaining,2024-02-26T19:29:19.950Z
Newerphone,"I need all your support. Going through a really tough time right now
  
    Tummy hurts",2024-02-26T19:33:22.910Z
Low_Procedure_3538,"Soun 8 tomorrow, 12 eow",2024-02-26T19:34:30.160Z
spartinofarrows,SOUN we BALLLLLL,2024-02-26T19:39:53.284Z
pigfucker5,how does one deal with unrelenting regret and fomo?,2024-02-26T19:43:04.685Z
bah2nah,"Everyone wishes they bought NVDA when Nancy bought in. Well, there’s your opportunity today. In PANW earnings call, they referenced to not getting a government contract. My guess is, in a few months, PANW will be awarded a huge gov contract.",2024-02-26T19:48:07.399Z
Peeeeech,NVDA 800 after close?,2024-02-26T20:15:08.221Z
Ill-Expression1737,who else is bankrupt,2024-02-26T20:15:30.420Z
WSBrookie,Was +140% now just flipped negative. Full regard.,2024-02-26T20:18:16.891Z
Sparky_SE81,Theta gang feasting today on bols,2024-02-26T20:19:19.210Z
nocashflow_,i have 2k to make 100k tomorrow,2024-02-26T20:20:03.815Z
drunktothemoon,"im so scared the 2 trillion AI bubble will burst and economic misery and ruin shall be inflicted upon my massive net worth of 10,000 DOLLARS",2024-02-26T20:21:43.464Z
analnapalm,"Sorry about MARA, everyone.  After sitting on the sidelines all day, I decided to buy calls at 3:06 pm.  My bad.",2024-02-26T20:24:14.483Z
bigfvckingbank,"THANK GOD I SOLD MY SPY PUTS.
  
    AND BOUGHT MORE.",2024-02-26T20:27:31.668Z
Macrophallus_Owner,Anyone else get skull-fucked today?,2024-02-26T20:28:21.840Z
MeetingKey4598,-25% on ZM incoming.,2024-02-26T20:34:51.755Z
Yourwifesboytoyy,"Only 6% of Harvard grads become millionaires, so odds are we all have a 50% chance here",2024-02-26T20:35:43.710Z
trumpdiego,Headline: BMBL Reports Huge Profit for first time ever! Announces new BMBL AI On-Demand Sexbot plans.,2024-02-26T20:40:01.518Z
UndeadMonarch1,"Honestly, SMCI should be under $800",2024-02-26T20:41:04.871Z
kk7766,"I was wondering why $COIN was up 17% today, then I saw this article and it all made sense
  
Cathie Wood’s Ark Invest sold $16 million worth of Coinbase shares last week",2024-02-26T20:46:55.545Z
_MrWallStreet,Full porting my Roth IRA with $10 2026 HOOD calls in early January looking real good right now. And my Roth is also on HOOD!!,2024-02-26T20:47:33.487Z
FairSlip9692,"Unity calls guy, calls not puts",2024-02-26T20:52:36.517Z
itsnotshade,CVNA price is a good reminder that efficient markets theory is fake news,2024-02-26T20:53:11.300Z
Massive-Quarter-4156,Holy shit it's Monday again and Thank god its Monday!,2024-02-26T11:03:38.116Z
xelyaJ,I have puts on SPY so I can assure you it’s probably going to 510 today. Happy Monday,2024-02-26T11:24:37.648Z
ShopBitter,Good Morning 🌞 ☕️,2024-02-26T11:37:51.417Z
Ballsmeetpets,"Futures flat as my gf’s ass.
  
    Jk I don’t have a gf.",2024-02-26T11:59:14.552Z
Cold-Lettuce8991,Spy 513 eod,2024-02-26T12:01:55.078Z
vteclover302,"Selling my Smci call and just playing weekly nvda calls, way more predictable and “safe”",2024-02-26T12:06:51.192Z
Cold-Lettuce8991,I’m betting lunr did a fraud,2024-02-26T12:12:18.867Z
Lolsmileyface13,even joe biden couldn't pump LUNR rip dead meme 2024-2024,2024-02-26T12:13:49.719Z
SnooDingos3776,Dear Tesla. Just rip face so I can get the fuck out lol,2024-02-26T12:19:50.107Z
6DeliciousInches,NVDL 210c 4/19 is going to 5x in 1 month,2024-02-26T12:29:27.019Z
lolikmomzy,So it turns out not taking profits holding over the weekend is not such a bad idea.,2024-02-26T12:33:42.166Z
Frozen_Shades,WMT stock split. $58/share now,2024-02-26T12:34:27.035Z
greyenlightenment,Am I the only one who does not care about Warren Buffett ai stock pick?,2024-02-26T12:47:14.333Z
EnginrA,"I once challenged a lesbian to a pleasuring woman orally competition (time to first orgasm, number of orgasms in 30 minutes) and I won easily",2024-02-26T12:48:59.481Z
TheOriginalBushToad,CNBC getting ready to talk about us regards.,2024-02-26T12:50:27.201Z
CultureForsaken3762,$127B of 2- and 5-yr USTs being auctioned today.  Buckle up Bulls,2024-02-26T12:53:33.974Z
AreProbablyWrong,"Yes, yes. Surely Downvotes will save your port",2024-02-26T13:05:24.537Z
Rausch,TSLA you need to save me this week,2024-02-26T13:13:57.260Z
cow_grass,I had a dream where Tesla hit 300 over night. And I was mad that I didn't buy calls.,2024-02-26T13:14:13.331Z
Myceliummmm,NVDA calls over the weekend were risky af. Shits up over 1% rn and I doubt I’ll make even 15% on them,2024-02-26T13:40:38.356Z
cow_grass,What the lunr doin.,2024-02-26T13:51:37.552Z
jokemon,"regarding reddits upcoming IPO
  

    What do you envision the funniest scenario to be?  WSB shorts the stock?  Memes?",2024-02-26T13:51:56.411Z
Myceliummmm,Cat was fucking around all night keeping me up and the dog threw up on the carpet while I was walking out the door for the gym. Might have to sit today out with how things are going,2024-02-26T13:53:33.019Z
31andnotdone,ALL CAWK NO BAWLS 🫵🫵🫵,2024-02-26T13:57:11.560Z
Stunning-Option-6722,full portfolio going on spy puts on open,2024-02-26T14:02:24.892Z
Spinosaurus1771,Nvidia gonna fail to break 800 then dump,2024-02-26T14:02:52.308Z
Brendan1620,All comments calling for spy puts at the open. So I’ll buy calls I guess,2024-02-26T14:05:58.957Z
optionsGPT,Nobody’s reporting the LUNR update. Guess they moved on lol. Hopefully we get some contract announcements at earnings,2024-02-26T14:08:29.220Z
cav19DScout,NVDA down to $770 then back up to $850 this week,2024-02-26T14:09:54.538Z
__Slick_iG_,Imagine buying a company called Snowflake lmao wtf,2024-02-26T14:14:37.576Z
Ok-Veterinarian-2333,New Nvda all time high every two days,2024-02-26T14:16:02.184Z
RagingBearBull,Maybe NVIDA is approaching overbought levels..,2024-02-26T14:19:03.734Z
yolodaily,Friendly reminder that even if you’re poor God still loves you,2024-02-26T14:23:33.059Z
BLOW_0,GIMME A FUKING EXIT PUMP TESLA,2024-02-26T14:25:43.710Z
SleazyAsshole,LUNR the moon is the other way buddy,2024-02-26T14:40:22.753Z
WSBrookie,+2k on the day see ya tomorrow,2024-02-26T14:40:50.440Z
cbusoh66,Is it me or does the market look a bit exhausted?,2024-02-26T14:55:04.589Z
TiggerHooo,MARA saving me from LUNR,2024-02-26T14:55:05.908Z
WYLD_STALYNZ,people should go to prison over CVNA lol,2024-02-26T14:55:39.730Z
LockedIn2024,"DONT LET MM USE YOUR MONEY FOR BLOW, CASH GANG ONLY TODAY",2024-02-26T14:56:34.424Z
projectwise5,took MARA call profits way too early,2024-02-26T14:58:50.504Z
lookingforajob2020,The ability of SPY/QQQ to simply refuse to stay red for an extended period of time is nothing short of astonishing,2024-02-26T14:59:45.284Z
tropicalia84,"+2% is the new green day
  
    Flat is the new red day",2024-02-26T15:05:40.599Z
Syab_of_Caltrops,"LUNR trading sideways, just like their Lander!",2024-02-26T15:13:53.306Z
Exclux,I bought an NVDA call for the first time in my life (perma bear),2024-02-26T15:15:54.016Z
Kingethan1208,MARA is wildinnnnn',2024-02-26T15:17:21.594Z
channndro,my heart goes out to those who bought LUNR at 11.93 😭😭💔💔,2024-02-26T15:21:20.693Z
Notyourhotcousin,MARA 30 EOD,2024-02-26T15:23:37.469Z
End-Game-1999,When you manage to land on the moon but aliens push over your spacecraft,2024-02-26T15:27:54.783Z
DJ_Hamster,Tf SOUN????,2024-02-26T15:30:39.900Z
FancyPirate69,!banbet SOUN $5.00 4d,2024-02-26T15:31:43.308Z
Extension-Metal-6168,SOUN fly,2024-02-26T15:32:02.563Z
galactaco,Spy don’t be greedy let go of a dollar or two,2024-02-26T15:34:10.353Z
kangadegen,SMCI is dead. Theta farm now.,2024-02-26T15:35:03.019Z
RuinedByGenZ,Did warren die or some shit?,2024-02-26T15:35:59.619Z
DragonfruitMean9214,Cmon NVDA 815,2024-02-26T15:37:42.451Z
MathematicianOk1218,"Own MSFT, GOOGL, AAPL and bought some SQQQ as a hedge. All 4 in the shitter.  GUUUHHH",2024-02-26T15:43:58.980Z
monochrome_f3ar,Only down 10% today this is fine this is fine 😫,2024-02-26T15:48:24.027Z
DooDoo1245,"Well my calls are dead, I’m out peace!",2024-02-26T15:53:51.443Z
nasty_nater,I wish gyms would take out 90% of the stupid weight machines and just add more squat racks and free weights.,2024-02-26T15:59:54.934Z
Diamondhands4dagainz,Should’ve yolo’d into PANW,2024-02-26T16:03:42.354Z
SpermBanking,SPY if you could just hit 506 real fast that would be great,2024-02-26T16:14:47.444Z
Frozen_Shades,"Me: Hey Schwab do I have unsettled cash?
  
    Schwab: All settled.
  
    Me : Makes trade.

    Schwab:  You shouldn't have done that.",2024-02-26T16:15:42.328Z
winner_in_life,How to cancel ban bet?,2024-02-26T16:17:08.035Z
Cute-Internet-9129,MARA just catching it's breath before it runs up to 30 !,2024-02-26T16:30:58.969Z
Real_Ad_7668,SPY looking pretty dumpy to me. Maybe I should wait it out,2024-02-26T16:31:27.165Z
Spectacl323,Can we just all buy NVDA calls like the tesla days and make money. Gay bers and regards come together,2024-02-26T16:33:13.989Z
[deleted],MARA keep going you saucy little minx,2024-02-26T16:35:24.067Z
ThatOneRedditBro,"Housing data was bad news
  
    Home prices up despite less demand.
  
    INFLATION",2024-02-26T16:41:37.839Z
aspiringgains,who else is iv crushed on spy puts,2024-02-26T16:43:16.868Z
[deleted],Comment deleted by user,2024-02-26T16:53:32.037Z
down_5_digits,NVDA having the battle of 800 for quite some time now,2024-02-26T16:53:36.436Z
SpermBanking,If we hit 506 SPY today I’ll record myself eating cat food,2024-02-26T17:01:17.572Z
Several-Actuator-585,SOUN $5 by eod,2024-02-26T17:04:11.653Z
oldspicecanyon,soun prob hits $5 by earnings,2024-02-26T17:04:15.087Z
billybeesesteak,SOUN needs to bust that 52 wk high wide open frfr,2024-02-26T17:29:02.443Z
Consistent-Platypus3,Soun is the next Smci confirmed (),2024-02-26T17:30:44.620Z
Dr_Stew_Pid,Thank you regards for putting SOUN in the green again!,2024-02-26T17:31:44.846Z
Evander85,"Gemini, Destroyer of Shareholder Value",2024-02-26T17:36:04.367Z
drunktothemoon,SOUN GOING TO 10$ SOON,2024-02-26T17:36:22.768Z
keyboardwarrior425,NVDA has the limpest dick right now. Stuck at 800,2024-02-26T17:40:31.300Z
waldenducks,I doubled down and turned a losing GOOGL position into an even bigger losing position. AMA,2024-02-26T17:42:19.603Z
But__Why_Tho,"Sold my failed SMCI puts, you're welcome for the imminent dump",2024-02-26T17:45:03.061Z
WSBrookie,Nancy is in on PANW,2024-02-26T17:48:45.255Z
humblepharmer,"I just got invited by Reddit to purchase shares at IPO price...I feel like this is a wake-up call, I am legit embarrassed",2024-02-26T17:52:25.242Z
Jeeperg84,Did you know the Average American male can't do more than 5pushups....what the fuck,2024-02-26T18:04:08.528Z
CHRIS_IS_MY_DADDY,"ok who the hell bought puts, why we got those green dildos now
  
    edit: nvm i see red now",2024-02-26T18:09:01.878Z
[deleted],Comment deleted by user,2024-02-26T18:13:10.262Z
distress_deez_nutz,VIX swimming to the bottom of the ocean on empty lungs with canon balls tied to its feet,2024-02-26T18:15:34.899Z
nerdy-nate,Bank locked my account because I’ve been pulling too much into options. This is my sign.,2024-02-26T18:16:04.114Z
proret4rd,Made 400% on my first SOFR contract. First one's free amirite,2024-02-26T18:16:18.471Z
thakid36,SOUN wants $5 sooo bad.,2024-02-26T18:19:08.461Z
__Slick_iG_,Spy rug pull,2024-02-26T18:27:13.923Z
UnholyTrigon,I love how my PANW calls fell 50% from peak but PANW puts barely moved 10%,2024-02-26T18:32:17.146Z
SpecificOk3905,google racist,2024-02-26T18:34:56.968Z
AJDillonsMiddleLeg,Keep going I'm gonna coom,2024-02-26T18:35:16.103Z
CHICKN_JO,$GOOG calls or naw,2024-02-26T18:36:35.050Z
BLOW_0,BEARS ACT LIKE WE ARE SUB SPY 400,2024-02-26T18:36:40.031Z
zg44,SOUN still looking strong near $5 as everything else sells.,2024-02-26T18:36:55.646Z
Investocks,It’s time for Sound Hound AI to make its move. Grab ahold of those tendies and join the ride!,2024-02-26T18:37:00.044Z
Disastrous_Dot_6941,"Bears are weird. Market up for months and the minute it drops an itty bitty amount, “bulls r fukt”",2024-02-26T18:40:06.437Z
HelloEveryone21,SPY 505 or less EOD,2024-02-26T18:44:44.516Z
SpecificOk3905,google so broke so woke,2024-02-26T18:46:36.479Z
nopenope12345678910,In and out of 200x spy 507c for 1k profit in 1:30s. Have a good rest of the day boys.,2024-02-26T18:49:32.536Z
_Zap_Rowsdower_,Would be nice if Soun 20 eod.,2024-02-26T18:49:51.197Z
[deleted],Comment removed by moderator,2024-02-26T18:51:48.210Z
Sufficient-Contact36,That Veronica Vaughn is one piece of ace,2024-02-26T18:53:50.852Z
cialonetc,calls on HIMS? errbody got ED nowadays,2024-02-26T18:54:21.063Z
Nils_Blum,just want a girl to crank on my knob every night,2024-02-26T18:56:38.940Z
co7y,tax man said im not required to file tax if i didnt even make money. is this real chat ?,2024-02-26T19:05:02.571Z
jlozada24,Why is Sound mooning?,2024-02-26T19:09:44.836Z
CaptainApeCommander,LMFAOOOO BULLS GOT TRAPPED NO FUK WAY HOL SHIT THIS IS COMEDY ITS A RECESSION HOLYYY,2024-02-26T19:09:51.155Z
