Author,Comment,Date
Able_Web2873,I am now a soun bag holder,2024-02-27T15:14:25.913Z
Unitedtendies,Who rugged soun. Fuk,2024-02-27T15:16:16.827Z
muzakx,Need NVDA to make that beautiful V recovery,2024-02-27T15:16:55.768Z
wallstreetsimps,Unity gonna turn green,2024-02-27T15:19:39.715Z
Very_Regarded,Smci no longer a meme stock. It behaves normally,2024-02-27T15:27:04.675Z
destroysaturn,What is this? Market for snails,2024-02-27T15:27:07.264Z
slimkay,BMBL now up nearly 5% today. RIP that put options trade.,2024-02-27T15:27:30.108Z
CommercialStandard0,Who is BMBL trying to fool lol,2024-02-27T15:30:36.672Z
Ghost1914,BMBL doesn’t care about that guys DD from yesterday,2024-02-27T15:31:10.809Z
Peach-State-Daddy,Literally only two people in here are mentioning LMND and it's probably the same guy.,2024-02-27T15:32:25.836Z
wallstreetsimps,wow Unity actually gonna turn green,2024-02-27T15:32:36.666Z
printeroutofinkagain,At this point I need Taylor swift to tweet LUNR,2024-02-27T15:40:50.626Z
Ghost1914,Guess I’m holding MARA through earnings,2024-02-27T15:43:47.722Z
Vivid_Complex_2399,"MARA dog shit why the fuck didn’t I sell my call at open, fuck these shitty ass miner stocks never touching them again",2024-02-27T15:44:09.299Z
Peach-State-Daddy,Saying the same ticker over and over isn't going to make you less broke. LMAO,2024-02-27T15:45:14.614Z
henryuzi,"worst type of day, fucking flat",2024-02-27T15:52:54.343Z
ScapedOut,Spy either go to fucking 508 or 504 im sick of waiting,2024-02-27T15:53:55.952Z
TheGager18,SOUN is coming,2024-02-27T15:56:42.997Z
ComfortableOwl0,"Holy shit I sold all my MARA calls at the top.
  
    God damn I have a huge boner",2024-02-27T16:08:57.740Z
Tim_Riggins_,Gimme a 10% correction I got some dry powder ready,2024-02-27T16:11:35.637Z
animositisomina35,Flatter than Zendaya.,2024-02-27T16:14:13.683Z
PutsOrCallsXD,spy has traded in a 1 basis point range for the last hour almost,2024-02-27T16:14:30.618Z
