Author,Comment,Date
nitroweb87,is that CELH ER leak real?,2024-02-29T03:19:50.686Z
KogaFuscia,"What just happened to mara, am I fucked",2024-02-28T18:28:51.856Z
SurvivedWayWorse,"Ya, that was a buzz kill.",2024-02-28T22:56:47.480Z
whitewashedsyrian,"Tomorrows pce will begin the correction, how severe it is will depend on how hot inflation is tmrw and the fed meeting in March. Got 15 480p expiring in may. Let’s profit",2024-02-28T08:32:57.720Z
squeezedeeznutzmayo,Nothing else matters besides AMC tomorrow,2024-02-28T02:05:27.194Z
MF_Paul_Bunyan,"Yeah, I thought about jumping in for old times sake.  But it's too unpredictable right now.",2024-02-28T13:17:42.649Z
Database-Greedy,Each upvote = 1 BMBL Put,2024-02-27T12:20:15.226Z
HeartWild9822,One upvote = 1 call on SOUN,2024-02-27T12:30:08.495Z
jglover82,Gonna stare at RH app for 8 hours while at work today,2024-02-27T12:10:50.761Z
free_lions,I like how bears basically just gave up on posting at this point,2024-02-27T11:17:03.932Z
shroomsnbeer,,2024-02-27T11:17:49.647Z
Zachincool,"My parents in their 30s: “let’s buy a house honey”
  
    Me in my 30s: “fuck my max bid of $6.20 for a Wendy’s burger was denied at this time”",2024-02-27T12:33:51.640Z
PlumpkinMunchkin,Holy shit you SOUN pumpers are annoying as fuck,2024-02-27T14:08:08.464Z
LookAtMeImInAGang,"Well, well, well, it looks like someone hacked my account and was posting crazy things when I was drunk yesterday.",2024-02-27T11:07:07.515Z
jdakidd13,I know it’s too late to jump in once people claim SOUN is going to $200,2024-02-27T13:09:37.640Z
throwaway0896z,Wendy’s adding “surge pricing” for fukin burgers,2024-02-27T11:17:36.647Z
Myceliummmm,"Went from starting with $8,000 in my account to making $5,000 yesterday and feeling nothing. Shit is just numbers on a screen lately and I don’t think that’s good for my risk management",2024-02-27T13:36:22.280Z
ziggs_ulted_japan,It straight up isn't. It doesn't feel like real money,2024-02-27T13:36:45.277Z
Orzorn,If BMBL fucks me its the only time I got a fuck from that app.,2024-02-27T21:02:30.533Z
free_lions,Imagine the market is at ATH and you are down YTD with worthless expiring puts,2024-02-27T11:13:58.958Z
icecoast44,"Sir, we’ve gone full meme on SOUN",2024-02-27T12:24:47.650Z
PerpetualHillman,"Lmao NVDA is down 0.3% premarket and this thread is saying it's ""crashing""",2024-02-27T13:47:58.094Z
Remote_Construction8,Right?  It could moon twenty bucks at open anyone knows,2024-02-27T13:49:09.105Z
Gemini_Of_Wallstreet,Sometimes i think i am regarded but then I remember people actually lose their life savings on options trades,2024-02-27T11:10:40.510Z
Gadshill,Some people also lose the savings of friends and relatives.,2024-02-27T11:16:58.212Z
mousepop321,"I might be down in the market but I got a hot Hispanic waiting for me at home 

    His name is Alejandro and says to “come up with the money or else”",2024-02-27T14:07:39.602Z
clerkcoin,OPEN THE CASINO IM READY,2024-02-27T14:21:21.285Z
HowLongCanIMakeACock,Dame I just bought a baconator at day high,2024-02-27T18:17:21.655Z
Zachincool,Can’t believe my dad bought SoundHound last week cuz Cramer told him to and now my dad is up 60% in a day and I’m down 86% for the year,2024-02-27T12:15:39.010Z
bel51,Is it insider trading if the direction of today's market was revealed to me in a dream?,2024-02-27T11:10:34.866Z
Abby-Larson,That's existential trading.,2024-02-27T11:13:16.932Z
[deleted],Comment deleted by user,2024-02-27T12:03:26.529Z
[deleted],Comment removed by moderator,2024-02-27T11:11:30.969Z
FrostingSubject4201,You know people talk a lot of hoopblah about wallstreetbets but I’ve made a decent amount of money trusting some of these guys calls just take everything with a grain of salt and do your own research as well you know,2024-02-27T11:13:45.028Z
Overlord335786,"Today the LUNR lander dies
  
    RIP",2024-02-27T11:27:58.537Z
ziggs_ulted_japan,Fuck it. Bought 350 shares of mara,2024-02-27T12:33:35.230Z
FemaleEcho,"Monthly percent gains have quadrupled since I stopped trading spy 0dte’
  😢",2024-02-27T11:15:31.283Z
Assaaaad911,"90% of gamblers quit before winning big. So anyways, just deposited another 1k to my brokerage account.",2024-02-27T12:42:30.171Z
UndeadMonarch1,"So basically I’m so fucking regarded, I coulda sold my SMCI poots for $7k, but now I’m down 90%",2024-02-27T20:08:19.658Z
DamnMyAPGoinCrazy,Pencils fucking down!!!,2024-02-27T21:00:28.805Z
xRICHxPIANAx,That dude really lit himself on fire for Palestine,2024-02-27T11:38:49.715Z
stonks_go_upp,lemme get a woof from my SOUNd hounds,2024-02-27T13:05:40.663Z
CarBatteryNipple,Nobody can hear LUNR morons scream because there's no SOUN in space,2024-02-27T14:13:31.178Z
Consistent-Platypus3,Maybe that Nvidia triple top guy was on to something,2024-02-27T14:44:23.381Z
StartingFrScratch,"So, this is what trading is all about, isn't it?
  
    The 5-minute high of seeing unrealized gains, but realizing a 30% loss.
  
    The imagination of making money overshadows the inability to take profit.",2024-02-27T15:07:47.634Z
Gemini_Of_Wallstreet,"AND NVDA IS BACK IN GREEN 
  
    BERS GET FUKD 
  
    🐻👌👈",2024-02-27T17:14:36.376Z
Ok-Veterinarian-2333,Made five losing trades in a row. I’m frustrated,2024-02-27T18:13:02.039Z
Loose_Meat_Sandwich_,9:31am: I am the Wolf of Wall Street 3:59pm: I am a wolf with mange,2024-02-27T12:00:18.537Z
wowthisguyoverhere,Don't be a bitch. At least play SOUN calls until earnings. Don't be such a fucking grinch and kill the vibes.,2024-02-27T12:11:06.352Z
jaypowwow,You all have great big cocks and I’m proud of you,2024-02-27T12:36:42.687Z
CumOneCumAllCumInYou,SOUN up 22% on the day and people in here acting like it's -22% lmao,2024-02-27T15:20:47.372Z
WTFspy,"Nvidia CEO 2023 compensation: 21 million
  
    Reddit CEO 2023 compensation: 193 million",2024-02-27T15:34:52.086Z
freehouse_throwaway,pack it up boys. its theta day,2024-02-27T16:02:58.910Z
AirborneMarburg,"You regards need to learn that once a ticker is getting hyped in WSB, it’s probably too late for you to enter.",2024-02-27T16:54:21.338Z
Randomsomedude,I’ve lost so much money,2024-02-27T17:55:41.992Z
[deleted],blew up my account between yesterday and today…,2024-02-27T18:27:43.130Z
baconography,BMBL will report that they are launching a new AI service: Artificial Insemination,2024-02-27T18:34:35.534Z
Thatguy19901,Imagine the market pumping because you were laid off. Like damn your employment was a drag on the economy.,2024-02-27T19:48:04.241Z
trumpdiego,Me losing $6K today 😭Me getting a $2.16 amazon e-gift card from the lithium ion battery settlement 🥳,2024-02-27T20:29:32.712Z
juliettefriskey,"🎶Look at this photograph, every day it makes me laugh🎶
  
🐻👈🤣",2024-02-27T11:09:15.707Z
xRICHxPIANAx,Bout to make coffee.. who wants a cup? 👊🏾,2024-02-27T11:15:41.914Z
Lopsided_Process5141,Just finished mine. Bout to shit. Who wants a smell?,2024-02-27T11:16:58.840Z
False_Profit_of_WSB,LUNR gonna be testing 3s today huh?,2024-02-27T11:50:28.888Z
parsley_lover,Bears saw a red day and bought puts. God have mercy on them.,2024-02-27T12:50:17.373Z
Traditional_Wing_187,so this sub called bitcoin a scam at 15k and is now coping by buying bitcoin miner stock 0dte calls after the stock is up 1000% in 14 months. what could go wrong,2024-02-27T13:46:35.775Z
wsb_mods_R_gay,Is soun gonna create another baholder community?,2024-02-27T14:20:15.795Z
Deesco5,FOMO is a helluva drug,2024-02-27T14:26:14.660Z
WallStreetYakuza,SOUN will replace every fast food order taker in the world,2024-02-27T14:48:18.679Z
Diamondhands4dagainz,"Lol Nancy has become a self-fulfilling prophecy. Everything she buys will just go up once she makes it public, because everyone wants to follow her trades.
  
    Insane.",2024-02-27T15:04:18.657Z
[deleted],Comment deleted by user,2024-02-27T15:13:57.178Z
tendiemountain,SOUN bags are going to be heavy.,2024-02-27T15:15:00.264Z
mousepop321,"Just so you know guys, that drop on SOUN is because I bought a single option at the top",2024-02-27T15:15:18.314Z
But__Why_Tho,"that regard's gonna be wrong about BMBL falling 25%, isnt he?",2024-02-27T15:22:21.692Z
ConcentrateOdd8190,"Just fking kill me,I don't want to trade this market anymore",2024-02-27T16:01:04.743Z
Thatguy19901,Idiots bought MARA calls after a 30% run up and wonder why it's tanking 😂 (I'm idiots),2024-02-27T16:19:01.759Z
prince_8814,Keep quiet and sell high.,2024-02-27T16:25:00.351Z
1984isnowpleb,"My trading strategy be like
  
    Double it and give it to the next person",2024-02-27T17:16:02.612Z
TanSuede,"Made $7k last week 

    Lost $5k today",2024-02-27T17:21:27.534Z
0dteDestroyedMyLife,started college 2020 --> they locked everything up so I never met any other students and made friendshipsnow --> finished my CS degree but now there are no jobs available anymore in techi truely have the best timing in lifefuck you,2024-02-27T18:41:53.588Z
Interpersonal,Oh wow Apple is investing in AI? Better pump trillions into the market.,2024-02-27T19:37:46.238Z
Allen1013,Nothing better then opening a new option and RH immediately tells me it lost 20%,2024-02-27T20:01:18.974Z
vegaseller,"the human instinct is to be a communist, to sell your winners and hold your losers. The first step to being a successful capitalist is learning to ditch your losers and double down on your winners.",2024-02-27T20:09:55.352Z
Johnny_Menace,Anyone holding SOUN overnight?,2024-02-27T20:36:16.046Z
ckami_91,Imagine being so regarded that you pay a subscription to have girls swipe left on you 🐝🐝🐝,2024-02-27T20:53:53.053Z
juliettefriskey,"Bears?
  
Bears?
BEARS?
    Nope all dead.",2024-02-27T11:03:21.805Z
Sensitive_Pilot3689,Too much r/sounding talk rn,2024-02-27T11:50:56.218Z
Gemini_Of_Wallstreet,Is a daily 2% rise in NVDA too much to ask?,2024-02-27T11:57:14.901Z
icanreadu,SOUN will open 25% up after a 50% up day yesterday and there will be regards buying calls at open and making money…props cus I ain’t got the balls I see it all the time but it’s just too regarded for me,2024-02-27T12:18:33.963Z
[deleted],Comment removed by moderator,2024-02-27T12:48:46.555Z
jusjones314,C3 not getting the AI bump but having AI as their ticker is hilarious 😂😂😂,2024-02-27T13:22:24.104Z
Eastern-Cranberry84,Age of Empires 2 is older than some of you.,2024-02-27T13:36:53.578Z
OakyTheBear,"U.S. Treasury Secretary Says Believe Israel Actions Are Having Adverse Impact On Palestinian Economy And Israel
    uh, yeah?",2024-02-27T13:52:23.154Z
VanguardDeezNuts,"Will NVDA win the fight for 800 and stay there? Stay tuned, for the fight begins in 7 minutes!",2024-02-27T14:23:45.660Z
theknowndudereturns,"HELP, bought SOUN at 7.90 what do i do now",2024-02-27T15:09:47.085Z
[deleted],Comment removed by moderator,2024-02-27T16:52:02.986Z
ModelloVirus,"Lots of low karma accounts shilling soun, yup staying away.",2024-02-27T17:01:19.143Z
Chrg88,Only need five 10 baggers in a row to quit this job,2024-02-27T17:25:28.447Z
AdornVirtue,So is YouTube basically soft core porn now like all the other rotten social media sites? Front page all I see are “influencer” ass and tits,2024-02-27T18:19:15.383Z
drewsaster,Fuck you Tim Apple for ruining my SPY short play,2024-02-27T19:28:58.531Z
Thepiguy1,"AAPL when TSLA is going bananas: “we’re going to make an Apple car!”
  
    AAPL when NVDA is going crazy: “FUCK THE CAR, we’re all in on… A….. I”",2024-02-27T19:34:27.927Z
uncivil_engineer42,Breaking: Apple is transitioning from $market_buzzword1 to $market_buzzword2,2024-02-27T19:45:29.379Z
rchung68,I’d be ruined if Bumble doesn’t tank AH,2024-02-27T20:09:26.640Z
Kreigmeister,BUMBLE MISSED SO BAD WHY ISN'T IT FALLING,2024-02-27T21:31:52.734Z
[deleted],Comment removed by moderator,2024-02-27T13:11:17.297Z
krunkpunk,Always follow Nancy. PANW!,2024-02-27T13:32:07.983Z
Johnny_Menace,NVDA died so Tesla could live,2024-02-27T13:40:19.609Z
alfapredator,"everyone calling this an NVDA ""crash"" needs to get banned immediately.",2024-02-27T13:46:14.154Z
Traditional-Fix2130,When I have puts in Tesla it goes up. When I have calls on Tesla it goes down. Why me,2024-02-27T13:57:48.018Z
harryburton420,anyone else on the toilet,2024-02-27T13:58:21.358Z
ScapedOut,TSLA legit has a regarded mind of its own,2024-02-27T14:02:41.975Z
[deleted],Comment deleted by user,2024-02-27T14:11:32.668Z
gbninjaturtle,"Bears! NVDA down .08%
  
    Market Crash imminent!
  
shakes bear treats",2024-02-27T14:12:28.253Z
31andnotdone,do you guys listen to eye of the tiger in pre market while you jerk off,2024-02-27T14:21:11.670Z
SilkyThighs,"Create algo to pump corn
  


    Other algos catch the bait and pump corn stocks
  


    Algo also sells a ton of high IV options
  


    Tank the corn price by exiting
  


    IV and options die
  


    Can i have enough $$ to do this, too",2024-02-27T14:21:55.852Z
[deleted],Comment deleted by user,2024-02-27T15:28:11.169Z
Thatguy19901,Thought I bought the MARA dip but there was a dip playing a dip disguised as another dip,2024-02-27T15:52:52.968Z
Spinosaurus1771,This is the most painfully boring week I’ve witnessed in a long time,2024-02-27T16:01:50.812Z
MachokeTheCryptoLord,Mara movement makes 0 sense. Fuck it. I'm holding.,2024-02-27T16:12:04.552Z
Peach-State-Daddy,"My coworker was sending me screenshots all morning of his MARA gains in his 401K, he's not replying to me anymore on Teams. LMAO",2024-02-27T16:12:34.456Z
Individual_Error_428,Oh man bears r coming,2024-02-27T16:24:22.861Z
lukeiscool22,Easier to hold when you’re dead inside 🐂,2024-02-27T16:33:32.086Z
Robb-san,Why is it called S&P 500 when 493 companies are completely irrelevant???,2024-02-27T16:54:17.188Z
peterpeer9,"Expectation: I made $450,000 YOLO'ing my port into 0DTE calls for earnings, fuck all y'all, I QUIT!!
  
    Reality: I blew all my savings again. Please don't fire me",2024-02-27T18:48:02.315Z
amazzajr,Jesus they trapped the bears.........again..........wow,2024-02-27T19:01:02.059Z
Such_Coin,Gave up on my puts. Let the drilling commence,2024-02-27T19:04:16.548Z
Dielawnnx5,It’s funny. I risked 13k to lose $7k. Actually it’s not funny it’s just irresponsible.,2024-02-27T19:40:59.932Z
ConversationMajestic,My BMBL puts haven’t moved since one- it’s the calm before the absolute smack down my put are about to get after BMBL announces they’ve made AI gfs. Prepping my Wendy’s dumpster already.,2024-02-27T20:35:52.036Z
EconomyNeat175,Im so nervous for my bmbl puts holy fuck,2024-02-27T20:52:52.397Z
kingpablo421,"Can't get fucked on bumble, but bumble fucks you. Lol.",2024-02-27T21:17:58.511Z
Altruistic-Hornet977,WTH Beyond Meat???? 85%? AI meat? Wtf is this BS?,2024-02-27T22:01:09.872Z
ironexia,The europoors saved us,2024-02-27T11:03:59.509Z
Qertyp,,2024-02-27T11:05:15.537Z
NTG97,My favorite part about the stock market is walking up at 5 am with a massive boner waiting for 9:30 to hit,2024-02-27T11:30:18.392Z
[deleted],Comment removed by moderator,2024-02-27T12:46:24.999Z
yeahnah09,"why is unity going up, crash bitch",2024-02-27T13:18:22.159Z
31andnotdone,"CAWK TO THE SKY AND BUY BUY BUY
  
    STOCKS ONLY GO UP
  
    GET HARD, GO LONG.",2024-02-27T14:24:29.193Z
Naive_Classic2746,God speed regards,2024-02-27T14:24:45.955Z
Very_Regarded,I’m chasing the high of when I made 210k in a day last week with PANW puts. Just gonna keep losing if I don’t get my head straight,2024-02-27T15:25:53.210Z
Peach-State-Daddy,All of the people yelling SOUN calls have gone silent as their internet and phone plans got shut off.,2024-02-27T15:34:55.823Z
BreakfastOver3618,Why is my wife using BUMBL rn,2024-02-27T15:41:15.543Z
Ok-Pomegranate-1641,If I was a woman id just play with my tits all day,2024-02-27T15:42:19.968Z
kenwright9881,I suck at trading,2024-02-27T15:44:49.286Z
surcie,why do I insist on ruining my own life with 0dtes,2024-02-27T15:49:57.024Z
OGWFORLIFE,I hate this shit bro. I truly hate this shit. Only reason I come back is to make a little bit of money to get by in this expensive ass fucking world. But nope. It’s just impossible even to make a fucking $1 it’s just too much to fucking ask for,2024-02-27T15:56:26.793Z
DanORourke42,SPY dumping today. I feel it in my plums,2024-02-27T16:19:06.544Z
Bulky_Negotiation850,"We're gonna drill into the inflation report on thursday.
  
    I'm ok with that.
  
    No you know why all those insiders have been selling.
  
    We're at ATH's FFS Peeps!",2024-02-27T16:26:12.475Z
ActInteresting1344,Gambling on NVDA feels like a blood sport.,2024-02-27T16:57:06.845Z
31andnotdone,I just need a -1% day 🥹🥹,2024-02-27T17:58:12.426Z
Interpersonal,SPY went from -0.2% to -0.1% and the bulls are cheering.,2024-02-27T18:20:03.405Z
tropicalia84,"2000 Apple employees working on the canceled EV project.
  
    The report that “Several employees” will be shifted to an already existing known AI project caused it to jump 2%.
  
    This market is the fucking best.",2024-02-27T19:50:44.673Z
PutsOrCallsXD,when apple was at 180.06 the rope was just about to close around my neck . then tim apple took pity and rescued my calls,2024-02-27T20:11:28.652Z
0dteDestroyedMyLife,I move the market,2024-02-27T20:23:39.363Z
Overlord335786,"SOUN: goes from 7.20 to 6.90
  
    WSB: Collective GUH",2024-02-27T20:25:24.078Z
RickGrimes1000,Bumble puts anyone?,2024-02-27T20:51:37.143Z
WSBrookie,"Portfolio recovered 83% today from its lows.
  
    Jesus Christ.",2024-02-27T20:53:01.804Z
dicktoballratio9000,Fuck whoever said BYND puts,2024-02-27T22:07:19.174Z
Abby-Larson,Squatting on my SOUN and PLTR until my ass hurts.,2024-02-27T11:12:26.537Z
Ok-Cardiologist6793,Every company market cap can be tripled within days by just management saying they are implementing AI and blockchain to their ecosystem.,2024-02-27T11:13:55.679Z
TheAngryShitter,Soun,2024-02-27T11:28:21.301Z
Turns999,Bumble is gonna tank today ! get on the puts,2024-02-27T12:51:29.745Z
[deleted],Comment deleted by user,2024-02-27T13:03:08.955Z
iBoughtAtTheBottom,Mara calls printing Tesla puts decimated,2024-02-27T13:12:24.256Z
Ballsmeetpets,"My three most pleasureable dumps:
  


    SPY
  


    QQQ
  


    The morning dump during a hangover 🤤",2024-02-27T13:22:39.630Z
animositisomina35,Buy calls on every single stock that has options. That way you're guaranteed to be in on Warren Buffett's mystery stock.,2024-02-27T13:28:07.793Z
SINYACHTA,"Options used to be cheaper, now you need a 15% drop to double your money on earnings. I hate optionflation",2024-02-27T13:33:12.393Z
LUVS2GAPE_MENs_ANOOS,"TESLA NEEDS TO SKY ROCKET
    MEN !! GET YOUR ASSHOe READY
  
    TESla needs u !!!!
  HULK HOGAN REAL AMERICAN",2024-02-27T13:38:44.434Z
MarcoPolooooo,That triple top post on nvda was something else,2024-02-27T13:40:20.827Z
BearContra,It's probably Cathy buying up U after garbage earnings,2024-02-27T14:10:30.815Z
[deleted],Comment removed by moderator,2024-02-27T14:12:08.728Z
Low-Wear-168,Gdp tomorrow. We are mooning today to fuk bers,2024-02-27T14:20:24.930Z
free_lions,CLOSE THE CASINO,2024-02-27T14:21:38.799Z
optionsGPT,I like birds. Might take up bird watching,2024-02-27T14:22:42.429Z
Anxious_Possession_4,Grilled a ribeye last night. My farts smell like Montreal Steak Seasoning,2024-02-27T14:22:42.549Z
Objective-Brick-6945,OPEN THE CASINO,2024-02-27T14:26:24.804Z
Dielawnnx5,Got excited when I saw a triple top and drop and then realized it was my own account,2024-02-27T14:28:08.774Z
im-regarded,Took profits on SOUN yesterday like a pussy,2024-02-27T14:48:28.341Z
Life_Record_4935,Smci to 600,2024-02-27T14:50:40.978Z
kidicaru59,SOUN goin to $15,2024-02-27T14:52:19.926Z
packetdenier,SOUN IV like 600% lol,2024-02-27T15:06:47.608Z
channndro,sold the soun to buy more soun 🫡,2024-02-27T15:08:50.287Z
jglhk,Puts are impossible to make money on in this market,2024-02-27T15:14:41.658Z
channndro,fuck i thought soun dropped hard but i was looking at lunr by accident,2024-02-27T15:15:31.408Z
[deleted],Comment deleted by user,2024-02-27T15:17:09.391Z
YouOk2157,"SOUN, I need you to hit fucking $8.50 please and thank you",2024-02-27T15:22:22.332Z
SnooDingos3776,She’s a 10 but thinks the fed is gonna cut rates next month,2024-02-27T15:47:19.685Z
nadoterisback,MARA bankrupt and delisted by 4pm,2024-02-27T16:16:44.520Z
Star_Lord924,Somebody poke PANW and tell it to wake up and get the fuck back into the 320s,2024-02-27T16:27:09.632Z
ballmode,My puts aren’t putting,2024-02-27T17:00:30.161Z
HelloEveryone21,SPY 504.50 EOD,2024-02-27T17:01:40.158Z
d1rtyd1x,Cava is up because the misguided tards were trying to buy cvna and got confused,2024-02-27T17:02:41.990Z
Jumpy_Elevator_6603,pamp and damp,2024-02-27T17:17:15.549Z
[deleted],Comment deleted by user,2024-02-27T17:41:14.101Z
DovahkiinAF,who here got BMBL puts? 💰,2024-02-27T18:03:26.655Z
IRunFast24,The person on the other end of my trades today is doing really well.,2024-02-27T18:06:05.869Z
blckjacknhookers,Girls drool -- Who thinks bumble fumbles earnings tonight and price drops AH ??,2024-02-27T18:28:51.135Z
Jeeperg84,So BMBL takes it's tumble at 1630 right?,2024-02-27T18:29:00.945Z
bullrfuk,"Nvidia CEO predicts the death of coding — Jensen Huang says AI will do the work, so kids don't need to learn
  

    LMAO",2024-02-27T19:06:42.332Z
NVDAismygod,I have 25K in call options on one stock. This is make or break time. Need a 10x bagger,2024-02-27T19:40:18.317Z
Eastern-Cranberry84,I don't even know what I do at work anymore,2024-02-27T19:56:02.484Z
peterpeer9,imagine waisting your entire day to watch. a line move to the right,2024-02-27T20:01:20.712Z
Goody2Shoes92,Am i really listening to some guy on the internet with my life savings about a dating apps earnings,2024-02-27T20:08:32.378Z
Unknown-Personas,I’m starting to suspect that SPY isn’t even a real company…,2024-02-27T20:24:50.789Z
kenathen,human will soon realize all these Ai pump was generated by Ai so that Ai can grow stronger and control human,2024-02-27T20:30:15.040Z
Cobine,game over man game over,2024-02-27T20:31:52.347Z
Jmr15002,Just sold my $510 SPY calls exp tomorrow at 40% loss. Watch it moon to $512 now.,2024-02-27T20:37:31.505Z
Tim_Riggins_,Inversing wsb on earnings is undefeated,2024-02-27T21:19:36.899Z
Kreigmeister,Bumble can you just go to hell already,2024-02-27T21:35:48.773Z
Make-dollars,LUNR time to buy?,2024-02-27T11:18:06.363Z
xRICHxPIANAx,Wake up. Black coffee. Shart.,2024-02-27T11:37:43.795Z
dreamwagon,Not sure about fundamentals but SOUN is about to meme hard af,2024-02-27T11:52:19.215Z
DanceDifficult8571,Is soun a pump and dump? I don't know anyone who uses the app,2024-02-27T12:23:41.356Z
zg44,"SOUN up another 27% on just 12 million shares pre-market.
  
    Today could be a 400 million volume day (twice the float).",2024-02-27T12:35:01.844Z
madkiki12,Wtf VKTX just went 100% on daily,2024-02-27T12:51:37.863Z
Muted-Bug-305,"Guys just woke up from a coma, super excited to see that 🌽 is flying again! Any ideas why my FTX login doesn’t seem to be working, I had a lot invested there. Is the website down?",2024-02-27T12:59:40.251Z
heizenbergbb,60k EOW or I set myself on fire.,2024-02-27T13:11:44.172Z
bmault,BMBL gonna fumble again today?,2024-02-27T13:15:17.811Z
CumOneCumAllCumInYou,"Think there is going to be some heavy profit taking on soun at open, then those poor bastards will regret what they've done about 5 minutes after.",2024-02-27T13:20:51.688Z
OakyTheBear,"Excuse me. I was told to just ""buy calls."" Where's my money?",2024-02-27T13:21:09.573Z
anidodina,Lunr drilling to the earth's core instead of the moon,2024-02-27T13:25:34.197Z
WSBSKINNY,SOUN bout to run on open,2024-02-27T13:36:54.176Z
Long-Blood,Yellen with a surprise press conference to try to save markets again,2024-02-27T13:37:31.081Z
TheDudeAbidesFarOut,TSLA melt-up to 240. LFG rocket boy,2024-02-27T13:38:49.016Z
RH_Fucked_My_Account,I'm still a coward cash gang 🥲,2024-02-27T13:46:27.699Z
Affectionate-Idea690,"US Treasury Secretary Yellen: I am not seeing risk of a US recession.
  
    US Treasury Secretary Yellen: I assume inflation will move closer to 2% as year goes on.
  
    US Treasury Secretary Yellen: The US economy doing extraordinarily well, but I wouldn't be surprised if growth came in under 3.1%.",2024-02-27T13:56:49.471Z
[deleted],Comment deleted by user,2024-02-27T14:02:07.141Z
beerstearns,hi guys im sorry but my mom says i cant come over and play stock market today since i still have to do my homework,2024-02-27T14:02:21.815Z
Chrg88,Explain to me how car insurance rates rise as your car depreciates assuming ZERO incidents,2024-02-27T14:15:06.198Z
trainwreck001,SALTY BERS GETS NO BUSSY,2024-02-27T14:16:50.518Z
Sharkkboy6,First 15 mins about to be hella violent,2024-02-27T14:25:34.461Z
SnooDingos3776,HERE. WE. GOOOOOOO,2024-02-27T14:29:13.438Z
theknowndudereturns,in 1000 shares at of SOUN at $7.0,2024-02-27T14:33:00.452Z
poquito__burrito,do we see SOUN closing at above $8?,2024-02-27T14:56:50.806Z
Bronto_Chad,"Just remember 99% of the people commenting here have a portfolio less than $10k , they can only do 3 day trades per week lol",2024-02-27T14:57:01.024Z
Prestigious_Set4560,this soun shit is next bbby,2024-02-27T15:01:52.373Z
Visible-Mix9780,Welp I’m out of here. Lost all my money. 11k in a week. It came & went faster.,2024-02-27T15:06:28.053Z
brondoplantscraveit,"If you’re playing SPY, just play NVDA. There’s no difference in price action at all.",2024-02-27T15:06:53.531Z
Prestigious_Set4560,mariokart race music plays in my head when i wake up to play with stonks,2024-02-27T15:15:35.113Z
