Author,Comment,Date
Fox_n_Roll,If this goes green today it's steak dinner. Bought S&P calls right at the bottom,2024-02-20T12:11:35.986Z
housemouse431,smci stands for suck my cock idiots,2024-02-20T12:26:05.385Z
WorthFaithlessness51,"Forget smci, watch LLY close 800+ eod",2024-02-20T12:36:56.853Z
free_lions,SMCI is either gonna moon at open or tank to he depths of hell. Lots of people are going to be very rich or very bankrupt,2024-02-20T13:07:15.393Z
Few_Tax6394,Another sideways day everyone is screwed 🤣🤣🤣,2024-02-20T13:18:38.712Z
Berto_,"Some of you fomo'd and held SMCI puts on Friday after taking a loss on your calls.
  
    Show yourselves!",2024-02-20T13:36:50.176Z
trainwreck001,"SMCI WITH THE LET MY NUTS HANG CHART FORMATION. BIG VEINY GREEN DIKK CANDLE ON DECK.
  
    NVDA SMCI $5K",2024-02-20T13:42:48.245Z
dweeegs,Who’s ready for bears to fumble the ball once again 🏈,2024-02-20T13:44:06.665Z
ninkorn,"Just saw a homeless woman paying a full fare to enter a subway station in NYC
  
    If that is not a sign of bullish 🔥 economy, I don’t know what is 🤷‍♂️",2024-02-20T13:51:34.516Z
ExactLobster1462,Give my SPY 500+ or give me death,2024-02-20T14:01:16.079Z
KilltheK04,Oh shit this is looking like a massive dump on open kind of day,2024-02-20T14:09:26.614Z
AlwaysATM,Puts on piece of shit smci,2024-02-20T14:14:31.569Z
DarkPeopleMeat,Green by 10,2024-02-20T14:31:52.697Z
AllTooWell31,Made $11 and I’m out,2024-02-20T14:56:20.397Z
Forward_Observation,I’m in absolute shambles lol,2024-02-20T15:02:40.645Z
Stonksupdown,just close the goddamn market already,2024-02-20T15:15:26.353Z
J_da_CPA,SMCI puts were the play,2024-02-20T15:25:07.012Z
Connect-Wrongdoer-11,Bought the top last week. Fuck me.,2024-02-20T15:26:26.902Z
trade_doctor,"Me:  planning my next move
  
    My buying power: $0.48",2024-02-20T15:47:29.623Z
tin_licker_99,Pretty soon SMCI will be down to  650 then 600 and then 550.,2024-02-20T15:49:52.728Z
Unitedtendies,That was a sharp V,2024-02-20T15:53:13.012Z
clarence_worley90,crazy that we all have SMCI trades open but none of us know what the company does,2024-02-20T16:06:34.789Z
jraiv420,I DECLARE BANKRUPTCY,2024-02-20T16:07:50.131Z
backleftwindowseat,Can’t believe we dropped 3 pts this morning and everyone started screaming “THE BUBBLE HAS POPPED!!!1!”,2024-02-20T16:09:10.151Z
DrSeuss1020,Yes hi I bought SMCI puts at the low today AMA,2024-02-20T16:17:55.767Z
icecoast44,-10% is not a pump lol,2024-02-20T16:19:28.745Z
Sweaty_Cereal,"NVDA bros, ya'll good tho",2024-02-20T16:24:50.288Z
OptionsApe69,"LUNR moons 300% in a month

    WSB: It’s time to buy",2024-02-20T16:28:58.860Z
WatcherOfTheCats,"My good positions? Up 10% a piece.
  
    My bad one? Down 40%.
  
    Perfectly balanced.",2024-02-20T16:33:37.371Z
ConcentrateOdd8190,"NVDA down 5% after earnings
  
    Jensen says AI 100 times,NVDA up 20% tomorrow",2024-02-20T16:53:19.127Z
igotthis_man,Why did i even buy tsla calls jesus,2024-02-20T17:01:41.773Z
UsuallylurknotToday,"Honestly with how idiotic the bears are here I may have to full port some calls. I’m disturbed that you guys think this is a crash. This is a normal boring day. Seriously. If you think today is exciting or “the beginning of something huge!” You’re not only poor but you’re also an idiot.
  
    Relax. It’s getting embarrassing.",2024-02-20T17:11:00.013Z
Jabbermouth,"What dips are you guys buying?
  
    Me personally I’m doing nothing until tomorrow
  
    Bought the AMD “dip” and now I’m down 30% lol",2024-02-20T17:19:49.758Z
nzholtok,"Me the entire weekend

    “This would be a good spot to get puts”
  
Tuesday morning

    “All in calls!”",2024-02-20T17:20:47.289Z
LeoFireGod,I’ve been out the game for over a year.  Got calls this morning. You’re welcome bears lol.,2024-02-20T17:24:35.650Z
No-Establishment8330,SMCI and NVDA gonna dump like crazy tomo,2024-02-20T17:33:42.509Z
Strategy_,Just the NVDA dump before earnings pump it back to where it was in the 730s.,2024-02-20T18:03:21.337Z
PutsOrCallsXD,"Ahh, yes, SPY and Q's forming the very rare cosine wave pattern.
  
    It's been known to symbolize that both bers and buls are indeed, fucked.",2024-02-20T18:05:51.742Z
marlonm2321,If spy goes green I’ll buy my gf flowers,2024-02-20T18:25:38.028Z
tendeeznuts,God bless unsettled cash or I’d be reeeeeeeal fucked rn,2024-02-20T18:48:24.889Z
Slipperypuppy25,!banbet SPY 510 4h,2024-02-20T18:53:02.926Z
juliettefriskey,I am the best at dollar lost averaging,2024-02-20T18:55:17.385Z
angrybubblez,I know my AMD position is going to succeed this week. It’s the last money in my portfolio. They want us in the casino as long as possible.,2024-02-20T18:55:43.379Z
Market_Bottom,Spy saying fuck those +200% puts,2024-02-20T18:58:15.827Z
NVDAismygod,Today is such a boring day. Open tomorrows casino,2024-02-20T19:02:06.442Z
Affectionate-Tax9885,NVDA could crash 50% and I’d still be up big. Maybe it’s time for an exit strategy lmao,2024-02-20T19:05:01.319Z
Quick_Rent_Now,Are they really gonna let SPY end today in the red??,2024-02-20T19:07:22.583Z
clarence_worley90,i just need SMCI to drop $250 by friday,2024-02-20T19:24:50.524Z
Tudored,NVDA running in with the briefcase at the end of the match,2024-02-20T19:51:00.687Z
Overlord335786,🌈 🐻 bought puts on a red day,2024-02-20T19:51:58.921Z
Consistent-Platypus3,"Hey, wait, bers, come back, you have to see us finish green",2024-02-20T19:53:00.058Z
Theeliteshitposter,"It’s been a 🌈 🐻 convention all weekend and all day.
  
    Time for the bools to fuck.",2024-02-20T19:54:24.865Z
SpermBanking,Power hour spy,2024-02-20T19:56:32.661Z
Theeliteshitposter,My fellow bools - LETS FUCK,2024-02-20T20:01:04.551Z
Diamondhands4dagainz,SMCI actually gunna recover green after being -17% at 11am,2024-02-20T20:01:23.451Z
trainwreck001,IF SMCI PRINTS NEW ATH TODAY ILL STOP POSTING FOR 1 HOUR,2024-02-20T20:02:26.880Z
SwagSorcerer,I’d be careful about SCMI. Feels like a setup for another rug pull,2024-02-20T20:09:56.318Z
PuldakSarang,Piece of shit SMCI now going up again all the sudden with increased volume 😂 we are in a fraudulent market,2024-02-20T20:12:38.131Z
trainwreck001,$8 TRILLION ON THE SIDELINES READY TO BUY NVDA,2024-02-20T20:18:53.539Z
[deleted],Comment deleted by user,2024-02-20T20:20:41.841Z
owfueI,SMCI calls or puts its like playing red or black on roulette,2024-02-20T20:21:40.634Z
TimeToGetTheBread,"Remember when the mods sold out and gave our data to hedge funds…
  
    Pepperidge farm remembers",2024-02-20T20:28:33.104Z
juliettefriskey,Only down 26k now today,2024-02-20T20:39:03.987Z
CouldBeSolidAdvice,everything i touched turned to poor today,2024-02-20T20:39:13.378Z
crucifero,Jesus listening to this discussion thread seeps into your subconscious and fucks with your trading I swear to god. Don’t read this thread tbh,2024-02-20T20:46:02.360Z
surcie,I wasted so much time looking at this today to just lose $137,2024-02-20T20:52:02.660Z
Own-Wolverine-5361,Nvidia is not the same as Palo Alto Networks. Palo Alto don’t have Jensen Huang with leather jacket,2024-02-20T22:11:29.538Z
MarcusDaLongis,Buls rn “guess I’m fuk”,2024-02-20T11:06:04.673Z
Jeremy5cahill,I have been scheming all weekend and I still have no idea what the move is,2024-02-20T11:16:07.127Z
Lethal_Raccoon,"i love when spy is way down pre market:,)",2024-02-20T11:32:20.657Z
[deleted],Comment deleted by user,2024-02-20T11:40:00.937Z
Miserable_Message330,3 hours until people realize again futes are fake and ___,2024-02-20T11:42:56.433Z
[deleted],Comment deleted by user,2024-02-20T11:48:04.686Z
gonebymidnite,I love staring at rigged numbers going up and down,2024-02-20T11:55:09.064Z
MordorBlues,"Never seen anyone in public wearing an occulus, only apple. Zuck got cucked hard.",2024-02-20T11:57:58.888Z
CouldBeSolidAdvice,"the reality is that if your spending $3500 on a product, you want people to see you look ridiculous",2024-02-20T11:59:45.787Z
Orfgorf,"To think, all of this gambling came from some dudes setting up corn futures",2024-02-20T12:07:30.535Z
ziggs_ulted_japan,Smci kinda pumping actually,2024-02-20T12:12:09.394Z
spierser,I'm NOT missing out on the SMCI run AGAIN! Let's GOOOOOO!,2024-02-20T12:17:05.241Z
DooDoo1245,"Made 100 bucks on futures, couldn’t resist. Enough for some good weed, pizza, snacks and Dr Pepper. I will be rooting for all you!",2024-02-20T12:18:28.852Z
[deleted],Are you one of those people who have gambling problem?,2024-02-20T12:25:41.150Z
Codyskank,If you start watching Shrek at 8am eastern it’ll be over right at market open. I do this every day.,2024-02-20T12:32:55.903Z
Hl_IM_MR_MEESEEKS,Good moaning 🥱,2024-02-20T12:51:39.032Z
housemouse431,smci is flagging lmao...this shits more bipolar than my high school girlfriend,2024-02-20T12:58:19.631Z
AfricaTwin2022,I can’t be the only one who has to trade stocks for a living because I can’t get a job with my felonies.,2024-02-20T12:59:54.036Z
free_lions,Wtf just happened to NVDA,2024-02-20T13:01:09.565Z
Frozen_Shades,"Me: Buys some shares

    My Brokerage: Short that position",2024-02-20T13:06:02.956Z
optionsGPT,Super mega cuck incels!,2024-02-20T13:06:25.819Z
SnooDingos3776,"Dear Tesla,
  
    You can do it.
  
    Sincerely,
  
    Call holders",2024-02-20T13:19:58.329Z
Turbulent-Bet-7133,I'm a greedy little piggy oink oink 🐷,2024-02-20T13:44:42.496Z
selfemployedsince16,Homedepot declining earnings doesn't look good.... homedepot doesn't just represent retail it represents part of the construction market as a whole which is over a quarter of our market.,2024-02-20T14:06:51.783Z
goodbuddyedb,Oh wow just now seeing that blowoff top on tech. Hindsight always so obvious,2024-02-20T14:07:48.058Z
SignalX_Cyber,NVDA was never my friend,2024-02-20T14:09:17.617Z
NVDAismygod,SMCI bulls trembling in their boots,2024-02-20T14:12:29.559Z
Newerphone,Welcome to Walmart I love you.,2024-02-20T14:13:29.686Z
ComprehensivePaint48,"Those SMCI options are going to 🩸, premiums way too crazy.",2024-02-20T14:23:25.060Z
NaturalEast4781,"It’s Joever for me 8k -> 20k -> dreading 4k this morning at open, all in 2 weeks. And this is just the past 2 weeks, I’m down 30k all time across my accounts. I’m going to disable options forever. I’m in my 20s I will just DCA into tech companies and corn and retire in 20 years Fuck you all for introducing me to options",2024-02-20T14:27:26.986Z
keyboardwarrior425,down 12k in 12min lfg,2024-02-20T14:42:52.735Z
Jazzlike_Farmer_636,Nvda 800 EOW.,2024-02-20T14:57:07.864Z
Pretend_Bluebird_53,generational bag holding opportunities,2024-02-20T14:57:56.737Z
DJSourNipples,"if everybody says AI three times, Jimmy Buffet or whatever his name is will make the market not gay",2024-02-20T15:03:25.549Z
LongHealth,"Bulls decimated, desecrated, decapitated, and defecated.",2024-02-20T15:11:09.434Z
depravedcertainty,Bought NVDA calls at market open ama,2024-02-20T15:13:04.664Z
Almondjoy101,This is the first time I haven’t panicked and sold everything,2024-02-20T15:14:02.939Z
RealAdmiralMajorButt,"Jim Cramer: ""A generational opportunity to buy 0DTE puts""",2024-02-20T15:16:01.912Z
MarcusDaLongis,Buls asking why drop but don’t question why pump,2024-02-20T15:20:11.693Z
jpric155,"Bro, did AI get cancelled?",2024-02-20T15:20:43.239Z
ADynes,"I've decided not to do anything today.
  
    Well technically my account decided for me because I'm flagged for day trading and I only have $1.74 in settled cash.  But it's my decision also.",2024-02-20T15:21:34.977Z
New_Possible_284,i think this is healthy correction,2024-02-20T15:25:03.294Z
surcie,Bought 0dte calls for once in my life and am getting destroyed,2024-02-20T15:26:39.245Z
DJSourNipples,"I uninstalled and reinstalled Robinhood, why am I still negative?",2024-02-20T15:28:06.780Z
Starkfault,"If NVDA dies this earnings then everyone is gonna wish they sold everything now
  
    If NVDA goes vertical then this dip is the one you should have bought
  Choose your team",2024-02-20T15:30:12.814Z
Pikachumon25,where is the guy that wanted NVDA up 8% by close,2024-02-20T15:31:05.019Z
zendraven,The NVDA selloff before the moon tomorrow before the dump on earnings,2024-02-20T15:32:14.797Z
Powerful_Mission_655,The iv on those nvda options is insane lmao,2024-02-20T15:36:29.589Z
Overlord335786,SMCI 700 BREACHED,2024-02-20T15:38:06.720Z
Roxaos,"Shoulda not have held shit over the long weekend
  FUCK",2024-02-20T15:38:33.813Z
LilEIsChadMan,The AI top is Sam Altman asking for the GDP of entire continents to fund his “vision”,2024-02-20T15:39:49.895Z
Connect-Wrongdoer-11,Why did you people tell me about options,2024-02-20T15:41:38.658Z
Connect-Wrongdoer-11,i am down all of the money today,2024-02-20T15:43:10.688Z
AbbreviationsNo6897,Doubling down on NVDA here. Scared money don’t make money.,2024-02-20T15:44:38.896Z
amoistsock,Did you buy the dip,2024-02-20T15:53:26.392Z
__Slick_iG_,Nvda premiums are so expensive you might as well just light your money on fire on both puts and calls,2024-02-20T15:55:15.988Z
ballmode,Man... SMCI $850p last Friday morning is a huge woulda coulda shoulda,2024-02-20T15:56:23.098Z
__Slick_iG_,Smci back to $70 within 2 weeks,2024-02-20T15:59:57.542Z
IllustriousCoat7561,I bought puts at the bottom :(,2024-02-20T16:01:02.917Z
Fried_Fart,"It was a great morning to pick up some calls, fuckwads",2024-02-20T16:01:57.878Z
creedthoughtsblog,"don’t fucking believe this, I actually sold my puts at low of the day 😁
  
    like actually trading with brain > heart",2024-02-20T16:04:11.156Z
FriedBalamari,Hindenburg may be gearing up for a SMCI report dropping today,2024-02-20T16:07:56.618Z
LuckyCaramel922,There's only 1 AI....and it's Allen Iverson,2024-02-20T16:09:09.615Z
BannedVisibleVirus,I've LITERALLY never seen this place more toxic than right now.,2024-02-20T16:10:46.972Z
liftshit9,SMCI $600 eow,2024-02-20T16:11:46.042Z
travisscottsburger,"NVDA sells off into earnings, no one want to be caught with their pants down after a run-up like this.",2024-02-20T16:14:42.804Z
Hormozi,I'm never going to financially recover from this.,2024-02-20T16:18:17.891Z
TimeToGetTheBread,I’m gonna go drink 8 charged lemonades,2024-02-20T16:19:37.534Z
trade_doctor,Oh no I'm losing again,2024-02-20T16:21:34.447Z
Quasat14,Bought more calls am i regarded?,2024-02-20T16:22:14.209Z
gridflash,Reddit has lost its personality...,2024-02-20T16:23:23.876Z
Trading_View_Loss,I fucking hate how popular this sub is. Really makes me feel demotivated to even try to keep doing TA and investing. Too many greedy slimy fucking regards just like me trying to scam each other out of money.,2024-02-20T16:33:19.654Z
MrDayv,Not even worth playing Nvidia. IV wayyyy too high,2024-02-20T16:33:20.383Z
Diamondhands4dagainz,"Bro r/SMCI_Stock is hilarious. Regards there think SMCI is worth more than NVDA because the SP is higher. Like when you have these kinds of regards YOLOing in, you know we are at the top",2024-02-20T16:33:54.531Z
Mech_engr2022,SMCI and Nvidia Puts paid for my vacation today,2024-02-20T16:35:06.410Z
Forward_Observation,Yeha but you have no one to go with cuz ur a ghey bear,2024-02-20T16:35:49.232Z
jekylczar,SPY you ignorant slut,2024-02-20T16:37:47.179Z
kratoasty,Which one of you dumb bulls bought more SMCI calls instead of load up on puts?,2024-02-20T16:37:59.164Z
Dapper_Grapefruit975,So torn over what to do with NVDA,2024-02-20T16:40:39.221Z
Competitive_Wind7738,All these bearish comments will become “bets fukt ” in 2 hours,2024-02-20T16:42:36.144Z
rdblaw,"Some of you got too used to easy mode and it shows, smells like bitch in here",2024-02-20T16:45:15.725Z
Very_Regarded,Brutal day. Every pump is sold off instantly,2024-02-20T16:48:01.770Z
ConcentrateOdd8190,"Who tf is selling nvda,it's like selling aapl before the launch of iphone",2024-02-20T16:49:45.930Z
Affectionate-Idea690,"Nvidia's Market Cap Is off More Than $100 Billion Today. Shares of Nvidia fell roughly 5% Tuesday morning, shedding more market value than on any other day in its history.",2024-02-20T16:51:29.561Z
[deleted],Comment removed by moderator,2024-02-20T16:52:49.434Z
Macrophallus_Owner,"I have not sold, therefore I have no losses today",2024-02-20T16:52:58.178Z
NVDAismygod,I really bought ethereum at 3K🤡,2024-02-20T16:53:35.216Z
Starkfault,"WSB: “I wish the market would crash, i’d get rich riding it down then back up”
  
SPY drops 0.86%

    WSB: bankrupt",2024-02-20T17:07:17.883Z
Bazzer82,Another 10 days like this and there might be a more sensible entry point into the market.,2024-02-20T17:09:23.564Z
Fantastic_Tiger_9000,they fucking know the ER is gong to be bad.,2024-02-20T17:09:57.646Z
FarLog4503,Need NVDA +20% move tomorrow,2024-02-20T17:11:37.936Z
thatmitchguy,My....God..the V was upside down the whole time!,2024-02-20T17:12:32.346Z
ebfeebfe,Imagine not leveraging a fraudulent loan application to acquire more $NVDA,2024-02-20T17:13:59.197Z
[deleted],Comment deleted by user,2024-02-20T17:14:03.896Z
I_Eat_Groceries,-$15k down....so far,2024-02-20T17:16:30.898Z
Jabbermouth,How many blown portfolios today?,2024-02-20T17:18:12.104Z
_unrealized_,"I have never, and I mean absolutely never (in my past 2 weeks of trading), seen SPY below 495.
  
    This is an unprecedented move by the markets, one that I am closely investigating (looking at memes on WSB).",2024-02-20T17:18:55.466Z
boxxa,"On a positive note, look how cheap those NVDA calls got.",2024-02-20T17:19:35.709Z
Strange_Path7709,guys im on the phone to broker tryna get myself perma banned from options.,2024-02-20T17:21:24.711Z
xlmtothemoon,"hey everyone, im a little bitch!",2024-02-20T17:21:39.116Z
JewJesus96,"Feels good to see bears earn once in a while. Go bears, go get the premium ramen today",2024-02-20T17:28:43.823Z
Jelly__Rogers,I doubled down on calls 5 minutes ago,2024-02-20T17:40:44.440Z
Aggravating_Bad8428,Getting smoked.,2024-02-20T17:41:31.278Z
_RAPTORMAN_,Doesn’t matter who wins or loses. If matters if we have fun right?? Right?? I’m not having a good time at all,2024-02-20T17:44:50.850Z
Life-Industry-1131,SMCI call buyers crying and about to throw up tantrum style,2024-02-20T17:45:46.918Z
__Shadowman__,Stairs up jumping off the grand canyon down,2024-02-20T17:46:28.895Z
Overlord335786,"I bought 500c for Friday, shopping for lambos now",2024-02-20T17:50:47.727Z
Powerful-Patience-69,I CAN TELL MOST OF YOU DEGENS ARE LEVERAGED WAY TOO HIGHLY BY THESE COMMENTS,2024-02-20T17:55:39.964Z
ercanbas,Maybe if we all hold hands and pray?,2024-02-20T18:02:14.665Z
KaleidoscopeNo828,Tesla investors are most panicking bearish people ever! Lol,2024-02-20T18:04:53.490Z
Very_Regarded,Jesus we can’t go up,2024-02-20T18:11:25.266Z
Rebelcr7,Homeless dude started telling the story of where his life went wrong. Beginning sounded suspiciously like mine. I walked away when he pulled out his phone and started opening Reddit,2024-02-20T18:12:44.123Z
brownbear34,Don’t worry everyone. I made sure to get calls at the top and puts at the bottom. Losses guaranteed,2024-02-20T18:13:34.963Z
thingmaker123,!banbet QQQ -83% 1h,2024-02-20T18:14:17.864Z
Trash-Goddess,"I'd like to thank wsb for teaching me that reading can actually make you dumber. I used to be addicted to trawling the depths of the comments section looking for insight in the public consciousness, but there's nothing there. Words don't even mean anything. The value add of social media is building momentum for pump and dumps and feeling superior to bagholders.",2024-02-20T18:28:04.853Z
willsucksagan,Welcome to Costco. I love you. Welcome to Costco. I love you,2024-02-20T18:48:40.231Z
surfinbird,NVDA earnings gonna make or break a lotta people here,2024-02-20T18:49:06.546Z
Jdom666,imagine not buying nvda dip. doing the same thing meta did,2024-02-20T18:53:23.426Z
ziggs_ulted_japan,Smci seriously is closing over 750,2024-02-20T18:56:15.682Z
Affectionate-Idea690,nvda now,2024-02-20T18:57:03.503Z
LongHealth,Guys I might be your father,2024-02-20T19:06:14.279Z
trumpdiego,As we all know two red days in a row is literally illegal for the past 3 years. So place your bets accordingly.,2024-02-20T19:08:32.981Z
BigBoiBenisBlueBalls,"Gets on a plane.
  
    Flight attendant: window or aisle?
  
    Me: window or you’ll what?",2024-02-20T19:16:05.552Z
_RAPTORMAN_,So pissed off at tech right now. Go fuck yourself,2024-02-20T19:18:20.019Z
jabronismacker,NVIDIA can cook the books tomorrow for all I care just as long as I make money tbh,2024-02-20T19:21:28.634Z
nyse125,bro this is the gheyest day so far,2024-02-20T19:32:06.216Z
chespirito2,SMCI bulls are impressive,2024-02-20T19:33:09.319Z
Sagetology,"Dump today, pump tomorrow. Huge NVDA beat after hours
  
    It is known",2024-02-20T19:33:41.239Z
yaboiRich,If SPY finishes green you can perma ban me,2024-02-20T19:46:10.239Z
Legitimate-Owl-7137,Spy 500 tomorrow,2024-02-20T19:49:19.209Z
Turbulent-Bet-7133,Anyone remember lumber liquidators? I member,2024-02-20T19:49:55.971Z
Diamondhands4dagainz,"Lol bers fuk again, SMCI gunna end green and NVDA will be back over 700",2024-02-20T19:51:27.394Z
Worried_Quarter469,SMCI : I CAN DO THIS ALL DAY,2024-02-20T19:53:42.973Z
edvincho,Smci green eod,2024-02-20T19:58:53.699Z
ercanbas,This day felt like 2 trading days,2024-02-20T20:09:03.265Z
Jabbermouth,"NVDA will 100% be green tomorrow until earnings
  
    Calls seem like free money as long as you sell before 4
  
    Fuck it I’m in",2024-02-20T20:19:50.824Z
Theeliteshitposter,This black dude on CNBC has been bearish since Halloween,2024-02-20T20:21:35.677Z
trainwreck001,Are you saying he's a Black Bear?,2024-02-20T20:22:40.325Z
erx988,man its so scummy that they pump it till 3;30 to fuck over puts and then ppl on robinhood get sold out and then straight at 3;30 shit starts dumping can they make it any more obvious,2024-02-20T20:35:45.581Z
Theeliteshitposter,If SMCI closes 🟢I’ll run a naked mile around my office campus,2024-02-20T20:41:47.183Z
Chemical-Storage2004,30% down on smci puts 🤪🥳🤩🤓🥰😇😘,2024-02-20T20:42:21.369Z
trainwreck001,SMCI $900+  AH....,2024-02-20T20:48:47.849Z
Opposite_Engine_6776,"Thanks, fucking SMCI regard bulls, for wiping out my puts today.",2024-02-20T20:56:49.641Z
rdblaw,SMCI has somehow become NVDA’s little brother that mom said he has to take him with,2024-02-20T21:32:30.426Z
optionsGPT,If the market drops 5% today I’m buying NVDA calls,2024-02-20T11:05:31.391Z
likamuka,why we so poor,2024-02-20T11:08:53.975Z
amoistsock,3 more hours until you expire worthless,2024-02-20T11:20:57.872Z
Jelly__Rogers,"You mean to tell me the massive amount of calls purchased Friday will expire worthless? I'm shocked, shocked!",2024-02-20T11:32:19.602Z
Very_Regarded,Every green candle sold off instantly,2024-02-20T11:35:49.175Z
NeitherCarpenter4234,ALL aI stocks will be choppy today...,2024-02-20T11:38:51.505Z
Jeeperg84,Well today marks the day when all my tendies from the past year is gone,2024-02-20T11:47:01.559Z
Jumpy_Elevator_6603,SMCI - buncha average down clowns 🤡,2024-02-20T11:58:17.060Z
[deleted],Hey boys are we shrekin' today?,2024-02-20T12:02:52.854Z
DooDoo1245,"What ever happens, just remember the words of Dave Chapelle. Being poor is a mindset not much recover from. If you lose everything you will be broke. Get out there save some money and come back to lose it all again!",2024-02-20T12:05:41.337Z
housemouse431,"this week there will be poor cucks turning into millionaires and millionaires starting paper applications for wendys job.
  
    the volatility is gonna be epic bitchesssss",2024-02-20T12:08:57.495Z
mallison945,Corn is the greatest ponzi of all time. You will bow to your crypto bro overlords very soon,2024-02-20T12:09:21.967Z
NaturalEast4781,Green by open. I’ll be 90% down instead of 99% down. Thank you Jesus,2024-02-20T12:12:01.033Z
GoodGuyDrew,Open is gonna be ✋WILD🤚,2024-02-20T12:18:24.809Z
baadllama_ghost,V shape,2024-02-20T12:41:56.804Z
wowthisguyoverhere,Fuck it LUNR sounds cool. Maybe i get burned but it might be a cool one to hold.,2024-02-20T12:45:13.520Z
diggin-the-doge,"It’s a game of who’s going to flinch first, who’s going to give up first. We know that isn’t going to be WallStreetBets. WSB is nothing more than toughness, togetherness, intensity, intelligence and competitiveness. It's game time boys!",2024-02-20T12:49:47.373Z
BallsDropped,Im even more encouraged with my puts after reading this,2024-02-20T12:53:12.236Z
crazyyimmy,"Mods, ape this man",2024-02-20T12:50:56.375Z
ziggs_ulted_japan,This America. The market should be open 24/7,2024-02-20T12:56:11.625Z
Diamondhands4dagainz,"Bunch of regards in here think they’re Gordon Gecko, but they’re actually just Bill Hwang",2024-02-20T12:56:27.013Z
amoistsock,"Market red: omG look so bearish. Any chance this can continue to go up
  
    Market green: hulk dick hulk dick there’s no stopping this train 

    -WSB REGARDS",2024-02-20T12:58:58.930Z
trade_doctor,Fuck SPY calls gotta be too easy,2024-02-20T13:00:16.527Z
trade_doctor,If Nvidia premarket is an indicator for SMCI I'm getting $290p,2024-02-20T13:01:57.227Z
TheCuttyBrown,I think SMCI was a test run of what can happen to NVDA if it tried to Pump up to a 1000 and Dump .. People belived in  SMCI going to 1300 after only hearing about it 5 mins earlier... Surely every one loves and trust Nvda not to scam them right...,2024-02-20T13:03:09.040Z
l____l___l___l____l,My calls are prob toast today,2024-02-20T13:04:49.635Z
TheOriginalBushToad,One more ATH on NVDA and semis and I'm placing puts on SMH.,2024-02-20T13:10:04.897Z
Usual_Information746,big possibility it’s going to be a pump,2024-02-20T13:21:00.520Z
