Author,Comment,Date
animositisomina35,"The market is in a holding pattern until SNAP's guidance determines the fate of the economy, as is tradition.",2024-02-06T20:38:51.307Z
ncaa_scammer,$20k on SNAP puts,2024-02-06T20:43:53.946Z
Overlord335786,All the calls I bought in the NVDA dip went green,2024-02-06T20:46:46.100Z
B1drvr,time to fomo nvda,2024-02-06T20:53:15.145Z
Ok-Veterinarian-2333,This is nonsense. How could Nvda be sub 700. It’s undervalued,2024-02-06T11:22:53.646Z
juliettefriskey,"BEARS LMFAOOOOOO
whoops just practicing",2024-02-06T12:01:47.163Z
twostroke1,LLY,2024-02-06T12:13:18.823Z
[deleted],Comment deleted by user,2024-02-06T12:24:35.819Z
SavingsGas4933,Banbet! $nvda 750 1d,2024-02-06T12:25:46.221Z
parsley_lover,NVDA PM volume : 1 million,2024-02-06T12:36:25.328Z
CMac681,"No not Toby Keith 😭
  
    RIP Cowboy",2024-02-06T12:40:24.308Z
postachioo,Congrats to NVDA fomo buyers at 700,2024-02-06T12:49:39.166Z
SuspiciousStable9649,AAPL selling a porn headset without being able to do porn. 🤦🏼🤦🏼,2024-02-06T13:06:09.715Z
DetroitRedWings79,Back to 700. Bears in shambles,2024-02-06T13:06:20.026Z
Huckleberry_Holiday,I lost 11k in a day last week and I was less upset about that than I am for selling my NVDA and SMCI calls for profit yesterday before close,2024-02-06T13:19:55.745Z
ChairmanPowell,I am in financial ruin.,2024-02-06T13:23:06.892Z
trainwreck001,"RAYMOND JAMES UPGRADES NVDA
  
    NVDA $4K",2024-02-06T13:26:01.875Z
realmichaelklemme,"Never bet against America
  
    Never bet against big pharma
  
    Never bet against the military industrial complex
  
    Do these and be rich 🤑",2024-02-06T13:37:27.319Z
Altruistic-Sense-593,PLTBRRRRRRRRRR,2024-02-06T13:43:35.594Z
UnholyTrigon,Wow it seems my 760 Lly calls might have a chance,2024-02-06T13:43:50.937Z
twostroke1,LLY giving me a big ole pharmaceutical boner rn,2024-02-06T13:57:27.916Z
HunterBidensdik,"PLTR 💦
  
    $20 calls printing 💵",2024-02-06T13:59:24.333Z
Overlord335786,"The second a NVDA mega thread is made, the stock will die",2024-02-06T14:02:15.386Z
[deleted],Comment deleted by user,2024-02-06T14:03:30.552Z
im-ron-burgAMD,TSLA & MSFT CALLS ✅,2024-02-06T14:16:21.824Z
Elons-Musky-Balls,Me and the Fellow Palantards about to be slightly less poor at open.   We did it boys Steaks for dinner tonight.,2024-02-06T14:19:35.145Z
Ok-Veterinarian-2333,I expect Nvda 720-740 by close today as bearish case,2024-02-06T14:21:52.226Z
harrybuice,How we feeling about $1000 nvda calls,2024-02-06T14:23:34.386Z
Anxious_Stop8618,Nvda bear trap of the week,2024-02-06T14:41:43.631Z
Double-hokuto,Nvda’s volatility is not good for my gambling neurons,2024-02-06T14:50:13.167Z
Overlord335786,"Calls purchased on this dip, deleting my brokerage app",2024-02-06T14:50:23.593Z
Avocadonot,This is my chance to buy NVDA calls jesus christ why can't I just get myself to buy calls on this bloated turd,2024-02-06T14:55:36.382Z
khartz99,Haven’t been on this sub in months. Goddamn Y’all are more skitzo than ever,2024-02-06T14:58:11.416Z
thespeeeed,PLTR going uphill on those roller ski things Karp uses.,2024-02-06T15:00:36.354Z
SleepiestGuyAlive,NVDA calls now?,2024-02-06T15:16:49.142Z
wildcat1055,"NVDA down today.
  
    How do I report to SEC?",2024-02-06T15:19:44.086Z
ShinyPants45,I'm palantarded yes I am,2024-02-06T15:22:42.513Z
Stmast,Loving the salty pltr bear tears,2024-02-06T15:22:43.048Z
WombatSana,"My options watchlist has a 100% win rate. My actual buys however, maybe closer to 20% 🫣",2024-02-06T15:24:23.829Z
brother_spirit,Oof. Anyone who bought NVDA calls yesterday getting absolutely rekt,2024-02-06T15:26:15.384Z
ykoreaa,THE V,2024-02-06T15:37:29.633Z
trainwreck001,"PAPER HANDS GOT INCINERATED 🔥🔥🔥
  
    DIAMOND HANDS BISHES 💎👐
  
    NVDA $4K",2024-02-06T15:38:57.099Z
Illustrious_Elk_4849,"I will not FOMO into puts, I will not FOMO into puts",2024-02-06T15:43:06.418Z
TransitionNo3549,If anyone buying NVDA actually wants to see it do a tesla tier rise you should appreciate a pullback.,2024-02-06T15:44:35.395Z
TheLapHog,spy v to 495 by eod,2024-02-06T15:47:14.812Z
soareyousaying,I like that TSLA and NVDA are now inversely correlated.,2024-02-06T16:12:03.902Z
ArchegosCapitalCEO,Error404: Gains not found,2024-02-06T16:22:25.816Z
_Rexfest_,Trading was supposed to be fun. What is this snail moving shit,2024-02-06T16:32:35.437Z
NVDAismygod,Panic selling has begun,2024-02-06T16:46:25.425Z
aqjingson,Imagine waiting 3 months for a nvda dip and fomoing in above 700 after hours yesterday,2024-02-06T16:55:48.814Z
SnooChickens1183,Nvidia just struck a deal with CISCO you guys really think it won’t be back past 700 in a couple days,2024-02-06T16:56:37.243Z
BallsDropped,"Not gonna lie, this dip is bullish AF",2024-02-06T16:58:48.822Z
igotthis_man,Rip my nvdia calls,2024-02-06T17:06:19.191Z
InitiativeBeginning,NvDA bagholders,2024-02-06T17:06:42.955Z
Sweatygun,nvda calls rn free money,2024-02-06T17:16:17.504Z
postachioo,Congrats on buying NVDA top,2024-02-06T17:16:35.269Z
Porcoddio45,"NVDA is -4% after being +40% since January.
  
    WSB: NVDA iS FuK!!@@@@!!",2024-02-06T17:18:23.670Z
PrecisionPunting,"Fellas, I was losing money today so I impulsively bought one expensive NVDA put because I’m a greedy gambler and it’s up pretty big pretty quickly . I normally don’t play options this expensive, how long should I let this thing ride ?",2024-02-06T17:24:08.345Z
[deleted],Comment deleted by user,2024-02-06T17:24:09.724Z
[deleted],A person who is okay with being alone at restaurants. Bars. Travelling. Etc. Is a powerful person.,2024-02-06T17:30:09.711Z
thatmitchguy,"When I picture all the bears celebrating NVDIA's one decent red day after all the enormous gains, I see a kid throwing a pebble at a mountain.",2024-02-06T17:30:55.067Z
Massive_Program4679,Doubled down on NVDA calls for a lower average cost bc I’m not a regarded bear,2024-02-06T17:38:15.854Z
spellbadgrammargood,"i saw it and it was beautiful.
  
    NVDA: 669.69",2024-02-06T17:44:07.811Z
Jarlaxle_rigged_it,wondering what if Vlad had never removed the buy button,2024-02-06T17:47:03.306Z
-IQ200,Bear mentality: The true value of (insert stock) is $0.,2024-02-06T18:00:49.719Z
DanceDifficult8571,Nvidia made me $600 yesterday and cost me $300 today. Still up though,2024-02-06T18:03:19.428Z
CPA-hole,Show me on the doll where NVDA touched you,2024-02-06T18:03:31.114Z
Squirrel_ZA,I made $450 yesterday. I am down $400 today. I am sad :(,2024-02-06T18:19:23.165Z
Aggravating_Bad8428,I need SPY $495 already,2024-02-06T18:21:00.643Z
TradingDegen,nvda is doing the thing,2024-02-06T18:36:50.788Z
Frozen_Shades,imagine thinking big tech will go bust with a chronically online population of regards,2024-02-06T18:42:30.460Z
BiigIfTrue1492,Imagine not playing the downfall of nvda,2024-02-06T18:46:21.320Z
OneworldcurrencyJSS,495 SPY LFG!!,2024-02-06T18:56:00.109Z
questionr,It's amazing how often the market gets things wrong compared to my positions.,2024-02-06T19:10:33.030Z
BagSelect,"u/marcusdalongis hey bud, it turned red again you can come back out of hiding to spam Cliffords and pretend you’re making money",2024-02-06T19:13:10.059Z
Miserable_Message330,Who turned off the SPY money machine,2024-02-06T19:15:25.460Z
LongHealth,Some of you have an f150 and it tows.,2024-02-06T19:15:39.069Z
Icy-Indication-6910,Palantards making bank and Nvidians holding the bag. What a time to be alive,2024-02-06T19:26:31.542Z
Cold-Lettuce8991,If smci goes green today i will eat 10 of my butthole hairs,2024-02-06T19:29:39.860Z
Porcoddio45,NVDA bears are seriously dead. It's so over for them.,2024-02-06T19:44:19.360Z
[deleted],Comment deleted by user,2024-02-06T19:50:00.554Z
Ryoujin,Today’s nVida dip was the generational buying opportunity.,2024-02-06T19:58:14.033Z
DuvelNA,sold my pltr calls too early. fuck my life.,2024-02-06T20:09:52.089Z
Consistent-Platypus3,"After Nvidia just shook off a -4% day, there's no way anyone thinks this doesn't reach 700 eow.",2024-02-06T20:16:03.829Z
davidbigham,Imagine not buying the NVDA dip,2024-02-06T20:16:48.968Z
__Shadowman__,Nvdia said he didn't hear no bell,2024-02-06T20:21:15.516Z
ercanbas,NVDA so sentient it’s buying its own stock.,2024-02-06T20:23:05.436Z
rdblaw,Does NVDA go green in the next 37 min?,2024-02-06T20:23:44.486Z
ARoseandAPoem,I bought a dip and it actually fucking went up. I’m shook.,2024-02-06T20:24:47.822Z
benjaroo69,Great stock market day today guys. Really good energy!,2024-02-06T20:26:10.834Z
Jelly__Rogers,"NVDA: ""I can't carry your holdings Mr. SPY.....But I can carry YOU!""",2024-02-06T20:26:17.343Z
Jumpy_Elevator_6603,NVDA getting ready to pop,2024-02-06T20:30:40.508Z
Jumpy_Elevator_6603,"Instead of having FOMO, why not just buy NVDA 🤷‍♂️",2024-02-06T20:37:26.911Z
monochrome_f3ar,LFG SMCI!!!  From 627 to 677 what the fuck,2024-02-06T20:53:17.012Z
coppehh,i am officialy a permabull,2024-02-06T20:57:06.176Z
yodamelon,TSLA isn't Mag 7 anymore.,2024-02-06T20:58:50.614Z
Consistent-Platypus3,Get ready for a green day tomorrow boys,2024-02-06T21:00:20.041Z
ValuableNobody9797,NVDA at lows not seen since close yesterday,2024-02-06T11:18:39.422Z
sola_rpi,my avg is 710 FML,2024-02-06T11:38:18.832Z
TheMysteriousBears,They gave NVDA bears a chance to buy at 690 again,2024-02-06T12:03:06.248Z
OPINION_IS_REGARDED,Fatties making me rich God bless America,2024-02-06T12:17:06.828Z
ShinyPants45,If Nvidia cools off I think we may be fuk boys,2024-02-06T12:23:18.196Z
animositisomina35,"Eli Lilly beats top-line and bottom-line estimates.
  
    2024 guidance issued with revenue in the range of $40.4 billion to $41.6 billion vs. $39.14B consensus, EPS in the range of $11.80 to $12.30 and non-GAAP EPS in the range of $12.20 to $12.70 vs. $12.38 consensus.",2024-02-06T12:28:16.261Z
realmichaelklemme,Elon has lost over 36 BILLION in net worth since December,2024-02-06T12:48:52.619Z
[deleted],Comment deleted by user,2024-02-06T12:50:53.847Z
Visible_Ad_2271,My best performing stock this year is Spotify,2024-02-06T13:07:11.868Z
Practical_Guidance90,OMG I TALKED MY Mom into letting me trade her $500 for the love of God act right Nvidia and LLY,2024-02-06T13:11:54.826Z
DMotorBoater,This made me uncomfortable.,2024-02-06T13:13:04.443Z
Doogertron64,Thank fuck for LLY calls. They just saved my bank account from being off work for most of December and January,2024-02-06T13:17:31.333Z
siouxu,Way too boolish in here. Thinking Mar/Apr puts once ber comes out of hibernation.,2024-02-06T13:26:43.467Z
ryanfave,Spy could hit 500 this week.,2024-02-06T13:37:15.120Z
Confident_Falcon5095,Do I mess with 0DTEs on SPY today?,2024-02-06T13:42:29.922Z
ViciousMoleRat,Open the fucking doors I'm sweating down my buttcheeks,2024-02-06T13:42:41.474Z
[deleted],Buying 1 NVDA 500P 7/19 every week until I’m behind Wendy’s,2024-02-06T13:50:42.640Z
fatboats,"What’s up with all these NVIDIA doom and gloom posts?
  
    Bers are cucks.",2024-02-06T13:55:22.389Z
wowthisguyoverhere,Laat 30 min of peace before chaos,2024-02-06T13:59:32.013Z
ProphetPenguin,Today is going to be RIDICULOUS,2024-02-06T14:11:20.509Z
AyumiHikaru,"At this rate, Toyota's market cap will surpass TSLA
  
    lol",2024-02-06T14:20:53.862Z
magicmeatwagon,Sometimes watching the open bell is more fun than watching horse races,2024-02-06T14:32:31.754Z
postachioo,NVDA fomo 700 buyers in shambles,2024-02-06T14:35:30.523Z
[deleted],Comment deleted by user,2024-02-06T14:36:07.756Z
GonnaBeWealthy,NVDA 710 EOD I’m not worried lol,2024-02-06T14:37:59.867Z
Nick663,All the gay bers selling their SMCI and NVDA for cheap,2024-02-06T14:38:33.017Z
Eccentricc,CATHY BUYING TESLA RN,2024-02-06T14:40:07.129Z
Gemini_Of_Wallstreet,this is just a repeat of last week. NVDA meets resistance on Tuesday Wednesday at 700-720 (600-620 last week) then moons,2024-02-06T14:43:07.333Z
Berto_,Some of you are going to fomo pltr at the top.,2024-02-06T14:43:16.579Z
DiligentBuy9074,NVDA granting us a gift right now,2024-02-06T14:46:53.667Z
PHX_adri,!banbet NVDA $700 6h,2024-02-06T14:47:58.902Z
OGWFORLIFE,It’s insane how much power I hold. I buy one call yesterday to stop this SMCI rally and it worked. Something like a God really.,2024-02-06T14:48:51.766Z
WYLD_STALYNZ,"the bear in me understands that a pullback must eventually come, but even the gayest version of that bear knows there is no way NVDA actually stops the runup before ER",2024-02-06T14:49:36.864Z
trainwreck001,"EMBRACE THE V BISHES.
  
    NVDA $4K",2024-02-06T14:53:25.442Z
Jballer200k,NVDA about to erupt.,2024-02-06T14:58:21.169Z
main-char,this spy is mean to me,2024-02-06T14:59:51.577Z
EngorgedBreasts,NVDA on sale fellas,2024-02-06T15:00:35.521Z
CheapHero91,ADVANCED MONEY DESTROYER IS BACK ON THE MENU LADIES,2024-02-06T15:03:11.374Z
Gemini_Of_Wallstreet,GUYS DON'T WORRY I JUST BOUGHT NVDA PUTS,2024-02-06T15:07:41.358Z
VotedOut,Sign of the end stage of a rally - the dash to meme-stock trash.,2024-02-06T15:09:39.739Z
Turbulent_Result_265,Decided to jump in on NVDA today 🥲,2024-02-06T15:10:17.059Z
OHIO_TERRORIST,Morning dip now followed by a V.  Every day,2024-02-06T15:20:54.633Z
semigonnadump,Thank u bols for posting millions of bullish NVDA posts and comments. Those are more beneficial for bears than any bad news from NVDA,2024-02-06T15:24:08.443Z
DirtTrick3843,My calls just got wrecked 😂,2024-02-06T15:24:56.166Z
tin_licker_99,How many would be ruined if NVDA lost what it gained this year?,2024-02-06T15:26:10.902Z
MIlkies_Nibbles,Why did NVDA go down when I buy a call lol,2024-02-06T15:26:52.888Z
ea888gen3,NVIDIA $745 by EOD,2024-02-06T15:29:47.800Z
Ok-Monitor8121,"Every red day “HAHA YOU IDIOTS BOUGHT AT THE TOP” and the market always rebounds.
  
    Today is a buy opportunity, if you aren’t then you truly hate money and are the real idiot",2024-02-06T15:32:10.418Z
tropicalia84,V GANG RISE UP,2024-02-06T15:35:49.629Z
Luv_Sosa21,"NVDA FINALLY FOUND SUPPORT, GET READY YOU SHIT ASS BEARS, DIE",2024-02-06T15:37:35.908Z
Anxious_Stop8618,497 close,2024-02-06T15:47:12.355Z
Its_Stir_Friday,Generational buying opportunity on NVDA here,2024-02-06T15:52:50.891Z
Diamondhands4dagainz,"And just like that, a new generation of PLTR bagholders are born",2024-02-06T15:53:34.615Z
Rebelcr7,I felt like a god amoung mere men with my nvda $700 calls in AHs yesterday,2024-02-06T15:56:17.739Z
__Shadowman__,Bro I love options,2024-02-06T15:57:06.758Z
TheMysteriousBears,Some of you don’t know how options work when buying them and it shows,2024-02-06T15:59:53.858Z
Its_Stir_Friday,This is gonna get ugly for 🐻,2024-02-06T16:03:26.873Z
[deleted],Comment deleted by user,2024-02-06T16:05:11.887Z
Frozen_Shades,Paper hand NVDA? Never,2024-02-06T16:05:41.066Z
essdii-,Thanks to the impending Reddit IPO Reddit is pushing so many damn subs onto me via homepage. I literally have to mute 10 communities a day. Puts on Reddit ipo when available,2024-02-06T16:08:42.373Z
Hl_IM_MR_MEESEEKS,11:11 make a wish 🥺👉👈,2024-02-06T16:11:03.366Z
losekiloaskme,What's happening to my NVDA 700C's???,2024-02-06T16:14:19.628Z
PutsOrCallsXD,a fuckin 3% drop in nvidia and weekly puts are barely up 50%? lmao yea not touching this POS the IV is juiced as fuck,2024-02-06T16:19:20.719Z
DSBandicoot,If roblox moons on earnings I'm gonna give the profits to my daughter to buy robux. If it goes down I'm going to pretend I didn't buy that call,2024-02-06T16:33:44.095Z
edvincho,"I said yesterday the day i buy nvda calls is the day it goes red
  
    Crazy shit",2024-02-06T16:51:17.936Z
AbbreviationsNo6897,"NVDIA up 40% in a month with barely a red day, and people still buying 0dte calls yesterday",2024-02-06T16:53:54.569Z
indiebryan,People panicking about NVDA when it's only down 4% smh. At this rate they'll still be solvent for another few weeks,2024-02-06T16:57:47.980Z
ballmode,"I buy puts and stock goes up. 
  
    I buy calls and stock goes down",2024-02-06T16:58:17.420Z
AncientRoller,Picked up some NVDA calls on this dip hoping for a V (i’m a bear),2024-02-06T17:03:09.365Z
gronaninjan,You loved NVIDIA at 700 you must superduper love it at 600,2024-02-06T17:04:55.301Z
BagSelect,Imagine pretending bulls are bankrupt when it’s barely -0.6% from ATH lmao some of you are truly delusional,2024-02-06T17:07:43.432Z
freehouse_throwaway,wow so NVDA knows how to go red after all...,2024-02-06T17:07:44.820Z
Happy_Wafer5366,Nvidia drilling so hard the US had to invade it,2024-02-06T17:11:07.487Z
skin_flute_player,"NVDA bers enjoy your day, we going back to 700 by tomorrow.",2024-02-06T17:11:54.031Z
throughthehazel,I’m still adding NVDA 700c ….not scared at all,2024-02-06T17:12:15.916Z
tuanzack,"If Nvda announces stock split right now, it will reverse back to +10%",2024-02-06T17:15:23.386Z
giomsan,"sorry guys, i got nvda calls this morning 💀",2024-02-06T17:21:37.939Z
jekylczar,going to take a lunch nap,2024-02-06T17:22:10.149Z
ValuableFeisty1008,you now laugh at NVDA but look how it will 720$ this week lol,2024-02-06T17:24:39.402Z
usnavy_sailor,"Nvda tried to help everyone to give the dip you wanted.
  
    If you don’t load up that’s on you
  
    They said let’s help the poors and gave yall a window
  
    Take it",2024-02-06T17:29:11.369Z
gronaninjan,lol at the amount people buying NVIDIA calls now thinking it will V today. Moneys gone,2024-02-06T17:32:19.582Z
Brilliant-Throat-626,I wish I had money to buy NVDA but NVDA took my money,2024-02-06T17:32:26.171Z
Medical_Panda7638,Hmm.  Selling my NVDA calls at close yesterday and switching to puts actually worked for the first time ever.  I'm out before this shit blows up in my face.,2024-02-06T17:34:12.787Z
And0_Command0,Watch me catch this falling knife 🩸🩸,2024-02-06T17:34:35.251Z
Brilliant-Throat-626,"Whoever’s making the stocks go down, cut that shit out",2024-02-06T17:34:36.403Z
sykotrades,If nvda doesn’t v I’m moving to Brazil and leaving my wife and kids behind,2024-02-06T17:36:05.658Z
CrazyAznFob,"You know, it's not impossible for SPY to take a 3 dollar dip any time today",2024-02-06T17:37:36.783Z
Rebelcr7,I’m so good at trading I routinely buy dips before it dips,2024-02-06T17:41:33.723Z
No-Bee2669,LLY cucked me today,2024-02-06T17:43:07.571Z
phonglau1,!banbet NVDA $695 3D,2024-02-06T17:43:39.439Z
Beautiful-Raccoon221,Everyone do the fast challenge no eating only water till Nvidia reclaims 700+ again,2024-02-06T17:45:42.503Z
trainwreck001,"VANGUARD WENT AI TO RUN ITS FUNDS. SHIT JUST GOT REAL.
  
    NVDA $4K",2024-02-06T17:50:04.864Z
Basic_Door_7180,Just make a decision SPY.,2024-02-06T17:55:09.509Z
Elforas_Tero,NVDA is basically at the price it opened yesterday. Chill,2024-02-06T17:55:20.231Z
[deleted],Comment deleted by user,2024-02-06T17:55:34.021Z
deuce-deuce-pap,Spy picking out what dress to wear before it fucks you.,2024-02-06T17:55:48.857Z
ebfeebfe,"$NVDA $70 before $700
  
    The prophecy shall be fulfilled!",2024-02-06T17:55:54.384Z
QuarterTrader,Just had 2 really great trades time to blow the port,2024-02-06T18:02:29.333Z
mysuruhuduga,"Imagine buying nvda at an absolute top 712 🤡
  
    I sold around 705",2024-02-06T18:06:14.818Z
Elforas_Tero,"Market on V mode AGAIN

    It can't stay low for long",2024-02-06T18:06:50.489Z
Basic_Door_7180,going calls. Good luck everybody else,2024-02-06T18:09:02.277Z
numbersu,If you’re new here this means buy puts immediately,2024-02-06T18:09:22.808Z
lumpy-possum,If I win the lotto I'd buy lulu a brownstone in Harlem,2024-02-06T18:09:36.212Z
Elforas_Tero,By reading bers comment you'd think that at least SPY would be red,2024-02-06T18:10:13.372Z
TacticalTackleBox,Ugly as hell today,2024-02-06T18:13:01.000Z
skykitty89,NVDA at prices not seen since... February 5th. Oh.,2024-02-06T18:13:02.051Z
Not_An_NSA_Employee,when nvda inevitably closes that 630 gap im gonna make a lot of money,2024-02-06T18:18:19.890Z
--Right--Tackle--,What is the worst social media platform and why is it Reddit,2024-02-06T18:25:49.491Z
lumpy-possum,bears humming  can't take my eyes off of you by the four seasons as they look at their 100 dollar portfolio,2024-02-06T18:27:35.038Z
Altruistic-Sense-593,Bears be like how do I make a week worth of meals on a $10 budget,2024-02-06T18:28:34.974Z
AreProbablyWrong,"Some of y’all are like: I have a shitty diet, beat myself up, don’t hang out with friends, no therapist, don’t hang out with partner, don’t have hobbies, don’t workout, no pets, don’t sleep well, hate my job, invest without research, why am I sad",2024-02-06T18:31:42.018Z
Devocean77,"Don't you hate when your port sheds 5% one day and then gains 5% the next day, so it feels like you've evened out your losses, but the math doesn't math and you're still actually down.",2024-02-06T18:32:49.394Z
SleepiestGuyAlive,NVDA LETS FO,2024-02-06T18:39:35.368Z
RGR111,,2024-02-06T18:39:54.715Z
HornetsAreBad,"imagine not buying NVDA during the dip today bruh, lmao bears are hilarious",2024-02-06T18:42:30.150Z
Late_Significance547,O nooooooo…. My Nvda puts…. Don’t you go above 580,2024-02-06T18:57:43.506Z
BarnacleNo514,NVDA wants to taste $700 again,2024-02-06T18:58:36.194Z
TradingDegen,buying nvda dips is free money,2024-02-06T18:59:38.790Z
GirlScoutCookies93,Calls almost green cmonn NVDA,2024-02-06T18:59:43.787Z
Fine_Specialists,V time mother fucking ghey bears,2024-02-06T19:00:25.712Z
heycals,"Quick, someone say Ai",2024-02-06T19:11:14.041Z
fhsiao,"If SPY V back up to 494, I will be able to afford McDonald's tonight, Large Fries too.",2024-02-06T19:25:27.845Z
VisualMod,"Ban Bet Won
u/AncientRoller made a bet that NVDA would go to 676.69 within 3 hours when it was 666.35 and it did, congrats autist.
  
    Their record is now 6 wins and 11 losses
  
Join WSB Discord",2024-02-06T19:32:11.131Z
jekylczar,492.50 to 493.50 back and forth all fckin day,2024-02-06T19:38:47.173Z
distles,Nvda aboutta take the condom off,2024-02-06T19:49:06.314Z
SewerSlidalThot,SPY getting my hopes up for the 100th time today.,2024-02-06T19:58:23.709Z
__Slick_iG_,Who sold their nvda calls for a loss?,2024-02-06T20:00:29.521Z
ConcentrateOdd8190,NVDA is going to $800 minimum,2024-02-06T20:03:09.837Z
LongJohnBitcoin,!banbet nvda 690 1h,2024-02-06T20:04:48.383Z
hmoos2007,NVDA 700 EOD,2024-02-06T20:05:06.197Z
sdace2,Are my PLTR puts fuked,2024-02-06T20:07:05.311Z
I_knowwhat_I_am,"going all in on TSLA calls, because why not",2024-02-06T20:10:04.844Z
rdblaw,Should I hedge my NVDA calls with SPY calls?,2024-02-06T20:11:59.239Z
Diamondhands4dagainz,SMCI has pumped 7% ($45) in 2 hours. What the actual fuck,2024-02-06T20:18:43.833Z
igotthis_man,Nvdia wants to go green,2024-02-06T20:19:41.196Z
ziggs_ulted_japan,Nvda 700 isn't a meme today?!,2024-02-06T20:21:07.838Z
WebstersRedditLog,NVDA ain’t heard no bell!,2024-02-06T20:24:26.048Z
Not_An_NSA_Employee,"Quick keep buying NVDA calls!
  
    No don't open the chart, just buy!!!",2024-02-06T20:25:28.695Z
TheMysteriousBears,"If NVDA ever drops 10%, the US could collapse with it",2024-02-06T20:26:27.493Z
Consistent-Platypus3,"It's  almost like Nvidia rips for a day, takes a rest on the next, and does it all over again on the next day.",2024-02-06T20:28:20.464Z
SilverSoldier9,Generational dip in NVIDIA,2024-02-06T20:36:32.655Z
FriedBalamari,What do Chinese babies say? GooGoo $BABA,2024-02-06T20:39:08.619Z
latefrank,Need NVIDIA to have an absolute chad run into close,2024-02-06T20:39:56.271Z
lumpy-possum,I work at papa John's and have 500k saved,2024-02-06T20:43:45.927Z
ArchegosCapitalCEO,A massive red dildo on NVDA at 3:59 PM would melt this sub,2024-02-06T20:45:12.061Z
Diamondhands4dagainz,SMCI is a pure scam at this point lmao. Jk im just salty as fuck i didnt buy some at 626,2024-02-06T20:56:31.076Z
ConcentrateOdd8190,COCKS DOWN,2024-02-06T21:00:39.187Z
Luv_Sosa21,"Cool SPY, thanks for hitting 494 after Robinhood auto sold my calls for 2.5k in losses and blowing up my entire portfolio, you absolute fucking bastard",2024-02-06T21:00:52.558Z
BallsDropped,"Why did I only buy 1 fuckin SNAP put
  
    God FUCK ME HARD AND SIDEWAYS AND IN THE ASA",2024-02-06T21:13:58.930Z
Necessary-Bag-1042,"Bro I went 2 for 2, had $20 strike PLTR calls and $13 strike SNAP puts",2024-02-06T21:19:17.791Z
Treegonaut,Not touching any SNAP earning plays.  You always get fucked in the end.,2024-02-06T21:21:23.574Z
jay_philip762,Rip Toby Keith,2024-02-06T11:30:51.262Z
Overlord335786,"Ber celebrating SMCI is flat, rocket launch for today confirmed",2024-02-06T11:31:14.777Z
fightoraccept,Nvda is basically 2019 tsla,2024-02-06T11:51:33.449Z
housemouse431,fuckkkkkk eli lilly,2024-02-06T11:57:59.633Z
--Right--Tackle--,NVDA is underbought if it’s RSI is below 100,2024-02-06T12:08:31.281Z
KingKillrSheerWillr-,Nvidia to 730 today?,2024-02-06T12:09:32.902Z
jaypowwow,Only here can a stock be up 100 plus in a week. It drops 4$..it’s dumping,2024-02-06T12:31:11.914Z
TouchGround,Everyone trying to make free money on chip Stonks,2024-02-06T12:34:49.136Z
Jelly__Rogers,Have you guys heard of a small indie chip company called NVDA?,2024-02-06T12:35:50.365Z
Apprehensive_Bat_388,Every single post is about NVDA. It’s actually become the wall street bets meme stock…AGAIN. The top is in.,2024-02-06T12:40:19.578Z
Powerful_Mission_655,Tsla the new Automatic money destroyer?,2024-02-06T12:45:10.716Z
corticothalamicloops,take a look at how many super bowl ads mention AI. that’ll tell you how much we’re mirroring the dot com bubble,2024-02-06T12:51:15.023Z
corticothalamicloops,the wsb i know is dead. pltr up 17% and no comments about it,2024-02-06T12:52:36.621Z
Ready2gambleboomer,LLY calls gonna print!!,2024-02-06T12:52:50.127Z
