Author,Comment,Date
OneEyedBurp,bought panw calls at the top 🤡,2024-02-27T15:18:32.028Z
trainwreck001,"YALL KNOW SOUN GONNA OPEN $12+ TOMORROW RIGHT?
  
    SOUN $50",2024-02-27T15:19:13.805Z
ninja_mon,My NVDA weeklies are dead ☠️,2024-02-27T15:38:06.513Z
TheMeta40k,So this is what losing money feels like. I hate it.,2024-02-27T15:41:43.203Z
NVDAismygod,The $SOUN clowns are spamming the chat repeatedly. Driving me insane find a new stock to fomo into,2024-02-27T15:47:33.595Z
ziggs_ulted_japan,Mara is red lol wtf is this market today,2024-02-27T16:07:34.741Z
Vegetable_Routine572,All the hate on SOUN lets me know it's still got room to go up,2024-02-27T16:11:31.514Z
theknowndudereturns,watching paint dry is more interesting than SOUN,2024-02-27T16:17:34.255Z
ziggs_ulted_japan,And mara is back to pumping too. Going back to 30 in no time huh,2024-02-27T16:25:46.770Z
cow_grass,If I see spy irl I'm punching it on the nose.,2024-02-27T16:33:30.271Z
1800cheezit,Wait until people figure out that you can lose weight without having to take pharmaceuticals,2024-02-27T16:39:26.598Z
DatScruffDoe,SOUN and $7 seem magnetic,2024-02-27T16:39:35.384Z
End-Game-1999,A girl from the local Kindergarten is named Tesla. Cringe,2024-02-27T16:49:24.139Z
OGWFORLIFE,2 1/2 hours of my life wasted.,2024-02-27T16:56:37.659Z
StartingFrScratch,"The longer I hold, the more depressing it gets.",2024-02-27T16:58:09.488Z
Theipodrookie,DIE TSLA YOU POS,2024-02-27T17:35:32.982Z
kyledemo,"Spy dump
  
    this time it’s different",2024-02-27T17:38:26.112Z
i_simp_f,Please stop posting gay AI art,2024-02-27T17:38:28.381Z
Jmr15002,SPY below $505 before EOD?,2024-02-27T17:50:51.100Z
twostroke1,I love how the market doesn’t rally because NVDA doesn’t rally. Def not a bubble tho.,2024-02-27T17:51:56.358Z
zantamaduno,Every single play I made this week gonna go to zero. Can’t make this shit up,2024-02-27T17:57:22.312Z
Deesco5,Drill Team 6 inbound. Burn this sack of shit to the ground.,2024-02-27T18:01:52.370Z
ArchegosCapitalCEO,Imagine having profits and paying taxes,2024-02-27T18:02:31.560Z
31andnotdone,your little green candle doesn't scare me,2024-02-27T18:03:13.513Z
Deesco5,Honestly wish the market was only open the first and last hour of the day so I wouldn’t sit here watching fuck all happen as it trades sideways mid day.,2024-02-27T18:17:17.557Z
PutsOrCallsXD,DID ANYONE SEE THAT APPLE CANDLE JUST NOW?? WHAT IN THE FUCK WAS THAT,2024-02-27T19:00:38.031Z
trumpdiego,Swear to God this market is regarded,2024-02-27T19:01:01.484Z
CEOofBeanz,AAPL calls cumming rn,2024-02-27T19:34:50.448Z
[deleted],Comment deleted by user,2024-02-27T19:38:43.969Z
UndeadMonarch1,LET THE STOCK FUCKING DIE JESUS FUCKING CHRIST SMCI JUST FUCKING DIE,2024-02-27T19:50:42.208Z
Appropriate_Meat2715,Who’s shorting Bumble?,2024-02-27T20:04:12.125Z
BusGuilty6447,NVDA really theta right now.,2024-02-27T20:08:43.877Z
AssistantInformal797,Power hour,2024-02-27T20:10:45.761Z
labinskee,bout time everybody stopped spamming the chat with SMCI and NVDA. Feels like its been 4 months of that shit,2024-02-27T20:30:02.598Z
Individual_1ne,Imagine how hollow your brain would have to be to pay for social media account.,2024-02-27T20:30:21.192Z
im_astrid,I will cum if we close above 5080,2024-02-27T20:50:57.017Z
BigGain_Shrek,Bumble crumble,2024-02-27T20:52:31.334Z
DaRealElonMusk,SPY EOD pump,2024-02-27T20:56:45.141Z
Jeeperg84,BMBL just tickling my balls all day...just die bitch,2024-02-27T20:57:35.531Z
Sad_Location4000,All in bumble  puts 🖐️🤭,2024-02-27T20:58:16.167Z
Sad_Location4000,Time to watch bumble hit 10 🤓,2024-02-27T21:01:25.686Z
Powerful-Call5148,"BYND. Beyond Meat. I put in an order for CALLS at the close, and just got a call from my broker, apparently I SOLD CALLS in BYND, instead of buying them. I am ruined, and it is all over. By the time this is over, American Express will have a hit man out on me. I hope my shitty broker doesn't have a bunch of Biker Collection Agents, or it's time to flee the jurisdiction. Beyond Meat, Fucking Beyond Me how this happened...
  
    Wiped the fuck out in 2 secs.",2024-02-27T22:29:03.440Z
theredviper17,Anyone else loading up on CRWD?,2024-02-27T11:02:36.427Z
VisualMod,"Ban Bet Lost
u/GiantProcessor made a bet that LUNR would go to 20.0 within 1 day when it was 6.409 and it did not, so they were banned for a week.
  
    Their record is now 0 wins and 1 losses
  
Join WSB Discord",2024-02-27T11:05:59.663Z
xRICHxPIANAx,AAPL blows,2024-02-27T11:09:44.629Z
Strategy_,I’m tired of this bitch ass stock too. Good thing it’s shares. The moment I sell covered calls is the moment it moons I bet.,2024-02-27T11:11:34.682Z
MarcoPolooooo,Fomo is gonna be real today,2024-02-27T11:23:00.422Z
[deleted],Comment deleted by user,2024-02-27T11:27:08.159Z
lfhdbeuapdndjeo,The market doesn’t deal in facts,2024-02-27T11:27:34.020Z
Jeeperg84,"Morning, wake up to my SOUN ITM, and NVDA launching back…got my other orders ready to go…let’s riiiiddddeee!",2024-02-27T11:36:58.810Z
Serious-University36,Is Mara going for round 2 today?,2024-02-27T12:41:50.926Z
channndro,i have 50 $45 MARA calls 🫠🫠🫠,2024-02-27T12:42:15.398Z
[deleted],Comment removed by moderator,2024-02-27T12:44:30.434Z
Overlord335786,We really are a bunch of AI locusts aren’t we,2024-02-27T12:45:31.759Z
[deleted],Comment removed by moderator,2024-02-27T12:50:16.901Z
amoistsock,ber have been ded for long time,2024-02-27T12:54:59.486Z
KanarieWilfried,How high is MARA going to go today? Why didn't I buy more?,2024-02-27T12:58:05.192Z
PFC321,"SOUN one of those plays you could have retired off, but only bought $500 worth of 4c last week. And yes I'm talking about MYSELF",2024-02-27T12:59:01.108Z
rawdigga,"BTC noise is bringing a lot of new fomo $$$ in, love to see it.",2024-02-27T13:03:02.954Z
Wuzgoodbruv,MARA $35 EOD,2024-02-27T13:03:35.201Z
ziggs_ulted_japan,Smci -50 today,2024-02-27T13:04:39.615Z
animositisomina35,"Good morning to everyone, except for bers.",2024-02-27T13:09:26.596Z
NVDAismygod,RIP nvda,2024-02-27T13:18:39.978Z
warlock22041,SOUN $7c 1/2025 already in the money,2024-02-27T13:21:31.026Z
OakyTheBear,"My banbet record is 2 wins, 34 losses. You know why? because I banbet a lot. Remember that if you're new here, and you constantly see people saying things like ""SPY is going to 502 today,"" or ""NVDA is going to 800,"" they are likely wrong as often as I am. They just don't have the balls to risk not being able to shit post for 5 measly days.",2024-02-27T13:33:56.174Z
BagSelect,"Pump and dumpers are fucking garbage people
  
soun pumpers this means you",2024-02-27T13:39:20.976Z
Lolsmileyface13,"Nvidia stops its upward slog for three days.
  
    This sub unironically:
  
ARe We In a BeAr MaRkEt?",2024-02-27T13:48:56.581Z
Many-Mess3899,They really ran TSLA up $6 on no volume to fuck my puta,2024-02-27T13:54:12.827Z
Jelly__Rogers,Holy shit that $16k Zoom calls guy might actually be fucked,2024-02-27T13:55:25.996Z
trainwreck001,"Press Release: SoundHound AI to Report 2023 Fourth Quarter and Full Year Financial Results, Host Conference Call and Webcast on February 29, 2024
  
    NVDA $5K SOUN $50",2024-02-27T13:58:30.802Z
DanceDifficult8571,Regards see NVDA not pump $40 in a day and call it a joke. 🤡,2024-02-27T13:59:51.471Z
HUcast101,Why the fuck is U going back up? Garbage ass company,2024-02-27T14:02:42.070Z
Many-Mess3899,Everyone who told me to buy TSLA puts yesterday is regarded,2024-02-27T14:04:33.306Z
[deleted],Comment removed by moderator,2024-02-27T14:14:12.261Z
TheAngryShitter,Putting all my money into soun,2024-02-27T14:18:54.005Z
ediiisoon,"i went all in on tesla last week...
  

    seeing it pop days after my calls expired worthless is some painful shit
  

    my 192.5 calls expired worthless!!",2024-02-27T14:22:55.405Z
afuro-samurai,What the fuck unity,2024-02-27T14:22:56.787Z
Basedshark01,"Writhing in my larval sac like a hateful little grub, sharp little teeth bared in mindless hostility, waiting to inflict myself on the stock market.",2024-02-27T14:24:53.289Z
gtlgdp,Oh soundhound. Yet another stock I’m too late to buy,2024-02-27T14:25:39.337Z
Sharkkboy6,“Your TSLA puts have gained 20% since you’ve opened them”,2024-02-27T14:44:55.618Z
grimandnordic1,Dumped my SOUN calls at open. I'm way too chicken shit to play this one. I've been bagged too many times in the past and I just might have finally learned my lesson. Good luck to you regarded bastards still playing 🤘,2024-02-27T14:54:42.997Z
Ill-Passenger-1745,sold SOUN to buy back SOUN,2024-02-27T14:58:57.217Z
BoorsBazar,Buy some SOUN dickheads!,2024-02-27T15:00:45.429Z
ConcentrateOdd8190,"Consumer confidence is down, economy is fuk",2024-02-27T15:01:44.880Z
keyboardwarrior425,500+ IV on SOUN options no thank you!!,2024-02-27T15:02:03.086Z
kingpablo421,Lmao panw amazing,2024-02-27T15:03:49.129Z
Slight-Bid-2663,hope my bmbl puts print tonight,2024-02-27T15:06:58.313Z
Ok-Pomegranate-1641,CONSUMER CONFIDENCE WAS TERRIBLE JUST DIE ALREADY SPY,2024-02-27T15:08:27.894Z
sins-sloth7,Hold MARA calls ?,2024-02-27T15:08:51.534Z
EternalBeThyAss,What kind of economy needs consumers anyways??,2024-02-27T15:10:19.790Z
MarijuanaGrowGroup,If $SPY just hits $495 everything can go back to pumping again.,2024-02-27T15:11:17.088Z
TheMeals,great. MARAs dumping.,2024-02-27T15:11:30.519Z
WallStreetYakuza,Is 100 bagger when you’re holding 100 empty bags?,2024-02-27T15:15:27.155Z
krismasstercant,"I CANT DO THIS, I CANT TAKE THIS SHIT NO MORE MAN!",2024-02-27T15:17:13.076Z
WTFspy,"Apple CEO 2023 compensation: 63 million
  
    Reddit CEO 2023 compensation: 193 million",2024-02-27T15:20:27.470Z
MoneyManMakeItRain,"Done for the day, made my 10% ‼️",2024-02-27T15:21:40.586Z
ziggs_ulted_japan,Nvda is never red. Just buy calls anytime it goes below 790,2024-02-27T15:22:00.611Z
Striking_Olive_3580,Is soun going to get up to 8 today?,2024-02-27T15:29:44.965Z
localpizza_again,gonna need therapy after today,2024-02-27T15:38:39.215Z
TheAngryShitter,Soun climbing nice ans steady now.,2024-02-27T15:42:25.833Z
No-Basis8475,Bought SOUN calls 15 mins after open only to buy SOUN puts an hour later. A true degenerate regard I am,2024-02-27T15:44:52.045Z
MarcoPolooooo,Anyone else down bad today? I ducked up so bad,2024-02-27T15:53:19.647Z
[deleted],Comment deleted by user,2024-02-27T15:56:20.576Z
Due_Ad_379,"Every fucking day is a theta day. If you guys haven’t figured it out, spy only trades during after hours",2024-02-27T15:57:48.559Z
TanSuede,Lost $5k today when I said I was going to take a break. Smh,2024-02-27T16:00:04.108Z
legitpiano,If you were hoping to play MARA earnings now wouldn't be a bad time to re-enter,2024-02-27T16:00:40.228Z
HeiPando,Selling MARA on open was a wise choice.,2024-02-27T16:14:31.943Z
Ldjforlife,Pickleballers have completely taken over the tennis courts at my local park. To the point where tennis enjoyers have to wait until after dark to get the courts lol how can profit from this?,2024-02-27T16:18:34.406Z
DanceDifficult8571,Got greedy with Mara now I'm getting my anoos ripped,2024-02-27T16:19:28.553Z
DamnMyAPGoinCrazy,Good morning regards,2024-02-27T16:24:55.060Z
cow_grass,Can even get a decent half percent drop on spy. Being a bear sucks,2024-02-27T16:26:46.230Z
New_Possible_284,"Sold SOUN, better +$400 than nothing",2024-02-27T16:30:45.224Z
Klantenservice,Drill team six ready for an afternoon crash,2024-02-27T16:32:18.014Z
Puzzleheaded-Ice-144,for the dude who said coin calls ily. you saved my rent money,2024-02-27T16:32:52.729Z
Overlord335786,People really bought SOUN $11c at open,2024-02-27T16:34:04.925Z
Pikachumon25,SOUN green didlos when,2024-02-27T16:39:36.849Z
prettysureiminsane,I was holding SOUN bags for 2 fucking years!  Finally cut my losses last week and of course it booms.  Of fucking course.  I intend to revenge trade and short the fuck out of them after ER.,2024-02-27T16:40:37.922Z
Whitebrown22,Physically I'm vaping in the handicap stall at work. But mentally I'm way down yonder on the Chattahoochee,2024-02-27T16:41:34.723Z
Breaderson,MARA gang,2024-02-27T16:44:24.191Z
cow_grass,This SPY ponzi can't keep going any longer.,2024-02-27T16:44:42.040Z
mike_n301,Let’s bring back SPY 420,2024-02-27T16:50:26.989Z
Johnny_Menace,SOUN I’m just asking for $8 not $20 like those greedy 🐷,2024-02-27T16:52:01.906Z
dacalo,NVDA green?,2024-02-27T16:53:15.104Z
Middle_Peanut_4833,It’s so cool watching spy move up literally.05% and losing 20% put value. This low volume bs is KILLING me bruh,2024-02-27T16:53:38.323Z
SpermBanking,SPY nosedive incoming,2024-02-27T16:55:57.561Z
UndeadMonarch1,SMCI Bools are fucking degens,2024-02-27T16:57:19.649Z
Very_Regarded,lol I just sold my SMCI calls and they bounce 30% immediately,2024-02-27T16:58:53.570Z
Retrovex,Nothing burger of a day,2024-02-27T17:01:32.676Z
ModelloVirus,"Lmao, you know to stay away from a certain stock ($soun) when you see the shillers being desperate.",2024-02-27T17:06:43.884Z
HunterBidensdik,NVDA back to GREEN,2024-02-27T17:07:03.192Z
youngzoot,I am 100% positive my soun calls will be worthless come Friday,2024-02-27T17:08:57.373Z
Puzzleheaded-Ice-144,puts on unity 🌈,2024-02-27T17:09:07.496Z
Rugpull_Generator,Flat market enjoyers also drink white claw,2024-02-27T17:14:17.895Z
dreacks1013,Nvidia 900 March 22nd,2024-02-27T17:17:00.267Z
3rdWorldAutist,Mr market tear down this wall,2024-02-27T17:17:08.272Z
Gristle__McThornbody,West coast traders barely waking up. They about to dump the spy. Watch out.,2024-02-27T17:17:53.507Z
Top-Painting4667,Need bumble -25% AH pls,2024-02-27T17:26:01.430Z
OGWFORLIFE,Stock market is the only thing in life that truly makes me want to kms I swear to god I need to ban everything stocks from my life. Delete apps. Unfollow every trader and person into it I know. This shit does nothing but ruin lives and mental health.,2024-02-27T17:26:58.589Z
Many-Mess3899,If TSLA closes red today it will be worth less than it was at market open,2024-02-27T17:27:04.529Z
__Slick_iG_,The worlds slowest sell off,2024-02-27T17:27:51.307Z
HunterBidensdik,"Really disappointed Elon has cars, flamethrowers, online platforms, tunnels, and spaceships but hasn’t come out with a cologne.
  
    “Elon’s Musk”. It’s right there.",2024-02-27T17:35:24.618Z
Strategy_,GOOGL is actually a piece of shit,2024-02-27T17:35:57.958Z
blumpkinspatch,The idea that stocks could go down is insane to think about,2024-02-27T17:42:11.547Z
Leader4256,So today is a red day..,2024-02-27T17:53:23.797Z
AfricaTwin2022,Getting rich with you degens is something I wouldn’t have any other way,2024-02-27T18:01:40.327Z
Cold-Lettuce8991,Fake V,2024-02-27T18:04:34.233Z
No-Basis8475,I literally don’t know how but I listened to one of you regards say buy CVNA puts. I bought a 76p expiring 3/8. Sold it 4 minutes later for a $435 gain. Not much. But my first win,2024-02-27T18:09:08.057Z
AJDillonsThirdLeg,SPY did not like 504,2024-02-27T18:09:08.593Z
Interpersonal,SMCI needs to fucking drop. I bought these weeklies yesterday and they are GRINDING me down.,2024-02-27T18:16:25.781Z
Sparky_SE81,"Citi says S&P 500 not in a bubble, tells investors to 'buy pullbacks”
  
    When the crooks tell you to buy you need to be extremely defensive and fearful",2024-02-27T18:20:46.930Z
Shlewtz,"Paycheck $1800, checking account 69.42",2024-02-27T18:26:27.205Z
Successful_Wedding82,Join the National reGaurd 🇺🇸,2024-02-27T18:36:59.412Z
bullrfuk,The rest of the year will be theta. We may end the year at $500-510 range.,2024-02-27T18:37:54.188Z
Unitedtendies,Bmbl $9 ah,2024-02-27T18:39:48.825Z
SarcasticTrumpet,SPY being propped up just to fuck over puts,2024-02-27T18:44:38.544Z
at__at__,I was up over 100% earlier…got busy now I’m up 7%. I hate this game.,2024-02-27T18:48:04.857Z
humblepharmer,"Does Wendy's surge pricing extend to its behind-the-dumpster offerings?
  
    Asking for a friend of course",2024-02-27T18:53:10.532Z
AmbitiousElection724,buying power of 23$ What’s the play?,2024-02-27T18:55:02.339Z
donni3j3tt,NVDA Flat as my wife’s ass,2024-02-27T19:07:42.298Z
Ldjforlife,So all a company has to do is say AI and they moon shot. Totally not a bubble,2024-02-27T19:23:26.651Z
DoctorImperialism,"Tim Apple must have made a deal with the devil for that green leg, jesus christ",2024-02-27T19:28:32.298Z
Deesco5,"I will take these CVNA puts to my grave, do you hear me Shrek?! Do you hear me you green swampy ass bastard?",2024-02-27T19:34:45.033Z
FearlessTrader,"AAPL 1.31% up, average wsb’er: I’m I’m cooming in my pants rn 💦, AAPL shrek d*ck 🍆, AAPL taking us to tendie town
  
    Never change wsb, never 🤣🤣🤣",2024-02-27T19:37:16.951Z
Throwingdartsmouth,"Feeling like 2021 in here all of a sudden. When btc runs due to increased inflows, you know the good stocks are fully valued so people are looking for a momentum trade rather than a serious investment.",2024-02-27T19:37:42.217Z
Fun_Reporter9086,$AAPL said AI and the stock rallied to +1.2% from red lmao.,2024-02-27T19:42:12.924Z
BagSelect,Apple AI announcement is a clear reminder that mods are ultra 🌈,2024-02-27T20:04:10.195Z
JaJaJalisco,all in with the BMBL guy,2024-02-27T20:07:53.780Z
trumpdiego,The worst is when you leave a tab open with all your terrible bets inside it and come across it a day or two later to remind you what a dumbass you were.,2024-02-27T20:22:28.443Z
ElonTaxiDriver,PANW 400C 5/17 now is a good time to enter before this is back to pre earnings,2024-02-27T20:25:46.735Z
yolocallking,NVDA has added $1.5T in market value and AI's biggest use case is Will Smith eating pasta like a regard,2024-02-27T20:33:52.072Z
MikeMikeGaming,SPY FUCKING MOVE,2024-02-27T20:38:19.988Z
MassBroShops,This BMBL pump is very fake and very gey,2024-02-27T20:41:17.910Z
studybreak15,Doubled down on my BMBL puts,2024-02-27T20:45:44.230Z
WallStreetYakuza,This casino is cool because I can hit my dab rig in it,2024-02-27T20:46:42.329Z
DamnMyAPGoinCrazy,90% of this sub lost money today,2024-02-27T20:48:09.214Z
Modelminorityperson,GDP out tomorrow. To the moon,2024-02-27T20:52:44.312Z
trainwreck001,"NEVER BET AGAINST GOD AMERICA OR JENSEN.
  
    NVDA $5K SOUN $50",2024-02-27T20:55:40.400Z
Sad_Location4000,Everything get bumble puts? 🤛🤛,2024-02-27T21:00:12.994Z
ConcentrateOdd8190,COCKS DOWN !!!,2024-02-27T21:01:28.326Z
Jeeperg84,FUCK YOU DIE BMBL!!!,2024-02-27T21:38:46.068Z
CEOofBeanz,If I went all in on BYND calls it would’ve been like winning the powerball,2024-02-27T21:59:33.561Z
Junesathon,Ok ill be a nice guy so u dont need to guess what the hype is for today: SOUN MARA COIN MSTR PANW CLSK ARM,2024-02-27T11:03:40.256Z
CumOneCumAllCumInYou,SOUN 🚀🚀🚀🚀🚀🚀,2024-02-27T11:10:33.310Z
motherfuckerjones30,MARA and SOUN,2024-02-27T11:30:00.665Z
TheAngryShitter,SOUN!!!!!,2024-02-27T11:30:44.344Z
Hazmedic82,"SOUN, MU AND INTC BIGGGG GAINS TODAY LETS GOOOOO!!!!!!",2024-02-27T11:36:36.343Z
Cclown69,LUNR really did tip over like the lander  4.70,2024-02-27T11:37:07.392Z
Database-Greedy,BMBL Puts,2024-02-27T11:53:02.044Z
GoGoButters,Turn up the $SOUN,2024-02-27T12:07:52.573Z
Zachincool,Does anyone here still work remote or is it just me,2024-02-27T12:12:05.034Z
ADynes,Well my SOUN puts are fucked. Should have assumed there's at least another day of pump before the dump. Hopefully my SPY 509c will make up for it.,2024-02-27T12:24:47.132Z
Zachincool,Just downloaded SoundHound and played stairway to heaven by Led zeppelins on Spotify and SoundHound told me that stairway to heaven by Led Zeppelin was playing,2024-02-27T12:27:37.284Z
waitfor_ittt,Im gonna jab myself with 6 doses of Ozempic and YOLO LLY calls,2024-02-27T12:34:49.418Z
Im_A_MechanicalMan,"I got the IPO invite in a private message.  All I could think of when reading that was ""You are invited to lose your money with the reddit IPO""  What a high honor.",2024-02-27T12:45:49.280Z
[deleted],"BREAKFASThttps://ibb.co/6nT5SgD


    scramby eggs
  


    bacon
  


    Pace mild salsa
  


    Burrito with:
  


    scramby eggs
  


    mild cheddar
  


    Pace mild salsa
  


    Bacon
  


    Fried on both sides to melt the cheese and warm the salsa",2024-02-27T12:48:43.293Z
Star_Lord924,"clears throat Roses are red. Tendies are green, We know what we want, We know what we dream, So open the casino, So the regards can play, Please be generous, And have a wonderful day.",2024-02-27T12:58:23.126Z
North_Hearing_1241,Me buying one SOUN call just to make it tank,2024-02-27T12:59:52.892Z
Ok-Veterinarian-2333,Soun $20 eod,2024-02-27T13:01:19.697Z
ilikemapgames,is it regarded to sell my NVDA calls just so I can spend my money on some of the cool and exciting lottery ticket stocks today,2024-02-27T13:05:00.122Z
rmrd26,"So I was a NVDA bear until 2 weeks... shorted that shit from 570 and got fucked and sold at 730 at 20k loss. I decided not to use any logic, PE, RSI bullshit and everything and dumped the remaining 20K on SOUN when it was at 4 $ because NVDA invested in them 2 weeks back.. I think this is what I'm gonna do ..follow you wankers...just ride the green dildos to Valhalla...I have been a naughty bear and I won't be anymore... Mr. Gaybear or how I stopped losing money and learned to love the green dildos",2024-02-27T13:12:20.199Z
[deleted],Comment deleted by user,2024-02-27T13:13:22.442Z
MurkyAnteater4059,market not even openend and i already fucked myself,2024-02-27T13:14:30.031Z
Zachincool,Wait is soundhound a meme or not I’m confused,2024-02-27T13:17:43.519Z
BagSelect,It’s a pump and dump,2024-02-27T13:19:04.013Z
Ballsmeetpets,Durable goods leaked 👀,2024-02-27T13:17:54.293Z
jhoffman1844,SOUN gonna pump further or dump at open?,2024-02-27T13:21:38.991Z
Ok_Quote140,MARA Calls ?,2024-02-27T13:23:02.367Z
minrknju2p0,Tread carefully folks. Premarket is rigged af.,2024-02-27T13:33:02.930Z
trainwreck001,"SOUN RELEASING POSITIVE NEWS WITH NVDA AND STELLANTIS.
  
    SOUN $50",2024-02-27T13:34:07.049Z
corticothalamicloops,damn i really though nvda would continue with some momentum. this is disappointing,2024-02-27T13:36:09.251Z
Lonely_Magazine_1338,Sold my TSLA yday after bagholding for 2 months yall fcking welcome,2024-02-27T13:41:30.472Z
jnavv7,I have NVDA calls n TSLA puts,2024-02-27T13:43:02.221Z
Ceyenne18,I'm going to sell a ton of NVDA 800c just to cap your regards,2024-02-27T13:49:14.321Z
professor_chao5,"Google is going out of business. Don’t believe me? Google it, also there are tons of YouTube videos on the subject",2024-02-27T13:53:30.359Z
[deleted],Comment deleted by user,2024-02-27T13:55:25.382Z
twostroke1,"I paid $60k for this internet string of numbers. I can’t really do anything with it, but someone else may buy it for like $1mil someday just because. 

    Honestly sounds so fucking regarded when you put it like that.",2024-02-27T13:55:49.195Z
zacht0626,My unity $30.5p are fucked. Thought I finally had a good play. God.,2024-02-27T14:02:23.027Z
Peeeeech,Is PANW actually going up or is it just Nancy hype,2024-02-27T14:04:47.426Z
Star_Lord924,Thinking BMBL/SPCE puts today,2024-02-27T14:05:54.552Z
[deleted],Comment removed by moderator,2024-02-27T14:08:29.060Z
BlitzComet95,Is 100 shares of SOUN better than buying 10 of the 7C?,2024-02-27T14:10:48.539Z
naija123456,Need SMCI to drop abt $100 for my puts,2024-02-27T14:11:12.758Z
Justzyn_Jefferzyn,"Taxes are an illusion that Americans are funding the government. Theft, pure theft",2024-02-27T14:21:11.797Z
PoopholeLicker,U puts kinda teetering right now.,2024-02-27T14:21:31.521Z
Many-Mess3899,RIP to my fellow TSLA put holders,2024-02-27T14:22:55.750Z
icecoast44,I was introduced to sounding yesterday and I’m so confused,2024-02-27T14:27:57.365Z
Trading_View_Loss,"SHE DID IT AGAIN. FUCK ME. I almost bought Nancy's option yesterday but it was too expensive, woulda made an easy 20% overnight on the position GOD DAMN IT. SHES NEVER WRONG.",2024-02-27T14:30:21.016Z
FairSlip9692,HIMS CALLS NOT MOVING???,2024-02-27T14:33:14.387Z
[deleted],Comment removed by moderator,2024-02-27T14:41:07.324Z
AllTooWell31,Spy down 31 cents and bers saying the AI bubble is over,2024-02-27T14:44:43.574Z
ActInteresting1344,"LET SMCI DIE, JESUS CHRIST.",2024-02-27T14:46:29.950Z
No-Can-944,Lmao 10am V monsta,2024-02-27T14:47:23.329Z
Overlord335786,"Me: “It’s over…. and I needed a proper goodbye.”
  
Removes SMCI from the watchlist",2024-02-27T14:47:25.427Z
[deleted],Comment deleted by user,2024-02-27T14:47:58.837Z
31andnotdone,BER GANG LETS FOLLOW THROUGH TODAY ✊️,2024-02-27T14:49:07.227Z
Yokeyoyo,SOUN can’t be stopped,2024-02-27T15:00:16.575Z
UltimateStevenSeagal,"SOUN
  
    Obviously the market is hunting for another SMCI, I might as well go along with the ride",2024-02-27T15:02:01.260Z
Overlord335786,500 IV on SOUN options?,2024-02-27T15:02:32.169Z
MarijuanaGrowGroup,Lmao what a fucking miss. And we thought PPI and CPI were bad.,2024-02-27T15:04:30.662Z
RDDT_to_ZERO_ETF,when you meant to buy puts but bought calls instead. And the calls make money,2024-02-27T15:07:03.853Z
Immediate-Bison9929,Good thing I sold my SOUN at the bottom,2024-02-27T15:08:10.192Z
Snaggerotl,Mara just break thru plz,2024-02-27T15:08:11.390Z
daddys_juicy_dong,"CPI for February is going to be extremely hot.
  
    How do I know this? Carvana is offering me 10% more for my car vs 2 months ago.
  
    Slightly sarcastic but I’m convinced CPI is heating up again.  Plus I’ve learned to never doubt Carvana….",2024-02-27T15:13:17.544Z
sloanemonroe,"Man, they are really afraid of qqq being red and how that could actually cause a little correction. They just hold it up no matter what.",2024-02-27T15:13:52.095Z
