Author,Comment,Date
AllTooWell31,"If I sell my Palantir calls we’ll pump to $25, if I hold we’re consolidating all week around $18",2024-02-06T12:53:57.959Z
OSRSkarma,"Fade the PLTR jump
  
    Outstanding shares increasing 7% a year",2024-02-06T12:55:22.114Z
WhiteColllarCrime_69,I want whatever NVDA traders are on 🤡,2024-02-06T13:13:06.025Z
GoodGuyDrew,"Every night I go to bed with OTM NVDA and SMCI calls and every morning they go ITM at open. Today’s targets are NVDA 710 and SMCI 690.
  
    This is madness.",2024-02-06T13:16:11.229Z
LostandConfused2024,"I actually feel bad for the bears man.  They get their hopes up and then they get shafted.  But then again, after the markets done it to them for the 4th time in a row, you’d think they get the message",2024-02-06T13:19:22.570Z
Delicious-Hour-3117,"Today's strategy: see profit, take profit, then reenter.
  
    Rinse & repeat.",2024-02-06T13:24:05.850Z
selfemployedsince16,At some point hedgefunds are gonna sell nvda at 700-1000 let it crash down to 300 again and then buy it up after all the leveraged regards here lose their money. They will make a huge profit when they sell and huge profit as it rises. It's what they did with meta for example 300-95-460.,2024-02-06T13:26:11.650Z
GoodGuyDrew,"Why are all these tech companies doing layoffs? You think they’re having trouble with cash flows?
  
    Get outta here!
  
    These people are being replaced by AI.
  
    NVDA 750 EOW",2024-02-06T13:26:37.570Z
PorkChopExpress41,This is up there in the most bullish I’ve seen this sub.  Rug pull imminent,2024-02-06T13:33:22.831Z
Consistent-Platypus3,Who's making money today,2024-02-06T13:40:58.127Z
Individual_1ne,In Elons defense... soon those tesla shares he sold for Twitter will be just as worthless as twitter.,2024-02-06T13:50:15.857Z
FullCopy,NVDA bers are preparing to be ass blasted into outer space.,2024-02-06T14:00:16.557Z
WhiteColllarCrime_69,Bersss preppin’ dat ass,2024-02-06T14:02:45.983Z
Aggravating_Bad8428,SPY $495 0dte easy money,2024-02-06T14:08:34.064Z
kemar7856,Baba 🤌 free Jack ma,2024-02-06T14:09:09.149Z
joe0228,pltr is raging in pre,2024-02-06T14:10:07.304Z
SubstantialAffect835,Sweet baby Jesus!  LLY looking good.,2024-02-06T14:10:21.931Z
Anxious_Stop8618,If you don’t have calls you might as well call your therapist today; we will rip hard,2024-02-06T14:12:31.434Z
burneraccount1819,"Damn fucking Toby Keith RIP, Courtesy of the Red, White and Blue will forever be goated 😭😭",2024-02-06T14:14:11.738Z
HereComesThe_Squeeze,Don’t like how much NVDA dropped pre market. Time to cash in the calls,2024-02-06T14:18:21.565Z
MaximusDecimus78,Kinda feels like everything gonna dump at open,2024-02-06T14:23:09.134Z
SleepiestGuyAlive,Idk I hope I LLY doesn’t drop at open lol,2024-02-06T14:24:43.785Z
MurkyAnteater4059,"dear nvda bears, please remember to buy as many otm puts as possible today, and don't forget to double and triple down on your short positions. Thank you",2024-02-06T14:27:01.221Z
Gemini_Of_Wallstreet,TSLA GET YO ASS TO 170 RIGHT NOW,2024-02-06T14:27:54.948Z
mmaisumm,Nvda 800 eod,2024-02-06T14:34:31.385Z
patelchief90,Premiums for nvda are crazy. I’m poor can’t play,2024-02-06T14:39:38.973Z
