Author,Comment,Date
TheNotoriousNIL,buying SMCI at open is must,2024-02-11T20:37:08.416Z
rigatoni-man,"DAMN SMCI
  

    BACK AT IT AGAIN WITH THE WHITE VANS",2024-02-09T19:28:53.624Z
OneworldcurrencyJSS,I use to think btfd meant bite the freaking dust,2024-02-07T20:49:50.408Z
salcido982,2025 17C Leaps on $SNAP ?,2024-02-07T20:01:45.567Z
goldenloi,For what though,2024-02-07T15:14:43.739Z
mdoo_Ad_6450,My problem I am bear,2024-02-07T14:12:10.002Z
WSBrookie,Fuuuuuuck. Okay I’m going to work now. God damnit.,2024-02-07T13:11:37.928Z
lame_mirror,"lol, SNAP down mega.",2024-02-07T04:23:07.687Z
jaypowwow,"Enjoy the day boys, life’s short.  I have a dad dying of cancer still and I wake up every day wondering if today’s that day.  I have more money than I can spend. Very blessed but none of that means shit. It’s not even an object. Life is the true gift. Enjoy it and tell someone ya love them today.",2024-02-06T12:56:36.692Z
Myceliummmm,"Man, when NVDA does finally dip it’s going to be a billion messages of “imagine buying the top after pumping 40% in a month”",2024-02-06T13:42:22.526Z
dweeegs,I’ve got it already copied to my clipboard don’t u worry,2024-02-06T13:43:08.977Z
housemouse431,"90% of wsb has never seen NVDA red premarket.
  
    dont worry, this is what normal stocks do everyday
  
    lmao",2024-02-06T11:37:37.547Z
DarkEvE,I may have just turned 8k into 6 figures in 3 trading days,2024-02-06T12:11:56.008Z
Luv_Sosa21,"As someone who has done this before, take the fucking profits before you blow up your account and hate yourself for a year",2024-02-06T12:13:00.821Z
spikemydrink,Looks like nvda bottom may be in. Selling my puts and then switching to calls. I play both sides so I can lose twice.,2024-02-06T18:18:41.289Z
pm-me-nice-pics,"Slept like shit 

    But anyway now i can watch meaningless numbers on a computer screen",2024-02-06T11:02:10.796Z
DetroitRedWings79,I just realized we’re a bunch of regards playing red light green light and Jerome Powell is the one barking the commands,2024-02-06T11:59:59.203Z
Eastern-Cranberry84,dude the number of people freaking out cuz NVDA was down 1% earlier was hilarious. IF NVDA ever dumps hard it's going to be an exciting day.,2024-02-06T12:37:31.138Z
KingKillrSheerWillr-,“The company beat revenue by 2 billion so we are increasing our price target $494 billion” -Goldman cuks,2024-02-06T12:38:52.943Z
OSRSkarma,"Did you see that little $10 drop on Nvidia yesterday at like 3:10 for it to immediately recover and go higher
  
    I tried buying weekly puts, lost 25% in 20mins…. Had to take the loss
  
    Staying in my lane and not getting my ass gapped again by that POS",2024-02-06T12:50:05.248Z
Droidvoid,We don’t need 100 play by play announcers on NVDA y’all. Please limit yourself on the spam,2024-02-06T13:10:17.402Z
DiligentBuy9074,NVDA gives us +40% in a month and for two hours pulls back 2% and everyone is losing it,2024-02-06T16:14:29.602Z
wildcat1055,"Just buy NVDA calls they said.
  
    All regards are getting rich they said.
  
    Where's the rent money, the landlord said.",2024-02-06T16:48:06.164Z
indiebryan,Good thing I sold all my NVDA at $186 a couple years ago 🧠,2024-02-06T17:05:55.661Z
stock_dude9,Not even joking 1 minute after i bought semi calls at 11:34 was the exact moment everything fell off a cliff evaporating 40% of my investment in 25 mins,2024-02-06T17:07:19.730Z
stopbanningme6969,"Finally cracked 6 figures… my 3 year chart is down $100,000",2024-02-06T17:53:35.717Z
lumpy-possum,"when im banned tomorrow,  remember me as i am now, full of white hot rage",2024-02-06T18:21:10.844Z
Porcoddio45,So the PLTR regards of 2020 were actually right lol,2024-02-06T13:06:15.831Z
willsucksagan,Looks like I’ve been turned into a long term NVDA investor. Long term being 2 days instead of 1,2024-02-06T15:59:45.012Z
jinr0,My drug dealer asked me how to invest in NVDA today,2024-02-06T11:07:33.967Z
heizenbergbb,Bears will never forget the 10 minutes NVDA was red in premarket.,2024-02-06T12:01:12.943Z
UnholyTrigon,"Yesterday, NVDA bears celebrated Nvidia being up only 2% in the morning",2024-02-06T12:07:34.308Z
Only-11780-Votes,"Elon sitting on his couch right now smoking a bowl of methamphetamine, scratching his neck about those Tesla shares… He just can’t forget about it… He can’t forget that he sold so much stock to buy Twitter and then he was forced to buy Twitter after he wanted to back out because his methamphetamines speaking out loud… Puts on Tesla",2024-02-06T13:36:26.992Z
Opposite_Engine_6776,"It’s about at that level where we start to see people quitting their jobs “to trade full time” and shit.
  
    A whole new generation of bull market investing geniuses has been spawned.",2024-02-06T13:38:04.837Z
YeOldeGazette,This is such an unhealthy addiction. I have a problem.,2024-02-06T13:49:27.794Z
AceKrieg,How’s my NVDA echo chamber doing this morning?,2024-02-06T13:51:42.445Z
deuce-deuce-pap,Rotation out of Nvda into Homeless camp by the highway.,2024-02-06T18:15:17.066Z
[deleted],Where my NVDA bros at? You held strong and I love you guys!,2024-02-06T20:07:20.725Z
pm-me-nice-pics,A single day 4% drop in NVDA is enough to cause a new global financial crisis,2024-02-06T11:18:10.739Z
Rubiscon95,LLY,2024-02-06T12:19:55.113Z
mathboom123,When will we have a separate thread for NVDA pumping?,2024-02-06T13:56:18.264Z
Soybeanrice,"if you want any idea of how my day is going, i dropped 12k on NVDA 2/9 700c's this morning 🤡",2024-02-06T18:15:39.980Z
NVDAismygod,Crazy I was up 11K and now I’m down $100,2024-02-06T15:56:34.813Z
ediiisoon,there's no way nvidia doesn't recover.. who tf is selling the most valuable asset in the world?????????,2024-02-06T17:07:47.155Z
Its_Stir_Friday,"Dear Mr Market,
  
    Please moon.
  
    Sincerely, Call Holder",2024-02-06T17:52:18.405Z
[deleted],Comment deleted by user,2024-02-06T17:59:22.651Z
kawkface,NVIDIA BABY PLEASE JUST TELL ME WHAT I DID WRONGGGGGGGG,2024-02-06T18:00:24.255Z
Jelly__Rogers,"When the fuck did fries and a fountain drink become more expensive than the burger?
  
    Lol I'll just buy 2 burgers and drink water at the house.",2024-02-06T18:18:16.171Z
Fluffy_Ad_7734,260K on snap 13$ 2/9 puts my life savings will sky inshallah,2024-02-06T18:51:40.049Z
SnooChickens1183,If you didn’t buy nvidia on the dip,2024-02-06T19:34:09.325Z
FairSlip9692,NVDA get the fuck back up,2024-02-06T20:34:08.037Z
poggersSpongebob,How do I tell my gf I blew our vacation money on palantir $20 puts,2024-02-06T21:24:25.881Z
twostroke1,"Born too late to go to war in the Middle East.
  
    Born too early to go to war in the Middle East.
  
    Born just in time to go to war in the Middle East.",2024-02-06T15:48:03.171Z
Ahueh,"Ok idiot bulls I'm one of you again, LETS GO NVDA",2024-02-06T17:38:08.885Z
FarLog4503,Last time NVDA was down -3%. It went up +14%,2024-02-06T17:51:39.864Z
[deleted],Comment deleted by user,2024-02-06T17:56:12.626Z
SleepiestGuyAlive,Yep NVDA going green,2024-02-06T19:32:41.556Z
LongJohnBitcoin,If Nvda goes green it will create much fomo,2024-02-06T20:21:54.382Z
totalwaraster,Premarket sell off means generational buying opportunity on $NVDA don’t miss the flight to the moon,2024-02-06T11:35:57.260Z
rcp_5,Anyone else fomo-ing into NVDA 1000c??,2024-02-06T13:06:14.334Z
doctorqaz,We finally gonna see SPY 500 today?,2024-02-06T14:15:58.207Z
WYLD_STALYNZ,"RIP Toby Keith. Stomach cancer is a real bitch, the survival rate is horrible because you typically don't find it until you're already fucked",2024-02-06T14:25:46.711Z
Then_Profession8020,NVDA is going to rise and who ever sold will cry,2024-02-06T14:41:50.404Z
Codyskank,This is fucking crazy I’ve made about 10 wrong plays in a row,2024-02-06T14:45:41.358Z
trainwreck001,"FAKE NVDA DUMP. SPY AND QQQ GREEN AF.
  
    LOADING NVDA $1,300 CALLS
  
    NVDA $4K",2024-02-06T14:48:39.022Z
Ancient-Talk2430,Meh imma just hold and hope for a V 😭,2024-02-06T15:25:28.526Z
angrybubblez,"Up 14% on my NVDIA puts today 

    Still down 84%",2024-02-06T16:04:57.828Z
ConcentrateOdd8190,NVDA being red should be declared as a national emergency and short selling should be banned effective immediately.,2024-02-06T16:14:59.573Z
SleepiestGuyAlive,NVDA go to 685 and I’ll finger my anoos with instant coffee,2024-02-06T16:37:45.292Z
conflicted_humanist,The sell off in Nvidia tells me we will definitely hit $800 very soon. Pullbacks are healthy. Things are working as planned.,2024-02-06T16:44:40.669Z
[deleted],"(At my boss’s funeral kneeling and whispering at the coffin):
  
    “Who’s thinking outside the box now, Gary?”",2024-02-06T16:58:08.504Z
WSBrookie,NVDA rallies back to $710 EOD,2024-02-06T17:22:56.789Z
MyTaco,"if you didnt buy the NVDA dip, you might be eligible for a handicap parking permit",2024-02-06T17:40:25.604Z
LooneyCube0,SMCI is gonna make me broke I’m gonna cry why is it red it’s the end of the world,2024-02-06T17:55:00.261Z
wifi_god69,Port is up 17% thanks to PLTR. Warren Buffett gonna be calling me for stock advice soon,2024-02-06T18:40:51.567Z
sskillit,imagine nvda ends today green that would be so crazy wouldn’t it haha,2024-02-06T18:55:56.905Z
SleepiestGuyAlive,Think the NVDA bottom is in,2024-02-06T19:23:35.427Z
GirlScoutCookies93,NVDA calls printing as always,2024-02-06T19:33:22.239Z
EnginrA,NVDA 700 EOD,2024-02-06T19:50:37.116Z
Limp_Plastic8400,lly to the moooon,2024-02-06T12:02:17.820Z
31andnotdone,"crippling anxiety and major depressive episode kinda day, LFG",2024-02-06T13:10:41.518Z
Far-Appeal-2350,NVDA green eod,2024-02-06T14:46:15.872Z
NVDAismygod,I miss easy mode,2024-02-06T16:22:08.501Z
Duelistgodx,I finally decided to buy NVDA - im the reason for the crash,2024-02-06T16:38:19.220Z
Cold-Lettuce8991,Nvda will be at 700 by eow,2024-02-06T17:49:14.526Z
Sandvicheater,"For those of you wondering why NVDA is tanking today is because I bought yesterday, I'm sorry.",2024-02-06T17:49:29.915Z
[deleted],Comment deleted by user,2024-02-06T17:51:05.114Z
kylestoned,"this may be fucking stupid, but with the surge in immigration to the United States, calls on Western Union.",2024-02-06T17:55:52.358Z
Ill-Help7820,I make $20 on green days and lose $4000 on red days,2024-02-06T18:03:15.385Z
Droidvoid,"Some of y’all be treating your full time job as a part time gig after making $300 in the market for the day. Talking shit like “pshh they better appreciate me, or imma quit”.",2024-02-06T18:23:09.141Z
may344,Need nvda to get back to 680 and build there. Not liking it below 670,2024-02-06T18:32:00.201Z
winner_in_life,"Don't sweat small stuff. Hold Nvidia, SMCI calls and trust the process.",2024-02-06T19:23:27.223Z
FarLog4503,NVDA 685 plz,2024-02-06T19:23:50.117Z
distles,Nvda are the only options I’ve ever seen gain value when the price drops lol,2024-02-06T19:59:26.385Z
Overlord335786,"Listen- I buy AI stocks so when the AI revolution happens they will know I have always supported them, and they will spare me from their machine wrath",2024-02-06T20:09:54.181Z
mtmodi,Somehow from down 1500 to up 200. Thank you nvda,2024-02-06T20:10:31.790Z
tropicalia84,"Imagine not buying that NVDA dip at the lows today, what are you even doing on this sub?",2024-02-06T20:27:26.143Z
landhwere,Saw my ex. She got chunky. Buying LLY calls here.,2024-02-06T20:42:01.053Z
Porcoddio45,NVDA 720 tomorrow,2024-02-06T21:00:51.025Z
TheMysteriousBears,Guy thats holding 60k in tesla calls expiring Friday must be crying his ass off rn,2024-02-06T11:53:44.385Z
Practical_Guidance90,Bruh why they had to pan over to the dudes face when I was busting ruined my morning I wanna see the actress not your facial expressions. Anyway buying everything nvda,2024-02-06T12:05:53.894Z
Far-Appeal-2350,"LLY up 5% pre market, 800 eod!!!",2024-02-06T12:15:04.162Z
BFox1982,Remember when it was a big deal to have a Trillion dollar market cap? Soon your local butcher that only processes their Uncle Chet's grass fed black Angus is gonna be a trillion dollar business.,2024-02-06T12:54:45.416Z
SecretSquritle,There’s no way NVDA doesn’t fall to $650 before March… it’s going to $800 but brother has been an absolute piss rocket since 2022,2024-02-06T14:18:54.784Z
BarelyCoherent45,"Buys SMCI at 90. Stock doesn’t budge for 9 months. Sells at 110 thinking there are more active stocks.  SMCI jumps to 675 and I miss out on all of it. Buys call for 3/1 700 at end of day yesterday., goes red immediately this morning.",2024-02-06T14:40:12.633Z
AcceptableOptimism,1 thing I've learned about WSB: All Bulls and Bears have absolutely no clue what is going on,2024-02-06T16:11:54.947Z
CheapHero91,Who bought smci and NVIDIA at ATH?,2024-02-06T17:57:10.053Z
TrainingAct8074,I up 120k last month from 6k and I just lost 130k in these two days,2024-02-06T18:11:43.443Z
SubstantialAffect835,Anyone else buy that NVDA dip?,2024-02-06T18:58:38.298Z
totalwaraster,"NVDA today is the correction. Tomorrow, the moon",2024-02-06T19:23:00.625Z
swisscakeman,No doubt tomorrow is a green day,2024-02-06T19:23:08.734Z
SleepiestGuyAlive,NVDA the one stock that always Vs right now. Always,2024-02-06T19:26:07.457Z
HarlaWaide,The daily afternoon NVDA rally has arrived.,2024-02-06T19:46:25.034Z
Far-Appeal-2350,Last day NVDA less then $700,2024-02-06T19:49:50.338Z
vjbk1,"If I buy NVDA 700C it stalls for the rest of the week, if I don't it opens at 720 tommorow",2024-02-06T20:25:39.761Z
CuriousEd0,Theta killeed me today. Down 1.3k smh,2024-02-06T20:37:21.276Z
__Slick_iG_,Market makers are really trying to shake people out of Nvidia before the run to 800 this week,2024-02-06T20:40:05.547Z
SavingsGas4933,banbet! NDVA 750$ 1d,2024-02-06T12:07:08.587Z
Far-Appeal-2350,LLY crushed eps,2024-02-06T12:09:25.071Z
[deleted],Comment deleted by user,2024-02-06T12:20:12.549Z
Overlord335786,Ber was excited as a PREMARKET red on NVDA LMAO,2024-02-06T12:26:41.028Z
anonkraken,"I’m gonna sacrifice myself and sell these AMD calls down 40%.
  
    Everyone else hold. This thing will be at $200 by EOD.",2024-02-06T12:34:30.865Z
rm0277,Gonna have to dust off the ol NVDA 700 hat,2024-02-06T13:06:20.580Z
Overlord335786,"NVDA back over 700, Ber shocked that his 5:30 AM thesis was flawed and WRONG",2024-02-06T13:10:45.613Z
[deleted],Comment deleted by user,2024-02-06T13:11:33.105Z
Far-Appeal-2350,NVDA and LLY go to $800,2024-02-06T13:39:54.048Z
UnholyTrigon,Perma bear u/semigonnadump has been buying Nvidia puts for 3 months now,2024-02-06T14:05:14.999Z
abused-throwawayy,My life would be so much better if i was just gay instead of a gay bear :(,2024-02-06T14:11:31.085Z
dkrich,NVDA is crashing which means it’s only up $5,2024-02-06T14:12:06.621Z
pain474,Damn the IV for SPOT options was massive. People will get destroyed at open.,2024-02-06T14:24:14.769Z
trainwreck001,"DO YOU EVEN PLAY THE  NVDA V BRUH? 

    NVDA $4K",2024-02-06T15:21:26.363Z
MarcoPolooooo,"Tesla up and nvda down, today must be Opposite Day lmao",2024-02-06T15:54:17.283Z
happybearforlyfe,Yo is this comment showing up? Upvote if you can see it,2024-02-06T16:00:05.386Z
Tricky-Elk397,NVDA 700 EOD,2024-02-06T16:08:57.750Z
losekiloaskme,"Calls on sale. Calls on sale...
  
    Get your NVDA Weekly calls on sale!!!!",2024-02-06T16:17:12.217Z
may344,Couldn't let nvda open at 712 u fuks,2024-02-06T16:34:22.888Z
keyboardwarrior425,Have stayed away from NVDA calls for weeks but when I finally decide it’s the right time to buy it’s fucks me in my anoos,2024-02-06T16:50:26.228Z
dieselinmyveins,I swear whenever there is slight turbulence this place turns into a paper handed morgue,2024-02-06T16:53:05.227Z
Bulls2Broke,10% of WSB wiped over a 3% move LMFAO,2024-02-06T16:55:36.337Z
Albuscarolus,NVDA AT LEVELS NOT SEEN SINCE FEBRUARY 5TH,2024-02-06T17:01:38.899Z
Dongkey_kong,NVDA best bag holder - cost basis of 709.50.,2024-02-06T17:22:34.054Z
twostroke1,I should have probably not shit on my boss’s desk before buying those NVDA calls yesterday.,2024-02-06T17:34:20.196Z
kempog,Anyone that was crazy enough to have bought NVDA puts yesterday kinda rich today,2024-02-06T17:36:12.412Z
calculussmash,Mods pls ban the mcdonalds guy,2024-02-06T17:38:02.601Z
No-Bee2669,NVDA dumped so it can refuel and pass 710 by eow,2024-02-06T17:42:03.131Z
twostroke1,"LLY today is basically you winning a hand of blackjack at the casino but the pit boss found you counting cards, took you into the back room, and fed you his big cock meat sammich.",2024-02-06T17:47:43.008Z
Sweaty_Cereal,"Down 52% on NVDA calls, Im doing just fine",2024-02-06T18:01:55.764Z
largerdaily,Going out for a bike ride. Get NVDA to green while I'm out please.,2024-02-06T19:14:46.730Z
iAmGrimTV,"SMCI and NVDA keep telling the market: ""Wanna see something cool?""",2024-02-06T19:32:23.610Z
InternationalTop2410,"Delinquencies skyrocketing and surpassing pre-Covid levels
  
    Fuck that !!!! NVDA 3T 📈📈📈",2024-02-06T20:11:50.880Z
BLOW_0,TESLA BEARS DESERVE TESLA 300 EOM,2024-02-06T20:14:24.855Z
duubz_,I need NVDA to close below 685 or I have to kiss some guy's gonads that I promised earlier,2024-02-06T20:18:16.179Z
GoodGuyDrew,"The shook the tree real fucking hard today. I’m proud of all you degens that stuck it out with me.
  
    💎🖐️",2024-02-06T20:24:27.184Z
Porcoddio45,We should rename the sub to NVDAstreetbets.,2024-02-06T20:26:54.662Z
Porcoddio45,Let me guess: NVDA 695 tomorrow PM and 720 trading hours.,2024-02-06T20:54:36.400Z
InitiativeBeginning,Bulls who think snap will be 20 tomorrow,2024-02-06T21:14:14.057Z
[deleted],"I know some people here rolled their PLTR gains into SNAP for some back to back parabolic gains
  
    Rest in peace pour souls",2024-02-06T21:19:23.372Z
PremiumGrade,Lly Call gang where y’all at?,2024-02-06T11:07:50.582Z
DiligentBuy9074,This is the biggest NVDA dip in a month. Buy,2024-02-06T11:27:45.209Z
AyumiHikaru,"Be patient
  
    TSLA shit under $100 is coming",2024-02-06T11:29:17.079Z
GroundbreakingCan655,NVDA 730 EOD cmon bulls,2024-02-06T11:56:05.101Z
LostandConfused2024,Spy barely even fell and bears are up and at it. Like bro as if this won’t go straight to 495 in a couple hours,2024-02-06T11:58:16.264Z
22strokestreet,"Over the past 100 trading sessions, NVDA’s high has been greater than its open 99% of the time with an average return of 1.56% from open to high. Do with that info what you will.",2024-02-06T12:06:08.253Z
lipmanz,RIP Toby Keith 🥾,2024-02-06T12:15:55.495Z
KingKillrSheerWillr-,"you could earn over 4% on bonds a year, or you could hold Nvidia and earn 4% a minute",2024-02-06T12:17:59.611Z
GinGer_Gypsi96,My LLY calls might be the best thing I've done in 2024🤓,2024-02-06T12:35:24.917Z
WhiteColllarCrime_69,"I miss trading options so naturally I’m liquidating $10k of my stable portfolio $ so I can get back the game.
  LFG!!!!! 🚀📈💰",2024-02-06T13:15:19.178Z
[deleted],I’ve got lly spot and pltr I might let them all run,2024-02-06T13:19:59.981Z
UnholyTrigon,"Bears were celebrating NVDA price 2 hours ago, where are they now ?",2024-02-06T13:20:27.518Z
nicktro12,I’m in calls but I think we are pulling back today,2024-02-06T13:27:05.795Z
trainwreck001,Pull on DEEZ NUTS,2024-02-06T13:27:34.564Z
JewJesus96,Raise the rates,2024-02-06T13:27:21.645Z
VacationLover1,"There has to be a few people in here who don’t have NVDA Calls… and as soon as those holdouts jump in…
  
    Loooooook ouuuuuut beeeellllloooooooooow",2024-02-06T13:28:35.697Z
3rdWorldAutist,PLTR absolutely rallying,2024-02-06T13:40:16.076Z
J_da_CPA,Let’s get PLTR to $30,2024-02-06T14:06:00.654Z
twostroke1,"I can’t wait for the near future when AI calls you a fat fuck, you put on your Apple goggles to escape reality in the metaverse, and then a little needle feeds you LLY weight loss drugs.",2024-02-06T14:20:48.445Z
SnortinDietOnlyNow,Toby knew all along that freedom wasn't free and it did in fact cost a Buck O' Five. American markets will moon today in honor of him.,2024-02-06T14:24:20.150Z
RagingBearBull,"Today seems to be one of those days where people keep posting about high credit card debts, increase in homelessness and etc.
  
    The solution is sooo simple. Just be a hot girl or rich.
  
    Im aiming to be a hot girl since that seems easier than becoming rich.
  
    The issue is im a fat dude, to loosing wieght is step one.",2024-02-06T14:47:00.693Z
DMZem,"haha PLTR pumping, finally about to offload my bags.",2024-02-06T14:50:46.281Z
GhostEagle12,NVDA will retest $700 by EOD. Too many regards full ported puts and paper hand call buyers are being shook out.,2024-02-06T14:55:43.530Z
TiittySprinkles,Y'all act like you haven't seen NVDA dip and recover from this before,2024-02-06T15:07:06.410Z
Illustrious_Elk_4849,"I have seen too many Vs to not sell my puts here, done for the day",2024-02-06T15:10:23.982Z
WombatSana,Two months of profits all erased now 🥲 yay,2024-02-06T15:10:24.671Z
jekylczar,broke my own rule and traded before 10:15 and boy did I get my ass handed to me,2024-02-06T15:10:39.054Z
TurtleHeadingFeces,Fuck this fucking shit. I held off on adding more to my NVIDIA port and decided to today and suddenly the dumping begins before fucking earnings. I'm going to break something man   FUCK,2024-02-06T15:13:05.739Z
Then_Profession8020,Hold hold hold NVDA or you’ll cry 😭,2024-02-06T15:20:49.511Z
[deleted],"If NVDA goes under $660,  I might have to get a job!",2024-02-06T15:44:16.317Z
Puzzleheaded-Leek993,So u mfs just gave up on the 700 dream,2024-02-06T15:48:51.992Z
iBoughtAtTheBottom,Calls right now would be stupidly genius,2024-02-06T16:01:00.335Z
MurkyAnteater4059,how many of you here actually trade off of chart patterns,2024-02-06T16:03:37.672Z
main-char,think my robinhood is broken. red can't be the only color,2024-02-06T16:06:08.768Z
Ancient-Talk2430,"I WAS PROMISED GREEN DILDOS, HELLO IS THIS THE MANAGER OF NYSE? YES ID LIKE TO FILE A COMPLAINT",2024-02-06T16:06:34.299Z
bhutams,Saw a post on TikTok this morning where a girl was talking about her 4.2 shares of nvidia. Current top has to be in,2024-02-06T16:23:55.592Z
Apprehensive-Tea3932,doubled down on the nvidia calls discount,2024-02-06T16:24:15.048Z
PHX_adri,Im balls deep in Nvidia and SMCI calls,2024-02-06T16:39:21.609Z
Its_Stir_Friday,This is about to be the nastiest bear trap in history.,2024-02-06T17:01:45.379Z
mba111,One of the hardest parts of trading 0-5dte options is knowing when to take profits and when to let the winners ride,2024-02-06T17:06:57.054Z
Sharkkboy6,NVDA Bulls show nudes,2024-02-06T17:07:54.453Z
MarcusDaLongis,Buls bought NVDA at 711,2024-02-06T17:14:55.746Z
FullCopy,"I bought NVDA calls at open this morning. Here’s my story:
  
https://www.nbcnews.com/news/us-news/73-year-old-arizona-man-dies-parachute-fails-fully-deploy-skydiving-ju-rcna137431",2024-02-06T17:39:20.163Z
ValuableFeisty1008,"bought more NVDA calls.
  
    Now go V'ing my baby",2024-02-06T17:41:38.859Z
Porcoddio45,Those who sold NVDA at 665 will buy at 765.,2024-02-06T17:44:42.115Z
Sparky_SE81,NVDA fomo baby bulls 🐮 born at 700 in utter shambles,2024-02-06T17:51:40.377Z
Altruistic_Ad1407,I made 3k last week on Tuesday and proceeded to lose 10k over the past week. FML,2024-02-06T17:57:30.431Z
OhCanVT,4 pm close is not a meme,2024-02-06T17:58:59.229Z
twostroke1,"“-2% isn’t a crash.” 

    “Ok guys, -12% is just a correction.” 

    “alright, -40% can’t go much lower.” 

    “yes sir, I’ll suck your peen right here behind this dumpster.” 

    That’s how they get ya.",2024-02-06T18:05:02.075Z
gronaninjan,Ig NVIDIA has it's first non V day in hundred days it might actually be over,2024-02-06T18:15:24.493Z
iano_,"Theta... I will find you, and I will fuck you!!!!",2024-02-06T18:19:29.709Z
Reasonable_Mud_3470,"Hey dumbasses, don’t forget to close your options contracts or set a stop/loss when you get sick and forget to check them. Message from a sickly loser, yours truly.",2024-02-06T18:21:00.398Z
OSRSkarma,"The nvidia weekly puts i got stopped out of yesterday for -25% are now up 100% from when i bought them
  
    I am straight punching air right now
  
    I HATE IT HERE",2024-02-06T18:25:10.294Z
PFC321,This is more fun when the lines go up,2024-02-06T18:31:51.139Z
Green-Mirror430,NVDA 🚀,2024-02-06T18:35:13.942Z
whitewashedsyrian,Nvidia ending green,2024-02-06T18:38:57.779Z
thep3nis,hope you bears blow whatever is left of your account,2024-02-06T18:54:59.836Z
ziggs_ulted_japan,If nvda closes above 675 I'll be so happy,2024-02-06T18:57:19.602Z
6l80destroyer,Tesla bears are a new breed of moron 🧸,2024-02-06T19:48:20.952Z
im_mocking_youmoron,Nvda and Smci MMs “hmmmm how can we make more money off these idiots?” “Oh! We can drop it to get people to sell their calls for a loss and get the dumb bears to waste their money on high premium puts”,2024-02-06T19:48:31.405Z
No-Bee2669,NVDA will be at 700 tomorrow,2024-02-06T19:51:27.361Z
Future_Hyena2562,Gonna go take the dogs for a walk.  Hoping I come back to see NVDA in the green,2024-02-06T20:06:39.618Z
igotthis_man,My nvdia calls in profit now,2024-02-06T20:08:16.566Z
Only-11780-Votes,PLTR is only up 33% today,2024-02-06T20:09:14.712Z
TheMysteriousBears,That NVDA dip was the last dip before we moon to 800,2024-02-06T20:17:56.729Z
SnooMacaroons5271,NVDA did exactly what they wanted it to do today… kill off a shit load of 2/9 calls and now back to business as usual.,2024-02-06T20:22:37.840Z
BlitzComet95,There were people in here that panic sold NVDA weeklies that were 80% down. COULD NEVER BE ME,2024-02-06T20:24:40.280Z
Rebelcr7,The next 30 mins will be the last chance in your lifetime to buy nvda sub $700,2024-02-06T20:38:03.003Z
