Author,Comment,Date
baadllama_ghost,"We are going to skyrocket green at open, i can feel it",2024-02-20T13:21:30.243Z
salmonussy,Watching the sunrise with coffee,2024-02-20T13:40:36.657Z
civillyRange,"China is facing deflation/real estate collapse and is holding back on stimulus measures as analysts reeeee about stock prices
  
    US is deficit spending in the trillions to keep the party going with 3% GDP and unemployment at decade lows while analysts cream their pants with PT upgrades
  
    2 bold strategies Cotton, lets see if they pay off",2024-02-20T13:59:39.847Z
gopoohgo,SMCI back in the red.,2024-02-20T14:14:05.145Z
StockMarketDavid,"LUNR 🚀🎉🥳 Literally to the moon
  
    And hopefully SMCI down to 750 and under today 💪
  
    Let's all make money 🥰🥳",2024-02-20T14:17:43.184Z
tendeeznuts,Super Micro Cock Inc sub $700 today,2024-02-20T14:22:14.139Z
Frozen_Shades,🎵You bought real high and now you want to die SMCI SMCI🎵,2024-02-20T14:22:36.791Z
Coldchips44,Literally shaking and trembling I need to gamble,2024-02-20T14:27:14.777Z
Very_Regarded,God robinhood is so shitty at open,2024-02-20T14:33:02.304Z
heycals,,2024-02-20T14:42:57.312Z
CasualPersistence,"If you liked NVDA at $740, you're gonna love it at $640",2024-02-20T14:45:42.741Z
gargle_deez,UPDATE: SELLING SMCI PUTS WAS DEFINITELY NOT FREE MONEY,2024-02-20T14:45:51.708Z
positively_kenormous,Kung fu panda 4 will save us from recession,2024-02-20T14:46:34.680Z
Bulls2Broke,We need a circus breaker not a circuit breaker,2024-02-20T14:47:11.563Z
TurbulentAd2553,Picked up a bunch of calls on the dip 😎,2024-02-20T14:47:31.697Z
DrummerCompetitive20,Nvda tanking the whole market,2024-02-20T14:53:02.759Z
Waitforsquirtle,"“Mr Jensen, I don’t feel so good.” 2-23-24750C before the snap.",2024-02-20T14:53:03.055Z
heycals,Tech ded. We'll be playing with sticks by EOW,2024-02-20T14:53:11.517Z
ComprehensivePaint48,Anybody going to catch that NVDA falling knife?,2024-02-20T14:53:13.082Z
CasualPersistence,"The neighbor's dog got out and ran through our yard earlier. I was able to catch him and when the neighbor came to pick up the dog, he asked me if I'd heard of NVDA or SMCI.
  
    Anyway, top is in.",2024-02-20T14:53:30.231Z
aqjingson,Literally the whole market hinges on nvda,2024-02-20T14:59:59.900Z
Rebelcr7,My $1000 Nvidia 23rd calls appear to have surprisingly lost some value,2024-02-20T15:01:40.320Z
Overlord335786,SMCI 650ish EOD,2024-02-20T15:03:31.315Z
Laurensio_,NVDA bulls really thought it would go higher lmaoooooo,2024-02-20T15:03:44.003Z
LegalConsequence7960,Not buying till they sticky the hotline number,2024-02-20T15:04:14.064Z
DueHousing,Bulls catching so many knives they can be a cutco salesman,2024-02-20T15:04:46.808Z
monochrome_f3ar,Took my profits and sold everything.  Good luck to everyone still ballsy enough to trade today.,2024-02-20T15:06:02.532Z
salmonussy,I trust in the V,2024-02-20T15:06:39.991Z
andytobbles,"Parties over bears, sell pressures off. Here comes the V you idiots were in a bull market and here comes the stampede",2024-02-20T15:07:43.633Z
MrFisher_,Currently doing professional mental gymnastics in order to justify not selling my calls this morning,2024-02-20T15:07:57.216Z
Jabbermouth,Anyone else straight up not having a good time?,2024-02-20T15:08:04.280Z
stuffandthings16,Is that 1100  call SCMI guy alive?,2024-02-20T15:10:35.311Z
DueHousing,NVDA just keep poopin and shiddin,2024-02-20T15:11:01.188Z
cryptohorn,Nvidia titanic 🎻🎻,2024-02-20T15:12:16.183Z
Jazzlike_Farmer_636,RIP mofo’s that bought calls today 💀🪦,2024-02-20T15:13:14.528Z
DueHousing,Super Micro Cucks and Nviditards competing to see whose the bigger bag holder,2024-02-20T15:14:46.452Z
DueHousing,SMCI and Nvidia racing for 500,2024-02-20T15:18:50.193Z
ninja_mon,Getting out of SMCI 1200c 2/23 on Friday at $700 loss was such a blessing lol… 💀,2024-02-20T15:19:05.198Z
End-Game-1999,You're an addict if you don't know what the company you're trading does,2024-02-20T15:19:30.908Z
Jabbermouth,Green dildos incoming,2024-02-20T15:19:54.149Z
Jabbermouth,"I entered QQQ 0DTE about 30 mins ago 

    I was down 30% and kept averaging down

    Now I have 9k in QQQ calls expiring today 😂
  
    This is so fucked",2024-02-20T15:21:17.232Z
LongHealth,BREAKING: Bulls seen stealing ropes and ladders from self checkouts. Puts on retailers.,2024-02-20T15:21:45.288Z
bshehebebehh,Lunr,2024-02-20T15:31:36.691Z
Eximietate,Brings me great joy to see SMCI and NVDA bulls get slaughtered today,2024-02-20T15:32:23.459Z
[deleted],Just as I predicted 🤌,2024-02-20T15:33:03.359Z
